2024,Neurocomputing,"Training and meta-training an ensemble of binary neural networks with quantum computing.",Daivid Leal; Israel F. Araujo; Adenilton J. da Silva,https://doi.org/10.1016/j.neucom.2023.127169,null,J,no_arxiv,0
2024,Neurocomputing,"Quantum variational distance-based centroid classifier.",Nicolas M. de Oliveira; Daniel K. Park; Israel F. Araujo; Adenilton J. da Silva,https://doi.org/10.1016/j.neucom.2024.127356,null,J,no_arxiv,0
2025,IEEE TCAD,"Linear Decomposition of Approximate Multicontrolled Single Qubit Gates.",Jefferson D. S. Silva; Thiago Melo D. Azevedo; Israel F. Araujo; Adenilton J. da Silva,https://doi.org/10.1109/TCAD.2024.3471905,null,J,no_arxiv,0
2024,IEEE TCAD,"Low-Rank Quantum State Preparation.",Israel F. Araujo; Carsten Blank; Ismael C. S. Araujo; Adenilton J. da Silva,https://doi.org/10.1109/TCAD.2023.3297972,null,J,no_arxiv,0
2024,IEEE TCAD,"Circuit Decomposition of Multicontrolled Special Unitary Single-Qubit Gates.",Rafaella Vale; Thiago Melo D. Azevedo; Ismael C. S. Araujo; Israel F. Araujo; Adenilton J. da Silva,https://doi.org/10.1109/TCAD.2023.3327102,null,J,no_arxiv,0
2021,IEEE Trans. Computers,"Circuit-Based Quantum Random Access Memory for Classical Data With Continuous Amplitudes.",Tiago Mendonça Lucena de Veras; Ismael C. S. de Araujo; Daniel K. Park; Adenilton J. da Silva,https://doi.org/10.1109/TC.2020.3037932,null,J,no_arxiv,0
