2018,Expert Systems Appl.,"A fuzzy hybrid integrated framework for portfolio optimization in private banking.",Luciano Ferreira; Denis Borenstein; Marcelo Brutti Righi; Adiel Teixeira de Almeida Filho,https://doi.org/10.1016/j.eswa.2017.09.055,null,J,no_arxiv,5
2018,Expert Systems Appl.,"A new PROMETHEE-based approach applied within a framework for conflict analysis in Evidence Theory integrating three conflict measures.",Lucimário Gois de Oliveira Silva; Adiel Teixeira de Almeida Filho,https://doi.org/10.1016/j.eswa.2018.07.002,null,J,no_arxiv,4
2016,Inf. Sciences,"A multicriteria approach for analysis of conflicts in evidence theory.",Lucimário Gois de Oliveira Silva; Adiel Teixeira de Almeida Filho,https://doi.org/10.1016/j.ins.2016.01.080,null,J,no_arxiv,18
2019,JORS,"Debtor level collection operations using Bayesian dynamic programming.",Mee Chi So; Christophe Mues; Adiel Teixeira de Almeida Filho; Lyn C. Thomas,https://doi.org/10.1080/01605682.2018.1506557,null,J,no_arxiv,0
2018,EJOR,"Preference modeling experiments with surrogate weighting procedures for the PROMETHEE method.",Adiel Teixeira de Almeida Filho; Thárcylla R. N. Clemente; Danielle Costa Morais; Adiel Teixeira de Almeida,https://doi.org/10.1016/j.ejor.2017.08.006,null,J,no_arxiv,12
2016,EJOR,"A new method for elicitation of criteria weights in additive models: Flexible and interactive tradeoff.",Adiel Teixeira de Almeida; Jonatas Araujo de Almeida; Ana Paula Cabral Seixas Costa; Adiel Teixeira de Almeida Filho,https://doi.org/10.1016/j.ejor.2015.08.058,null,J,no_arxiv,49
