2024,Soft Computing,"Assessing the interactions amongst index tracking model formulations and genetic algorithm approaches with different rebalancing strategies.",Thiago Wanderley De Amorim; Julio Cezar Soares Silva; Adiel Teixeira de Almeida Filho,https://doi.org/10.1007/s00500-023-09185-7,null,J,no_arxiv,0
2023,Applied Soft Comput.,"An analytical tool to support public policies and isolation barriers against SARS-CoV-2 based on mobility patterns and socio-economic aspects.",Julio Cezar Soares Silva; Diogo Ferreira de Lima Silva; Nivan Roberto Ferreira Júnior; Adiel Teixeira de Almeida Filho,https://doi.org/10.1016/j.asoc.2023.110177,null,J,no_arxiv,0
2023,Applied Soft Comput.,"Using GAN-generated market simulations to guide genetic algorithms in index tracking optimization.",Julio Cezar Soares Silva; Adiel Teixeira de Almeida Filho,https://doi.org/10.1016/j.asoc.2023.110587,null,J,no_arxiv,0
2023,Expert Systems Appl.,"Preference disaggregation on TOPSIS for sorting applied to an economic freedom assessment.",Diogo Ferreira de Lima Silva; Luciano Ferreira; Adiel Teixeira de Almeida Filho,https://doi.org/10.1016/j.eswa.2022.119341,null,J,no_arxiv,0
2021,Expert Systems Appl.,"Auto loan fraud detection using dominance-based rough set approach versus machine learning methods.",Jerzy Blaszczynski; Adiel Teixeira de Almeida Filho; Anna Matuszyk; Marcin Szelag; Roman Slowinski,https://doi.org/10.1016/j.eswa.2020.113740,null,J,no_arxiv,0
2020,Expert Systems Appl.,"A new preference disaggregation TOPSIS approach applied to sort corporate bonds based on financial statements and expert's assessment.",Diogo Ferreira de Lima Silva; Luciano Ferreira; Adiel Teixeira de Almeida Filho,https://doi.org/10.1016/j.eswa.2020.113369,null,J,no_arxiv,0
2024,ITOR,"An enhanced GRASP approach for the index tracking problem.",Julio Cezar Soares Silva; Diogo Ferreira de Lima Silva; Adiel Teixeira de Almeida Filho,https://doi.org/10.1111/itor.13163,null,J,no_arxiv,0
2021,JORS,"Financial modelling with multiple criteria decision making: A systematic literature review.",Adiel Teixeira de Almeida Filho; Diogo Ferreira de Lima Silva; Luciano Ferreira,https://doi.org/10.1080/01605682.2020.1772021,null,J,no_arxiv,0
