2022,Expert Systems Appl.,"Multi-Armed Bandits in Recommendation Systems: A survey of the state-of-the-art and future directions.",Nícollas Silva; Heitor Werneck; Thiago Silva; Adriano C. M. Pereira; Leonardo Rocha 0001,https://doi.org/10.1016/j.eswa.2022.116669,null,J,no_arxiv,0
2021,Expert Systems Appl.,"Effective and diverse POI recommendations through complementary diversification models.",Heitor Werneck; Rodrigo Santos; Nícollas Silva; Adriano C. M. Pereira; Fernando Mourão; Leonardo Rocha 0001,https://doi.org/10.1016/j.eswa.2021.114775,null,J,no_arxiv,0
2020,Inf. Sciences,"A comparative study of machine translation for multilingual sentence-level sentiment analysis.",Matheus Araújo 0001; Adriano C. M. Pereira; Fabrício Benevenuto,https://doi.org/10.1016/j.ins.2019.10.031,null,J,no_arxiv,0
2022,Inf. Systems,"A reproducible POI recommendation framework: Works mapping and benchmark evaluation.",Heitor Werneck; Nícollas Silva; Adriano C. M. Pereira; Matheus Carvalho Viana; Alejandro Bellogín; Jorge Martínez Gil; Fernando Mourão; Leonardo Rocha 0001,https://doi.org/10.1016/j.is.2022.102019,null,J,no_arxiv,0
2021,Inf. Systems,"Points of Interest recommendations: Methods, evaluation, and future directions.",Heitor Werneck; Nícollas Silva; Matheus Carvalho Viana; Adriano C. M. Pereira; Fernando Mourão; Leonardo Rocha 0001,https://doi.org/10.1016/j.is.2021.101789,null,J,no_arxiv,0
2023,SIGIR,"Exploring Scenarios of Uncertainty about the Users' Preferences in Interactive Recommendation Systems.",Nícollas Silva; Thiago Silva; Henrique Hott; Yan Ribeiro; Adriano C. M. Pereira; Leonardo Rocha 0001,https://doi.org/10.1145/3539618.3591684,top,C,no_arxiv,0
2022,SIGIR,"iRec: An Interactive Recommendation Framework.",Thiago Silva; Nícollas Silva; Heitor Werneck; Carlos Mito; Adriano C. M. Pereira; Leonardo Rocha 0001,https://doi.org/10.1145/3477495.3531754,top,C,no_arxiv,0
