2019,Knowledge-Based Syst.,": A semantic indexing scheme for structured, unstructured, and partly structured data.",Joe Tekli; Richard Chbeir; Agma J. M. Traina; Caetano Traina Jr.,https://doi.org/10.1016/j.knosys.2018.11.010,null,J,no_arxiv,0
2022,Inf. Systems,"Establishing trajectories of moving objects without identities: The intricacies of cell tracking and a solution.",Mirela T. Cazzolato; Agma J. M. Traina; Klemens Böhm,https://doi.org/10.1016/j.is.2021.101955,null,J,no_arxiv,0
2019,Inf. Systems,"Querying on large and complex databases by content: Challenges on variety and veracity regarding real applications.",Agma J. M. Traina; Safia Brinis; Glauco Vitor Pedrosa; Letricia P. S. Avalhais; Caetano Traina Jr.,https://doi.org/10.1016/j.is.2019.03.012,null,J,no_arxiv,0
2018,Data & Knowl. Eng.,"The Merkurion approach for similarity searching optimization in Database Management Systems.",Marcos V. N. Bedo; Daniel S. Kaster; Agma J. M. Traina; Caetano Traina Jr.,https://doi.org/10.1016/j.datak.2017.09.003,null,J,no_arxiv,0
2018,Data & Knowl. Eng.,"Full-fledged semantic indexing and querying model designed for seamless integration in legacy RDBMS.",Joe Tekli; Richard Chbeir; Agma J. M. Traina; Caetano Traina; Kokou Yétongnon; Carlos Raymundo Ibañez; Marc Al Assad; Christian Kallas,https://doi.org/10.1016/j.datak.2018.07.007,null,J,no_arxiv,0
2018,CIKM,"Efficient and Reliable Estimation of Cell Positions.",Mirela T. Cazzolato; Agma J. M. Traina; Klemens Böhm,https://doi.org/10.1145/3269206.3271734,null,C,no_arxiv,0
2018,PRL,"How to speed up outliers removal in image matching.",Jonathan S. Ramos; Carolina Yukari Veludo Watanabe; Caetano Traina; Agma J. M. Traina,https://doi.org/10.1016/j.patrec.2017.08.010,null,J,no_arxiv,0
