2021,Future Generation CS,"Computational resource and cost prediction service for scientific workflows in federated clouds.",Michel J. F. Rosa; Célia Ghedini Ralha; Maristela Holanda; Aleteia P. F. Araujo,https://doi.org/10.1016/j.future.2021.07.030,null,J,no_arxiv,0
2019,Future Generation CS,"Multiagent system for dynamic resource provisioning in cloud computing platforms.",Célia Ghedini Ralha; Aldo H. D. Mendes; Luiz A. Laranjeira; Aletéia P. F. Araújo; Alba C. M. A. Melo,https://doi.org/10.1016/j.future.2018.09.050,null,J,no_arxiv,0
2021,IEEE BIBM,"Resource Prediction Service for Efficient Execution of Bioinformatics Workflows in Federated Cloud with Machine Learning.",Matheus Sobrinho; Michel Rosa; Waldeyr Silva; Aletéia Patrícia Favacho de Araújo,https://doi.org/10.1109/BIBM52615.2021.9669152,null,C,no_arxiv,0
2018,IEEE BIBM,"Cost and Time Prediction for Efficient Execution of Bioinformatics Workflows in Federated Cloud.",Michel J. F. Rosa; Aleteia P. F. Araujo; Felipe L. S. Mendes,http://doi.ieeecomputersociety.org/10.1109/BIBM.2018.8621199,null,C,no_arxiv,0
2021,Trans. GIS,"A proposal to minimize the cost of processing big geospatial data in public cloud providers.",João Bachiega Jr.; Maristela Holanda; Aleteia P. F. Araujo,https://doi.org/10.1111/tgis.12754,null,J,no_arxiv,0
2020,CCGrid,"Performance Comparison of Terraform and Cloudify as Multicloud Orchestrators.",Leonardo Rebouças de Carvalho; Aletéia Patrícia Favacho de Araújo,https://doi.org/10.1109/CCGrid49817.2020.00-55,null,C,no_arxiv,0
