2022,Applied Soft Comput.,"Regularization-free multicriteria optimization of polymer viscoelasticity model.",Francisco José Monaco; Roman Denysiuk; Alexandre Cláudio Botazzo Delbem; António Gaspar-Cunha,https://doi.org/10.1016/j.asoc.2022.109040,null,J,no_arxiv,0
2019,Expert Systems Appl.,"Neuroevolution for solving multiobjective knapsack problems.",Roman Denysiuk; António Gaspar-Cunha; Alexandre C. B. Delbem,https://doi.org/10.1016/j.eswa.2018.09.004,null,J,no_arxiv,0
2018,Applied Soft Comput.,"Characterization of runtime resource usage from analysis of binary executable programs.",René S. Pinto; Alexandre Cláudio Botazzo Delbem; Francisco José Monaco,https://doi.org/10.1016/j.asoc.2017.12.040,null,J,no_arxiv,0
2017,Expert Systems Appl.,"Optimization based on phylogram analysis.",Antonio Soares; Ricardo A. L. Rabêlo; Alexandre C. B. Delbem,https://doi.org/10.1016/j.eswa.2017.02.012,null,J,no_arxiv,0
2020,SPE,"Optimizing computational resource management for the scientific gateways ecosystems based on the service-oriented paradigm.",Edvard Martins de Oliveira; Júlio Cezar Estrella; Alexandre Cláudio Botazzo Delbem; Mario Henrique de Souza Pardo; Fausto Guzzo da Costa; Alexandre Defelicibus; Stephan Reiff-Marganiec,https://doi.org/10.1002/spe.2808,null,J,no_arxiv,0
2017,SPE,"Multi-criteria IoT resource discovery: a comparative analysis.",Luiz Henrique Nunes; Júlio Cezar Estrella; Charith Perera; Stephan Reiff-Marganiec; Alexandre Cláudio Botazzo Delbem,https://doi.org/10.1002/spe.2469,null,J,no_arxiv,0
