2017,Concurrency and Computation,"Autotuning CUDA compiler parameters for heterogeneous applications using the OpenTuner framework.",Pedro Bruel; Marcos Amaris; Alfredo Goldman,https://doi.org/10.1002/cpe.3973,null,J,no_arxiv,3
2017,Concurrency and Computation,"Computer architecture and high performance computing.",Alfredo Goldman; Luciana Arantes; Edward Moreno,https://doi.org/10.1002/cpe.4348,null,J,no_arxiv,1
2015,HiPC,"A Simple BSP-based Model to Predict Execution Time in GPU Applications.",Marcos Amaris; Daniel Cordeiro; Alfredo Goldman; Raphael Y. de Camargo,https://doi.org/10.1109/HiPC.2015.34,null,C,no_arxiv,4
2019,CCGrid,"Autotuning Under Tight Budget Constraints: A Transparent Design of Experiments Approach.",Pedro Bruel; Steven Quinito Masnada; Brice Videau; Arnaud Legrand; Jean-Marc Vincent; Alfredo Goldman,https://doi.org/10.1109/CCGRID.2019.00026,null,C,no_arxiv,0
2014,J. Network Computer App.,"A comprehensive view of Hadoop research - A systematic literature review.",Ivanilton Polato; Reginaldo Ré; Alfredo Goldman; Fabio Kon,https://doi.org/10.1016/j.jnca.2014.07.022,null,J,no_arxiv,46
2019,IST,"A model of requirements engineering in software startups.",Jorge Melegati; Alfredo Goldman; Fabio Kon; Xiaofeng Wang 0001,https://doi.org/10.1016/j.infsof.2019.02.001,null,J,no_arxiv,1
2015,EMSE,"Fostering effective inter-team knowledge sharing in agile software development.",Viviane A. Santos; Alfredo Goldman; Cleidson R. B. de Souza,https://doi.org/10.1007/s10664-014-9307-y,null,J,no_arxiv,21
