2013,Applied Soft Comput.,"Obtaining the threat model for e-mail phishing.",Cleber K. Olivo; Altair Olivo Santin; Luiz S. Oliveira,https://doi.org/10.1016/j.asoc.2011.06.016,null,J,no_arxiv,8
2014,IEEE TPDS,"A (UCON) Resilient Authorization Evaluation for Cloud Computing.",Arlindo Luis Marcon Jr.; Altair Olivo Santin; Maicon Stihler; Juliana Bachtold,https://doi.org/10.1109/TPDS.2013.113,top,J,no_arxiv,4
2018,CCGrid,"A Machine Learning Auditing Model for Detection of Multi-Tenancy Issues Within Tenant Domain.",Cleverton Vicentini; Altair Olivo Santin; Eduardo Viegas; Vilmar Abreu,https://doi.org/10.1109/CCGRID.2018.00081,top,C,no_arxiv,0
2017,Computer Networks,"Toward a reliable anomaly-based intrusion detection in real-world environments.",Eduardo Viegas; Altair Olivo Santin; Luiz S. Oliveira,https://doi.org/10.1016/j.comnet.2017.08.013,null,J,no_arxiv,5
2015,Computer Networks,"Method for testing the fault tolerance of MapReduce frameworks.",João Eugenio Marynowski; Altair Olivo Santin; Andrey Ricardo Pimentel,https://doi.org/10.1016/j.comnet.2015.04.009,null,J,no_arxiv,7
2018,Computers & Security,"A reliable and energy-efficient classifier combination scheme for intrusion detection in embedded systems.",Eduardo Viegas; Altair Olivo Santin; Luiz Oliveira; Andre Luiz Pereira de Franca; Ricardo P. Jasinski; Volnei A. Pedroni,https://doi.org/10.1016/j.cose.2018.05.014,null,J,no_arxiv,0
2013,IEEE Security & Privacy,"Mitigating XML Injection 0-Day Attacks through Strategy-Based Detection Systems.",Thiago Mattos Rosa; Altair Olivo Santin; Andreia Malucelli,https://doi.org/10.1109/MSP.2012.83,null,J,no_arxiv,10
