2019,Neurocomputing,"Control strategies for Hopf bifurcation in a chaotic associative memory.",André K. O. Tiba; Aluizio F. R. Araújo,https://doi.org/10.1016/j.neucom.2018.09.078,null,J,no_arxiv,0
2019,Neural Networks,"A neural network architecture for learning word-referent associations in multiple contexts.",Hansenclever F. Bassani; Aluizio F. R. Araújo,https://doi.org/10.1016/j.neunet.2019.05.017,null,J,no_arxiv,0
2018,GECCO,"MOEA/D with uniformly randomly adaptive weights.",Lucas R. C. de Farias; Pedro H. M. Braga; Hansenclever de F. Bassani; Aluizio F. R. Araújo,https://doi.org/10.1145/3205455.3205648,null,C,no_arxiv,1
2015,Neurocomputing,"Hopf Bifurcation in a Chaotic Associative Memory.",André K. O. Tiba; Aluizio F. R. Araújo; Marcos N. Rabelo,https://doi.org/10.1016/j.neucom.2014.11.013,null,J,no_arxiv,5
2015,IEEE Trans. Neural Netw. Learn. Syst.,"Dimension Selective Self-Organizing Maps With Time-Varying Structure for Subspace and Projected Clustering.",Hansenclever de F. Bassani; Aluizio F. R. Araújo,https://doi.org/10.1109/TNNLS.2014.2315571,top,J,no_arxiv,4
2015,IEEE Trans. Neural Netw. Learn. Syst.,"Self-Organizing Map With Time-Varying Structure to Plan and Control Artificial Locomotion.",Aluizio F. R. Araújo; Orivaldo V. Santana,https://doi.org/10.1109/TNNLS.2014.2345662,top,J,no_arxiv,1
2019,Inf. Sciences,"Multi-objective evolutionary algorithm with prediction in the objective space.",Elaine Guerrero-Pena; Aluizio Fausto Ribeiro Araújo,https://doi.org/10.1016/j.ins.2019.05.091,null,J,no_arxiv,0
2019,CVIU,"Dynamic topology and relevance learning SOM-based algorithm for image clustering tasks.",Heitor R. Medeiros; Felipe D. B. de Oliveira; Hansenclever de F. Bassani; Aluizio F. R. Araújo,https://doi.org/10.1016/j.cviu.2018.11.003,null,J,no_arxiv,2
