2018,ICSE,"Assessing the threat of untracked changes in software evolution.",André C. Hora; Danilo Silva; Marco Tulio Valente; Romain Robbes,http://doi.acm.org/10.1145/3180155.3180212,top,C
2018,SANER,"Why and how Java developers break APIs.",Aline Brito; Laerte Xavier; André C. Hora; Marco Tulio Valente,https://doi.org/10.1109/SANER.2018.8330214,null,C
2017,SANER,"Historical and impact analysis of API breaking changes: A large-scale study.",Laerte Xavier; Aline Brito; André C. Hora; Marco Tulio Valente,https://doi.org/10.1109/SANER.2017.7884616,null,C
2016,EMSE,"Mining architectural violations from version history.",Cristiano Amaral Maffort; Marco Tulio Valente; Ricardo Terra; Mariza Andrade da Silva Bigonha; Nicolas Anquetil; André C. Hora,https://doi.org/10.1007/s10664-014-9348-2,null,J
2016,ICSME,"Understanding the Factors That Impact the Popularity of GitHub Repositories.",Hudson Borges; André C. Hora; Marco Tulio Valente,https://doi.org/10.1109/ICSME.2016.31,null,C
2016,ICPC,"A novel approach for estimating Truck Factors.",Guilherme Avelino; Leonardo Teixeira Passos; André C. Hora; Marco Tulio Valente,https://doi.org/10.1109/ICPC.2016.7503718,null,C
2016,FSE,"When should internal interfaces be promoted to public?",André C. Hora; Marco Tulio Valente; Romain Robbes; Nicolas Anquetil,http://doi.acm.org/10.1145/2950290.2950306,top,C
2016,SANER,"Do Developers Deprecate APIs with Replacement Messages? A Large-Scale Analysis on Java Systems.",Gleison Brito; André C. Hora; Marco Tulio Valente; Romain Robbes,https://doi.org/10.1109/SANER.2016.99,null,C
2015,ICSME,"How do developers react to API evolution? The Pharo ecosystem case.",André C. Hora; Romain Robbes; Nicolas Anquetil; Anne Etien; Stéphane Ducasse; Marco Tulio Valente,https://doi.org/10.1109/ICSM.2015.7332471,null,C
