2024,Applied Soft Comput.,"Optimizing public transport system using biased random-key genetic algorithm.",João Luiz Alves Oliveira; André L. L. de Aquino; Rian G. S. Pinheiro; Bruno C. S. Nogueira,https://doi.org/10.1016/j.asoc.2024.111578,null,J,no_arxiv,0
2024,Applied Soft Comput.,"A multi-start simulated annealing strategy for Data Lake Organization Problem.",Danilo Fernandes; Geymerson S. Ramos; Rian G. S. Pinheiro; André L. L. de Aquino,https://doi.org/10.1016/j.asoc.2024.111700,null,J,no_arxiv,0
2021,Supercomputing,"Reproducibility model for wireless sensor networks parallel simulations.",Matheus Leônidas Silva; Joubert de Castro Lima; André L. L. de Aquino,https://doi.org/10.1007/s11227-020-03298-8,null,J,no_arxiv,0
2024,Ad Hoc Networks,"An edge computing and distributed ledger technology architecture for secure and efficient transportation.",Douglas L. L. Moura; André L. L. de Aquino; Antonio A. F. Loureiro,https://doi.org/10.1016/j.adhoc.2024.103633,null,J,no_arxiv,0
2021,J. Network Computer App.,"Temporal complex networks modeling applied to vehicular ad-hoc networks.",Fillipe Santos; André L. L. de Aquino; Edmundo R. M. Madeira; Raquel S. Cabral,https://doi.org/10.1016/j.jnca.2021.103168,null,J,no_arxiv,0
2024,ITOR,"A matheuristic approach for the minimum broadcast time problem using a biased random-key genetic algorithm.",Alfredo Lima; André L. L. de Aquino; Bruno C. S. Nogueira; Rian G. S. Pinheiro,https://doi.org/10.1111/itor.13146,null,J,no_arxiv,0
