2019,Future Generation CS,"A method to detect data outliers from smart urban spaces via tensor analysis.",Thiago I. A. Souza; André L. L. de Aquino; Danielo Goncalves Gomes,https://doi.org/10.1016/j.future.2018.09.062,null,J,no_arxiv,2
2019,IEEE TPDS,"JSensor: A Parallel Simulator for Huge Wireless Sensor Networks Applications.",Matheus Leônidas Silva; Lincoln N. Santos Júnior; André L. L. de Aquino; Joubert de Castro Lima,https://doi.org/10.1109/TPDS.2019.2908845,top,J,no_arxiv,0
2018,Future Generation CS,"An evolutionary algorithm for roadside unit deployment with betweenness centrality preprocessing.",Douglas L. L. Moura; Raquel S. Cabral; Thiago Sales; André L. L. de Aquino,https://doi.org/10.1016/j.future.2018.03.051,null,J,no_arxiv,7
2019,SPE,"A middleware solution for integrating and exploring IoT and HPC capabilities.",Leonardo de Souza Cimino; José Estevão Eugênio de Resende; Lucas Henrique Moreira Silva; Samuel Queiroz Souza Rocha; Matheus de Oliveira Correia; Guilherme Souza Monteiro; Gabriel Nata de Souza Fernandes; Renan da Silva Moreira; Junior Guilherme de Silva; Matheus Inácio Batista Santos; André Luiz Lins de Aquino; André Luís Barroso Almeida; Joubert de Castro Lima,https://doi.org/10.1002/spe.2630,null,J,no_arxiv,1
2019,Ad Hoc Networks,"Study about vehicles velocities using time causal Information Theory quantifiers.",Maurício José da Silva; Tamer S. G. Cavalcante; Osvaldo A. Rosso; Joel J. P. C. Rodrigues; Ricardo Augusto Rabelo Oliveira; André L. L. de Aquino,https://doi.org/10.1016/j.adhoc.2019.02.009,null,J,no_arxiv,1
2018,Computer Networks,"A data sample algorithm applied to wireless sensor network with disruptive connections.",Israel L. C. Vasconcelos; Ivan C. Martins; Carlos Mauricio S. Figueiredo; André L. L. de Aquino,https://doi.org/10.1016/j.comnet.2018.09.006,null,J,no_arxiv,2
2015,Computer Comm.,"Deployment of roadside units based on partial mobility information.",Cristiano M. Silva; André L. L. de Aquino; Wagner Meira Jr.,https://doi.org/10.1016/j.comcom.2015.01.021,null,J,no_arxiv,20
