2015,J. Parallel Distrib. Comput.,"An enhanced location-free Greedy Forward algorithm with hole bypass capability in wireless sensor networks.",Horacio A. B. F. de Oliveira; Azzedine Boukerche; Daniel L. Guidoni; Eduardo Freire Nakamura; Raquel A. F. Mini; Antonio A. F. Loureiro,https://doi.org/10.1016/j.jpdc.2014.10.007,null,J,no_arxiv,10
2015,IEEE TPDS,"A Multipath Video Streaming Solution for Vehicular Networks with Link Disjoint and Node-disjoint.",Hengheng Xie; Azzedine Boukerche; Antonio A. F. Loureiro,https://doi.org/10.1109/TPDS.2014.2371027,top,J,no_arxiv,16
2013,J. Parallel Distrib. Comput.,"A multicast reprogramming protocol for wireless sensor networks based on small world concepts.",Guilherme Maia; André L. L. de Aquino; Daniel L. Guidoni; Antonio A. F. Loureiro,https://doi.org/10.1016/j.jpdc.2013.05.006,null,J,no_arxiv,4
2018,ACM Comput. Surveys,"Underwater Wireless Sensor Networks: A New Challenge for Topology Control-Based Systems.",Rodolfo W. L. Coutinho; Azzedine Boukerche; Luiz Filipe M. Vieira; Antonio A. F. Loureiro,http://doi.acm.org/10.1145/3154834,null,J,no_arxiv,2
2016,ACM Comput. Surveys,"Vehicular Networks: A New Challenge for Content-Delivery-Based Applications.",Fabrício A. Silva; Azzedine Boukerche; Thais R. M. Braga Silva; Linnyer Beatrys Ruiz; Eduardo Cerqueira; Antonio A. F. Loureiro,http://doi.acm.org/10.1145/2903745,null,J,no_arxiv,9
2017,Inf. Systems,"A large-scale study of cultural differences using urban data about eating and drinking preferences.",Thiago H. Silva; Pedro O. S. Vaz de Melo; Jussara M. Almeida; Mirco Musolesi; Antonio A. F. Loureiro,https://doi.org/10.1016/j.is.2017.10.002,null,J,no_arxiv,0
2014,ICWSM,"You Are What You Eat (and Drink): Identifying Cultural Boundaries by Analyzing Food and Drink Habits in Foursquare.",Thiago H. Silva; Pedro O. S. Vaz de Melo; Jussara M. Almeida; Mirco Musolesi; Antonio A. F. Loureiro,http://www.aaai.org/ocs/index.php/ICWSM/ICWSM14/paper/view/8113,null,C,no_arxiv,
2013,WWW,"The self-feeding process: a unifying model for communication dynamics in the web.",Pedro Olmo Stancioli Vaz de Melo; Christos Faloutsos; Renato Assunção; Antonio Alfredo Ferreira Loureiro,http://doi.acm.org/10.1145/2488388.2488503,top,C,no_arxiv,10
2017,MSWiM,"SMAFramework: Urban Data Integration Framework for Mobility Analysis in Smart Cities.",Diego O. Rodrigues; Azzedine Boukerche; Thiago H. Silva; Antonio A. F. Loureiro; Leandro A. Villas,http://doi.acm.org/10.1145/3127540.3127569,null,C,no_arxiv,0
2016,MSWiM,"A Novel Centrality Metric for Topology Control in Underwater Sensor Networks.",Rodolfo W. L. Coutinho; Azzedine F. M. Boukerche; Luiz Filipe M. Vieira; Antonio Alfredo Ferreira Loureiro,http://doi.acm.org/10.1145/2988287.2989162,null,C,no_arxiv,3
2016,MSWiM,"Matrix: Multihop Address Allocation and Dynamic Any-to-Any Routing for 6LoWPAN.",Bruna Soares Peres; Otavio Augusto de Oliveira Souza; Bruno Pereira Santos; Edson Roteia Araujo Junior; Olga Goussevskaia; Marcos Augusto Menezes Vieira; Luiz Filipe Menezes Vieira; Antonio Alfredo Ferreira Loureiro,http://doi.acm.org/10.1145/2988287.2989139,null,C,no_arxiv,0
2016,SenSys,"AoT: Authentication and Access Control for the Entire IoT Device Life-Cycle.",Antonio L. Maia Neto; Artur L. F. Souza; Ítalo S. Cunha; Michele Nogueira; Ivan Oliveira Nunes; Leonardo Cotta; Nicolas Gentille; Antonio A. F. Loureiro; Diego F. Aranha; Harsh Kupwade Patil; Leonardo B. Oliveira,http://doi.acm.org/10.1145/2994551.2994555,null,C,no_arxiv,6
2015,MSWiM,"Filling the Gaps of Vehicular Mobility Traces.",Fabrício A. Silva; Clayson Celes; Azzedine Boukerche; Linnyer Beatrys Ruiz; Antonio A. F. Loureiro,http://doi.acm.org/10.1145/2811587.2811612,null,C,no_arxiv,8
2015,MSWiM,"Modeling and Analysis of Opportunistic Routing in Low Duty-Cycle Underwater Sensor Networks.",Rodolfo W. L. Coutinho; Azzedine Boukerche; Luiz Filipe M. Vieira; Antonio A. F. Loureiro,http://doi.acm.org/10.1145/2811587.2811608,null,C,no_arxiv,6
2014,MSWiM,"Transmission power control-based opportunistic routing for wireless sensor networks.",Rodolfo W. L. Coutinho; Azzedine Boukerche; Luiz Filipe M. Vieira; Antonio Alfredo Ferreira Loureiro,http://doi.acm.org/10.1145/2641798.2641813,null,C,no_arxiv,4
2013,MobiHoc,"Connectivity in obstructed wireless networks: from geometry to percolation.",Marcelo G. Almiron; Olga Goussevskaia; Antonio A. F. Loureiro; José D. P. Rolim,http://doi.acm.org/10.1145/2491288.2491306,null,C,no_arxiv,3
2013,MSWiM,"Movement assisted-topology control and geographic routing protocol for underwater sensor networks.",Rodolfo W. L. Coutinho; Luiz Filipe M. Vieira; Antonio A. F. Loureiro,http://doi.acm.org/10.1145/2507924.2507956,null,C,no_arxiv,10
2013,MSWiM,"RECAST: telling apart social and random relationships in dynamic networks.",Pedro O. S. Vaz de Melo; Aline Carneiro Viana; Marco Fiore; Katia Jaffrès-Runser; Frederic Le Mouel; Antonio A. F. Loureiro,http://doi.acm.org/10.1145/2507924.2507950,null,C,no_arxiv,1
2013,MSWiM,"Traffic aware video dissemination over vehicular ad hoc networks.",Guilherme Maia; Cristiano G. Rezende; Leandro A. Villas; Azzedine Boukerche; Aline Carneiro Viana; André L. L. de Aquino; Antonio Alfredo Ferreira Loureiro,http://doi.acm.org/10.1145/2507924.2507962,null,C,no_arxiv,10
2014,MASCOTS,"Local Maximum Routing Recovery in Underwater Sensor Networks: Performance and Trade-offs.",Rodolfo W. L. Coutinho; Azzedine Boukerche; Luiz Filipe M. Vieira; Antonio Alfredo Ferreira Loureiro,https://doi.org/10.1109/MASCOTS.2014.22,null,C,no_arxiv,1
