2021,AAMAS,"Minimum-Delay Adaptation in Non-Stationary Reinforcement Learning via Online High-Confidence Change-Point Detection.",Lucas Nunes Alegre; Ana L. C. Bazzan; Bruno C. da Silva 0001,https://dl.acm.org/doi/10.5555/3463952.3463970,null,C,no_arxiv,0
2017,AAMAS,"Learning to Minimise Regret in Route Choice.",Gabriel de Oliveira Ramos; Bruno Castro da Silva; Ana L. C. Bazzan,http://dl.acm.org/citation.cfm?id=3091244,null,C,no_arxiv,0
2022,ICML,"Optimistic Linear Support and Successor Features as a Basis for Optimal Policy Transfer.",Lucas Nunes Alegre; Ana L. C. Bazzan; Bruno C. da Silva 0001,https://proceedings.mlr.press/v162/alegre22a.html,top,C,http://arxiv.org/abs/2206.11326v1,0
2021,NIPS/NeurIPS,"Universal Off-Policy Evaluation.",Yash Chandak; Scott Niekum; Bruno C. da Silva 0001; Erik G. Learned-Miller; Emma Brunskill; Philip S. Thomas,https://proceedings.neurips.cc/paper/2021/hash/e71e5cd119bbc5797164fb0cd7fd94a4-Abstract.html,top,C,no_arxiv,0
2018,Computers & Graphics,"A task-and-technique centered survey on visual analytics for deep learning model engineering.",Rafael Garcia; Alexandru C. Telea; Bruno Castro da Silva; Jim Tørresen; João Luiz Dihl Comba,https://doi.org/10.1016/j.cag.2018.09.018,null,J,no_arxiv,0
2017,IROS,"Task-based behavior generalization via manifold clustering.",Rafael Garcia; Bruno Castro da Silva; João Luiz Dihl Comba,https://doi.org/10.1109/IROS.2017.8206503,null,C,no_arxiv,0
