2019,BigData,"Open-Source Innovation in Practice: A Lean-Based Development Process Leveraging Open-Source Big Data Tools.",Silvio Alonso; Marx L. Viana; Elder Cirilo; Paulo S. C. Alencar; Carlos Lucena,https://doi.org/10.1109/BigData47090.2019.9006516,null,C,no_arxiv,0
2017,Inf. Sciences,"FIoT: An agent-based framework for self-adaptive and self-organizing applications based on the Internet of Things.",Nathalia Moraes do Nascimento; Carlos José Pereira de Lucena,https://doi.org/10.1016/j.ins.2016.10.031,null,J,no_arxiv,0
2022,EMSE,"Analysis of a many-objective optimization approach for identifying microservices from legacy systems.",Wesley K. G. Assunção; Thelma Elita Colanzi; Luiz Carvalho; Alessandro Garcia 0001; Juliana Alves Pereira; Maria Julia de Lima; Carlos Lucena,https://doi.org/10.1007/s10664-021-10049-7,null,J,no_arxiv,0
2021,SANER,"A Multi-Criteria Strategy for Redesigning Legacy Features as Microservices: An Industrial Case Study.",Wesley K. G. Assunção; Thelma Elita Colanzi; Luiz Carvalho; Juliana Alves Pereira; Alessandro F. Garcia 0001; Maria Julia de Lima; Carlos Lucena,https://doi.org/10.1109/SANER50967.2021.00042,null,C,no_arxiv,0
2020,IST,"Collaborative or individual identification of code smells? On the effectiveness of novice and professional developers.",Roberto Felicio Oliveira; Rafael Maiani de Mello; Eduardo Fernandes; Alessandro Garcia 0001; Carlos Lucena,https://doi.org/10.1016/j.infsof.2019.106242,null,J,no_arxiv,0
2020,ICSME,"On the Performance and Adoption of Search-Based Microservice Identification with toMicroservices.",Luiz Carvalho; Alessandro F. Garcia 0001; Thelma Elita Colanzi; Wesley K. G. Assunção; Juliana Alves Pereira; Baldoino Fonseca; Márcio Ribeiro 0001; Maria Julia de Lima; Carlos Lucena,https://doi.org/10.1109/ICSME46990.2020.00060,null,C,no_arxiv,0
2020,ICPC,"When Are Smells Indicators of Architectural Refactoring Opportunities: A Study of 50 Software Projects.",Leonardo da Silva Sousa; Willian Nalepa Oizumi; Alessandro Garcia 0001; Anderson Oliveira; Diego Cedrim; Carlos Lucena,https://doi.org/10.1145/3387904.3389276,null,C,no_arxiv,0
2018,ICSE,"Identifying design problems in the source code: a grounded theory.",Leonardo da Silva Sousa; Anderson Oliveira; Willian Nalepa Oizumi; Simone D. J. Barbosa; Alessandro Garcia 0001; Jaejoon Lee; Marcos Kalinowski; Rafael Maiani de Mello; Baldoino Fonseca; Roberto Felicio Oliveira; Carlos Lucena; Rodrigo B. de Paes,https://doi.org/10.1145/3180155.3180239,top,C,no_arxiv,0
2018,SPLC,"Understanding vulnerabilities in plugin-based web systems: an exploratory study of wordpress.",Oslien Mesa; Reginaldo Vieira; Marx L. Viana; Vinicius H. S. Durelli; Elder Cirilo; Marcos Kalinowski; Carlos Lucena,https://doi.org/10.1145/3233027.3233042,null,C,no_arxiv,0
