2020,Future Generation CS,"Using machine learning techniques to analyze the performance of concurrent kernel execution on GPUs.",Pablo Carvalho; Esteban Clua; Aline Paes; Cristiana Bentes; Bruno Lopes 0001; Lúcia Maria de A. Drummond,https://doi.org/10.1016/j.future.2020.07.038,null,J,no_arxiv,0
2019,Concurrency and Computation,"New advances in high-performance computing systems.",Cristina Boeres; Cristiana Bentes; Edward D. Moreno,https://doi.org/10.1002/cpe.5172,null,J,no_arxiv,0
2019,Concurrency and Computation,"Maximizing the GPU resource usage by reordering concurrent kernels submission.",Rommel Anatoli Quintanilla Cruz; Cristiana Bentes; Bernardo B. Labronici; Eduardo C. Vasconcellos; Esteban Clua; Pablo Carvalho; Lúcia Maria de A. Drummond,https://doi.org/10.1002/cpe.4409,null,J,no_arxiv,0
2019,Concurrency and Computation,"DTM@GPU: Characterizing and evaluating trace redundancy in GPU.",Leandro A. J. Marzulo; Alexandre da Costa Sena; Alexandre Solon Nery; Cristiana Bentes; Igor Machado Coelho; Maria Clicia Stelling de Castro; Saulo T. Oliveira; Tiago A. O. Alves; Felipe M. G. França,https://doi.org/10.1002/cpe.4450,null,J,no_arxiv,0
2015,JMLR,"Evolving GPU machine code.",Cleomar Pereira da Silva; Douglas Mota Dias; Cristiana Bentes; Marco Aurélio Cavalcanti Pacheco; Leandro Fontoura Cupertino,http://dl.acm.org/citation.cfm?id=2831136,top,J,no_arxiv,0
2017,INFORMS J Compt,"A Graphics Processing Unit Algorithm to Solve the Quadratic Assignment Problem Using Level-2 Reformulation-Linearization Technique.",Alexandre Domingues Gonçalves; Artur Alves Pessoa; Cristiana Bentes; Ricardo C. Farias; Lúcia Maria de A. Drummond,https://doi.org/10.1287/ijoc.2017.0754,top,J,no_arxiv,0
