2014,Inf. Fusion,"Spatial query processing in wireless sensor networks - A survey.",Rone Ilídio da Silva; Daniel Fernandes Macedo; José Marcos S. Nogueira,https://doi.org/10.1016/j.inffus.2012.08.006,null,J,no_arxiv,12
2020,Computer Comm.,"Ethanol: A Software-Defined Wireless Networking architecture for IEEE 802.11 networks.",Henrique D. Moura; Alisson R. Alves; Jonas R. A. Borges; Daniel F. Macedo; Marcos Augusto Menezes Vieira,https://doi.org/10.1016/j.comcom.2019.10.010,null,J,no_arxiv,0
2020,Computer Comm.,"Automatic MAC protocol selection in wireless networks based on reinforcement learning.",André Gomes; Daniel F. Macedo; Luiz Filipe M. Vieira,https://doi.org/10.1016/j.comcom.2019.10.023,null,J,no_arxiv,0
2019,IM,"Automatic Quality of Experience Management for WLAN Networks using Multi-Armed Bandit.",Henrique Duarte Moura; Daniel Fernandes Macedo; Marcos Augusto Menezes Vieira,http://dl.ifip.org/db/conf/im/im2019/188986.pdf,null,C,no_arxiv,
2018,IEEE Trans. Mobile Comput.,"ULOOF: A User Level Online Offloading Framework for Mobile Edge Computing.",Jose Leal Domingues Neto; Se-Young Yu; Daniel F. Macedo; José Marcos S. Nogueira; Rami Langar; Stefano Secci,https://doi.org/10.1109/TMC.2018.2815015,top,J,no_arxiv,12
2016,Computer Networks,"SNVC: Social networks for vehicular certification.",Thiago Rodrigues de Oliveira; Cristiano M. Silva; Daniel F. Macedo; José Marcos S. Nogueira,https://doi.org/10.1016/j.comnet.2016.08.030,null,J,no_arxiv,4
2015,IM,"Ethanol: Software defined networking for 802.11 Wireless Networks.",Henrique D. Moura; Gabriel V. C. Bessa; Marcos Augusto M. Vieira; Daniel F. Macedo,https://doi.org/10.1109/INM.2015.7140315,null,C,no_arxiv,13
