2022,ACM Comput. Surveys,"Beyond Multimedia Authoring: On the Need for Mulsemedia Authoring Tools.",Douglas Paulo de Mattos; Débora C. Muchaluat-Saade; Gheorghita Ghinea,https://doi.org/10.1145/3464422,null,J,no_arxiv,0
2020,Communications ACM,"Digital healthcare in Latin America: the case of Brazil and Mexico.",Monica Tentori; Artur Ziviani; Débora C. Muchaluat-Saade; Jesús Favela,https://doi.org/10.1145/3423923,null,J,no_arxiv,0
2023,Multimedia Tools Appl.,"Providing multimodal and multi-user interactions for digital tv applications.",Fábio Barreto; Raphael S. de Abreu; Marina Ivanov Pereira Josué; Eyre Brasil B. Montevecchi; Pedro Alves Valentim; Débora C. Muchaluat-Saade,https://doi.org/10.1007/s11042-021-11847-3,null,J,no_arxiv,0
2021,IEEE MultiMedia,"Toward Content-Driven Intelligent Authoring of Mulsemedia Applications.",Raphael S. de Abreu; Douglas Paulo de Mattos; Joel A. F. dos Santos; Gheorghita Ghinea; Débora Christina Muchaluat-Saade,https://doi.org/10.1109/MMUL.2020.3011383,null,J,no_arxiv,0
2020,Multimedia Tools Appl.,"Providing adjustable and dynamic spatial layouts for multimedia applications with STyLe.",Glauco Fiorott Amorim; Joel A. F. dos Santos; Débora C. Muchaluat-Saade,https://doi.org/10.1007/s11042-020-09204-x,null,J,no_arxiv,0
2022,Computer Comm.,"A survey on vital signs monitoring based on Wi-Fi CSI data.",Julio César Huarachi Soto; Iandra Galdino; Egberto Caballero; Vinicius C. Ferreira 0001; Débora C. Muchaluat-Saade; Célio Vinicius N. de Albuquerque,https://doi.org/10.1016/j.comcom.2022.08.004,null,J,no_arxiv,0
