2022,J. Parallel Distrib. Comput.,"Early scheduling on steroids: Boosting parallel state machine replication.",Elia Batista; Eduardo Alchieri; Fernando Luís Dotti; Fernando Pedone,https://doi.org/10.1016/j.jpdc.2022.02.001,null,J,no_arxiv,0
2022,IEEE TPDS,"Exploiting Concurrency in Sharded Parallel State Machine Replication.",Aldenio Burgos; Eduardo Alchieri; Fernando Luís Dotti; Fernando Pedone,https://doi.org/10.1109/TPDS.2021.3135761,top,J,no_arxiv,0
2023,Concurr. & Computation,"DataPlane-ML: An integrated attack detection and mitigation solution for software defined networks.",Ranyelson Neres Carvalho; Lucas Rodrigues Costa; Jacir Luiz Bordim; Eduardo A. P. Alchieri,https://doi.org/10.1002/cpe.7434,null,J,no_arxiv,0
2020,DSN,"From Byzantine Replication to Blockchain: Consensus is Only the Beginning.",Alysson Bessani; Eduardo Alchieri; João Sousa 0002; André Oliveira 0002; Fernando Pedone,https://doi.org/10.1109/DSN48063.2020.00057,null,C,http://arxiv.org/abs/2004.14527v1,0
2019,Middleware,"Boosting concurrency in Parallel State Machine Replication.",Ian Aragon Escobar; Eduardo Alchieri; Fernando Luís Dotti; Fernando Pedone,https://doi.org/10.1145/3361525.3361549,null,C,no_arxiv,0
2019,Computers & Security,"Building secure protocols for extensible distributed coordination through secure extensions.",Edson Floriano; Eduardo Alchieri; Diego F. Aranha; Priscila Solís Barreto,https://doi.org/10.1016/j.cose.2019.101583,null,J,no_arxiv,0
