2019,ICML,"New results on information theoretic clustering.",Ferdinando Cicalese; Eduardo Sany Laber; Lucas Murtinho,http://proceedings.mlr.press/v97/cicalese19a.html,top,C,no_arxiv,
2018,ICML,"Binary Partitions with Approximate Minimum Impurity.",Eduardo Sany Laber; Marco Molinaro; Felipe de A. Mello Pereira,http://proceedings.mlr.press/v80/laber18a.html,top,C,no_arxiv,
2014,ICML,"Diagnosis determination: decision trees optimizing simultaneously worst and expected testing cost.",Ferdinando Cicalese; Eduardo Sany Laber; Aline Medeiros Saettler,http://proceedings.mlr.press/v32/cicalese14.html,top,C,no_arxiv,
2018,Algorithmica,"Correction to: Trading Off Worst and Expected Cost in Decision Tree Problems.",Aline Medeiros Saettler; Eduardo Sany Laber; Ferdinando Cicalese,https://doi.org/10.1007/s00453-018-0423-8,null,J,no_arxiv,0
2017,Algorithmica,"Decision Trees for Function Evaluation: Simultaneous Optimization of Worst and Expected Cost.",Ferdinando Cicalese; Eduardo Sany Laber; Aline Medeiros Saettler,https://doi.org/10.1007/s00453-016-0225-9,null,J,no_arxiv,0
2015,ISAAC,"Trading off Worst and Expected Cost in Decision Tree Problems.",Aline Medeiros Saettler; Eduardo Sany Laber; Ferdinando Cicalese,https://doi.org/10.1007/978-3-662-48971-0_20,null,C,no_arxiv,1
2014,Algorithmica,"Improved Approximation Algorithms for the Average-Case Tree Searching Problem.",Ferdinando Cicalese; Tobias Jacobs; Eduardo Sany Laber; Marco Molinaro,https://doi.org/10.1007/s00453-012-9715-6,null,J,no_arxiv,0
2014,Theor. Comput. Sci.,"Approximating the maximum consecutive subsums of a sequence.",Ferdinando Cicalese; Eduardo Sany Laber; Oren Weimann; Raphael Yuster,https://doi.org/10.1016/j.tcs.2013.05.032,null,J,no_arxiv,3
2018,PRL,"Splitting criteria for classification problems with multi-valued attributes and large number of classes.",Eduardo Sany Laber; Felipe de A. Mello Pereira,https://doi.org/10.1016/j.patrec.2018.04.013,null,J,no_arxiv,0
