2022,Neurocomputing,"TSPred: A framework for nonstationary time series prediction.",Rebecca Salles; Esther Pacitti; Eduardo Bezerra 0002; Fábio Porto 0001; Eduardo S. Ogasawara,https://doi.org/10.1016/j.neucom.2021.09.067,null,J,no_arxiv,0
2021,Neurocomputing,"STConvS2S: Spatiotemporal Convolutional Sequence to Sequence Network for weather forecasting.",Rafaela Castro; Yania Molina Souto; Eduardo S. Ogasawara; Fábio Porto 0001; Eduardo Bezerra 0002,https://doi.org/10.1016/j.neucom.2020.09.060,null,J,http://arxiv.org/abs/1912.00134v4,0
2019,Knowledge-Based Syst.,"Nonstationary time series transformation methods: An experimental review.",Rebecca Salles; Kele T. Belloze; Fábio Porto 0001; Pedro H. Gonzalez; Eduardo S. Ogasawara,https://doi.org/10.1016/j.knosys.2018.10.041,null,J,no_arxiv,0
2020,Future Generation CS,"BioinfoPortal: A scientific gateway for integrating bioinformatics applications on the Brazilian national high-performance computing network.",Kary A. C. S. Ocaña; Marcelo Galheigo; Carla Osthoff; Luiz M. R. Gadelha Jr.; Fábio Porto 0001; Antônio Tadeu A. Gomes; Daniel de Oliveira 0001; Ana Tereza Ribeiro de Vasconcelos,https://doi.org/10.1016/j.future.2020.01.030,null,J,no_arxiv,0
2022,Proc. VLDB,"Fast Algorithms for Denial Constraint Discovery.",Eduardo H. M. Pena; Fábio Porto 0001; Felix Naumann,https://www.vldb.org/pvldb/vol16/p684-pena.pdf,top,J,no_arxiv,0
2021,Concurr. & Computation,"Towards optimizing the execution of spark scientific workflows using machine learning-based parameter tuning.",Douglas E. M. de Oliveira; Fábio Porto 0001; Cristina Boeres; Daniel de Oliveira 0001,https://doi.org/10.1002/cpe.5972,null,J,no_arxiv,0
2019,CCGrid,"Towards a Science Gateway for Bioinformatics: Experiences in the Brazilian System of High Performance Computing.",Kary Ann del Carmen Ocaña Gautherot; Marcelo Galheigo; Carla Osthoff; Luiz M. R. Gadelha Jr.; Antônio Tadeu A. Gomes; Daniel de Oliveira 0001; Fábio Porto 0001; Ana Tereza Ribeiro de Vasconcelos,https://doi.org/10.1109/CCGRID.2019.00082,null,C,no_arxiv,0
