2024,AAMAS,"BDI Agents in Natural Language Environments.",Alexandre Yukio Ichida; Felipe Meneguzzi; Rafael C. Cardoso 0001,https://dl.acm.org/doi/10.5555/3635637.3662942,null,C,no_arxiv,0
2024,IJCAI,"A Survey on Model-Free Goal Recognition.",Leonardo Amado; Sveta Paster Shainkopf; Ramon Fraga Pereira; Reuth Mirsky; Felipe Meneguzzi,https://www.ijcai.org/proceedings/2024/877,top,C,no_arxiv,0
2023,AAAI,"Robust Neuro-Symbolic Goal and Plan Recognition.",Leonardo Amado; Ramon Fraga Pereira; Felipe Meneguzzi,https://doi.org/10.1609/aaai.v37i10.26408,top,C,no_arxiv,0
2023,IJCAI,"Multi-Agent Intention Recognition and Progression.",Michael Dann; Yuan Yao 0007; Natasha Alechina; Brian Logan 0001; Felipe Meneguzzi; John Thangarajah,https://doi.org/10.24963/ijcai.2023/11,top,C,no_arxiv,0
2022,AAAI,"Goal Recognition as Reinforcement Learning.",Leonardo Amado; Reuth Mirsky; Felipe Meneguzzi,https://doi.org/10.1609/aaai.v36i9.21198,top,C,http://arxiv.org/abs/2202.06356v1,0
2021,AAAI,"An LP-Based Approach for Goal Recognition as Planning.",Luísa R. de A. Santos; Felipe Meneguzzi; Ramon Fraga Pereira; André Grahl Pereira,https://doi.org/10.1609/aaai.v35i13.17418,top,C,no_arxiv,0
2021,IJCAI,"A Survey on Goal Recognition as Planning.",Felipe Meneguzzi; Ramon Fraga Pereira,https://doi.org/10.24963/ijcai.2021/616,top,C,no_arxiv,0
