2017,AAAI,"Spatial Projection of Multiple Climate Variables Using Hierarchical Multitask Learning.",André Ricardo Gonçalves; Arindam Banerjee; Fernando J. Von Zuben,http://aaai.org/ocs/index.php/AAAI/AAAI17/paper/view/15018,top,C,http://arxiv.org/abs/1701.08840v1,
2016,IEEE Trans. Cybernetics,"Learning to Anticipate Flexible Choices in Multiple Criteria Decision-Making Under Uncertainty.",Carlos R. B. Azevedo; Fernando J. Von Zuben,https://doi.org/10.1109/TCYB.2015.2415732,null,J,no_arxiv,1
2015,IJCAI,"Multi-Label Structure Learning with Ising Model Selection.",André Ricardo Gonçalves; Fernando J. Von Zuben; Arindam Banerjee,http://ijcai.org/Abstract/15/496,top,C,no_arxiv,
2014,Neurocomputing,"Self-organization and lateral interaction in echo state network reservoirs.",Levy Boccato; Romis Attux; Fernando J. Von Zuben,https://doi.org/10.1016/j.neucom.2014.01.036,null,J,no_arxiv,8
2017,Inf. Sciences,"Enumerating all maximal biclusters in numerical datasets.",Rosana Veroneze; Arindam Banerjee; Fernando J. Von Zuben,https://doi.org/10.1016/j.ins.2016.10.029,null,J,http://arxiv.org/abs/1403.3562v4,2
2016,JMLR,"Multi-task Sparse Structure Learning with Gaussian Copula Models.",André Ricardo Gonçalves; Fernando J. Von Zuben; Arindam Banerjee,http://jmlr.org/papers/v17/15-215.html,top,J,no_arxiv,
2014,CIKM,"Multi-task Sparse Structure Learning.",André Ricardo Gonçalves; Puja Das; Soumyadeep Chatterjee; Vidyashankar Sivakumar; Fernando J. Von Zuben; Arindam Banerjee,https://doi.org/10.1145/2661829.2662091,null,C,no_arxiv,5
2013,PR,"Predicting missing values with biclustering: A coherence-based approach.",Fabrício Olivetti de França; Guilherme Palermo Coelho; Fernando J. Von Zuben,https://doi.org/10.1016/j.patcog.2012.10.022,null,J,no_arxiv,9
