2017,J Comb Opt,"Approximation algorithms for k-level stochastic facility location problems.",Lucas P. Melo; Flávio Keidi Miyazawa; Lehilton L. C. Pedrosa; Rafael Crivellari Saliba Schouery,https://doi.org/10.1007/s10878-016-0064-2,null,J,no_arxiv
2015,Math Program,"A systematic approach to bound factor-revealing LPs and its application to the metric and squared metric facility location problems.",Cristina G. Fernandes; Luis A. A. Meira; Flávio Keidi Miyazawa; Lehilton L. C. Pedrosa,https://doi.org/10.1007/s10107-014-0821-x,null,J,no_arxiv
2014,Annals OR,"Order and static stability into the strip packing problem.",Thiago Alves de Queiroz; Flávio Keidi Miyazawa,https://doi.org/10.1007/s10479-014-1634-2,null,J,no_arxiv
2013,Computers & OR,"Heuristics for the strip packing problem with unloading constraints.",Jefferson L. M. da Silveira; Flávio Keidi Miyazawa; Eduardo C. Xavier,https://doi.org/10.1016/j.cor.2012.11.003,null,J,no_arxiv
2018,LATIN,"A Tight Lower Bound for an Online Hypercube Packing Problem and Bounds for Prices of Anarchy of a Related Game.",Yoshiharu Kohayakawa; Flávio Keidi Miyazawa; Yoshiko Wakabayashi,https://doi.org/10.1007/978-3-319-77404-6_51,null,C,http://arxiv.org/abs/1712.06763v1
2018,LATIN,"Two-Dimensional Knapsack for Circles.",Carla Negri Lintzmayer; Flávio Keidi Miyazawa; Eduardo Candido Xavier,https://doi.org/10.1007/978-3-319-77404-6_54,null,C,no_arxiv
2014,ESA,"Polynomial-Time Approximation Schemes for Circle Packing Problems.",Flávio Keidi Miyazawa; Lehilton L. C. Pedrosa; Rafael Crivellari Saliba Schouery; Maxim Sviridenko; Yoshiko Wakabayashi,https://doi.org/10.1007/978-3-662-44777-2_59,null,C,no_arxiv
