2019,Expert Systems Appl.,"Clustering of multi-view relational data based on particle swarm optimization.",Rene Pereira de Gusmao; Francisco de A. T. de Carvalho,https://doi.org/10.1016/j.eswa.2018.12.053,null,J,no_arxiv,0
2017,Neurocomputing,"A robust regression method based on exponential-type kernel functions.",Francisco de A. T. de Carvalho; Eufrasio de Andrade Lima Neto; Marcelo R. P. Ferreira,https://doi.org/10.1016/j.neucom.2016.12.035,null,J,no_arxiv,0
2017,Neurocomputing,"Fuzzy clustering of interval-valued data with City-Block and Hausdorff distances.",Francisco de A. T. de Carvalho; Eduardo C. Sim천es,https://doi.org/10.1016/j.neucom.2017.05.084,null,J,no_arxiv,0
2016,Neurocomputing,"Batch SOM algorithms for interval-valued data with automatic weighting of the variables.",Francisco de A. T. de Carvalho; Patrice Bertrand; Eduardo C. Sim천es,https://doi.org/10.1016/j.neucom.2015.11.084,null,J,no_arxiv,0
2021,Inf. Sciences,"Co-clustering algorithms for distributional data with automated variable weighting.",Francisco de A. T. de Carvalho; Antonio Balzanella; Antonio Irpino; Rosanna Verde,https://doi.org/10.1016/j.ins.2020.11.018,null,J,no_arxiv,0
2018,Inf. Sciences,"An exponential-type kernel robust regression model for interval-valued variables.",Eufrasio de Andrade Lima Neto; Francisco de A. T. de Carvalho,https://doi.org/10.1016/j.ins.2018.05.008,null,J,no_arxiv,0
2017,Inf. Sciences,"Fuzzy clustering of distributional data with automatic weighting of variable components.",Antonio Irpino; Rosanna Verde; Francisco de A. T. de Carvalho,https://doi.org/10.1016/j.ins.2017.04.040,null,J,no_arxiv,0
2018,PR,"Gaussian kernel c-means hard clustering algorithms with automated computation of the width hyper-parameters.",Francisco de A. T. de Carvalho; Eduardo C. Sim천es; Lucas V. C. Santana; Marcelo R. P. Ferreira,https://doi.org/10.1016/j.patcog.2018.02.018,null,J,no_arxiv,0
2016,PR,"Kernel-based hard clustering methods with kernelization of the metric and automatic weighting of the variables.",Marcelo R. P. Ferreira; Francisco de A. T. de Carvalho; Eduardo C. Sim천es,https://doi.org/10.1016/j.patcog.2015.09.025,null,J,no_arxiv,0
