2019,Concurrency and Computation,"MASA-OpenCL: Parallel pruned comparison of long DNA sequences with OpenCL.",Marco Antonio C. de Figueiredo; Edans Flavius de Oliveira Sandes; Genaína Nunes Rodrigues; George Luiz Medeiros Teodoro; Alba Cristina Magalhaes Alves de Melo,https://doi.org/10.1002/cpe.5039,null,J,no_arxiv,0
2017,Data & Knowl. Eng.,"Planning runtime software adaptation through pragmatic goal model.",Felipe Pontes Guimarães; Genaína Nunes Rodrigues; Raian Ali; Daniel Macêdo Batista,https://doi.org/10.1016/j.datak.2017.03.003,null,J,no_arxiv,0
2019,Concurr. & Computation,"Statistical analysis of Amazon EC2 cloud pricing models.",Gustavo Portella; Genaína Nunes Rodrigues; Eduardo Y. Nakano; Alba C. M. A. Melo,https://doi.org/10.1002/cpe.4451,null,J,no_arxiv,0
2019,IST,"GoalD: A Goal-Driven deployment framework for dynamic and heterogeneous computing environments.",Gabriel S. Rodrigues; Felipe Pontes Guimarães; Genaína Nunes Rodrigues; Alessia Knauss; João Paulo C. de Araújo; Hugo Sica de Andrade; Raian Ali,https://doi.org/10.1016/j.infsof.2019.04.003,null,J,no_arxiv,0
2019,IST,"Enhancing context specifications for dependable adaptive systems: A data mining approach.",Arthur Rodrigues; Genaína Nunes Rodrigues; Alessia Knauss; Raian Ali; Hugo Sica de Andrade,https://doi.org/10.1016/j.infsof.2019.04.011,null,J,no_arxiv,0
2019,JSS,"Characterization of implied scenarios as families of common behavior.",Caio Batista de Melo; André Luiz Fernandes Cançado; Genaína Nunes Rodrigues,https://doi.org/10.1016/j.jss.2019.110425,null,J,no_arxiv,0
2018,IST,"Feature-family-based reliability analysis of software product lines.",André Lanna; Thiago M. Castro; Vander Alves; Genaína Nunes Rodrigues; Pierre-Yves Schobbens; Sven Apel,https://doi.org/10.1016/j.infsof.2017.10.001,null,J,no_arxiv,0
2017,IST,"Building reliable and maintainable Dynamic Software Product Lines: An investigation in the Body Sensor Network domain.",Leonardo Pessoa; Paula Fernandes; Thiago M. Castro; Vander Alves; Genaína Nunes Rodrigues; Hervaldo Carvalho,https://doi.org/10.1016/j.infsof.2017.02.002,null,J,no_arxiv,0
