2016,Bioinformatics,"A multi-objective optimization approach accurately resolves protein domain architectures.",Juliana S. Bernardes; Fabio Vieira; Gerson Zaverucha; Alessandra Carbone,https://doi.org/10.1093/bioinformatics/btv582,null,J,no_arxiv,0
2015,BMC Bioinformatics,"Evaluation and improvements of clustering algorithms for detecting remote homologous protein families.",Juliana S. Bernardes; Fabio Vieira; Lygia Costa; Gerson Zaverucha,https://doi.org/10.1186/s12859-014-0445-4,null,J,no_arxiv,0
2020,Machine Learning,"Transfer learning by mapping and revising boosted relational dependency networks.",Rodrigo Azevedo Santos; Aline Paes; Gerson Zaverucha,https://doi.org/10.1007/s10994-020-05871-x,null,J,no_arxiv,0
2019,Machine Learning,"Online probabilistic theory revision from examples with ProPPR.",Victor Guimarães 0001; Aline Paes; Gerson Zaverucha,https://doi.org/10.1007/s10994-019-05798-y,null,J,no_arxiv,0
2018,Inf. Sciences,"Revising the structure of Bayesian network classifiers in the presence of missing data.",Roosevelt Sardinha; Aline Paes; Gerson Zaverucha,https://doi.org/10.1016/j.ins.2018.02.011,null,J,no_arxiv,0
2017,Machine Learning,"On the use of stochastic local search techniques to revise first-order logic theories from examples.",Aline Paes; Gerson Zaverucha; Vítor Santos Costa,https://doi.org/10.1007/s10994-016-5595-3,null,J,no_arxiv,0
2017,J. Log. Comput.,"On the formal characterization of the FORTE_MBC theory revision operators.",Ana Luísa Duboc; Aline Paes; Gerson Zaverucha,https://doi.org/10.1093/logcom/exx015,null,J,no_arxiv,0
