2022,BMC Bioinformatics,"Semantic interoperability: ontological unpacking of a viral conceptual model.",Anna Bernasconi 0002; Giancarlo Guizzardi; Oscar Pastor 0001; Veda C. Storey,https://doi.org/10.1186/s12859-022-05022-0,null,J,no_arxiv,0
2024,Data & Knowl. Eng.,"Explanation, semantics, and ontology.",Giancarlo Guizzardi; Nicola Guarino,https://doi.org/10.1016/j.datak.2024.102325,null,J,no_arxiv,0
2024,Data & Knowl. Eng.,"Evaluating quality of ontology-driven conceptual models abstractions.",Elena Romanenko; Diego Calvanese; Giancarlo Guizzardi,https://doi.org/10.1016/j.datak.2024.102342,null,J,no_arxiv,0
2024,ER,"An Analysis of the Semantic Foundation of KerML and SysML v2.",João Paulo A. Almeida; Luís Ferreira Pires; Giancarlo Guizzardi; Gerd Wagner 0001,https://doi.org/10.1007/978-3-031-75872-0_8,null,C,no_arxiv,0
2024,ER,"Ontological Foundations of Resilience.",Pedro Paulo F. Barcelos; Rodrigo F. Calhau; Italo Jose da Silva Oliveira; Tiago Prince Sales; Frederik Gailly; Geert Poels; Giancarlo Guizzardi,https://doi.org/10.1007/978-3-031-75872-0_21,null,C,no_arxiv,0
2023,Data & Knowl. Eng.,"A FAIR catalog of ontology-driven conceptual models.",Tiago Prince Sales; Pedro Paulo F. Barcelos; Claudenir M. Fonseca; Isadora Valle Souza; Elena Romanenko; César Henrique Bernabé; Luiz Olavo Bonino da Silva Santos; Mattia Fumagalli; Joshua Kritz; João Paulo A. Almeida; Giancarlo Guizzardi,https://doi.org/10.1016/j.datak.2023.102210,null,J,no_arxiv,0
2023,Data & Knowl. Eng.,"Legal powers, subjections, disabilities, and immunities: Ontological analysis and modeling patterns.",Cristine Griffo; João Paulo A. Almeida; João A. O. Lima; Tiago Prince Sales; Giancarlo Guizzardi,https://doi.org/10.1016/j.datak.2023.102219,null,J,no_arxiv,0
2023,Inf. Systems,"Assessing the value of ontologically unpacking a conceptual model for human genomics.",Alberto García S.; Anna Bernasconi 0002; Giancarlo Guizzardi; Oscar Pastor 0001; Veda C. Storey; José Ignacio Panach,https://doi.org/10.1016/j.is.2023.102242,null,J,no_arxiv,0
2023,CAiSE,"Ontological Representation of FAIR Principles: A Blueprint for FAIRer Data Sources.",Anna Bernasconi 0002; Alberto García Simón; Giancarlo Guizzardi; Luiz Olavo Bonino da Silva Santos; Veda C. Storey,https://doi.org/10.1007/978-3-031-34560-9_16,null,C,no_arxiv,0
2023,CAiSE,"Enabling Representation Learning in Ontology-Driven Conceptual Modeling Using Graph Neural Networks.",Syed Juned Ali; Giancarlo Guizzardi; Dominik Bork,https://doi.org/10.1007/978-3-031-34560-9_17,null,C,no_arxiv,0
2023,EDOC,"A System Core Ontology for Capability Emergence Modeling.",Rodrigo F. Calhau; Tiago Prince Sales; Italo Jose da Silva Oliveira; Satyanarayana Kokkula; Luís Ferreira Pires; David B. Cameron; Giancarlo Guizzardi; João Paulo A. Almeida,https://doi.org/10.1007/978-3-031-46587-1_1,null,C,no_arxiv,0
2023,EDOC,"What Do I Get from Modeling? - An Empirical Study on Using Structural Conceptual Models.",Isadora Valle Sousa; Tiago Prince Sales; Eduardo Guerra 0002; Luiz Olavo Bonino da Silva Santos; Giancarlo Guizzardi,https://doi.org/10.1007/978-3-031-46587-1_2,null,C,no_arxiv,0
2022,Data & Knowl. Eng.,"Ontologically correct taxonomies by construction.",Jeferson O. Batista; João Paulo A. Almeida; Eduardo Zambon; Giancarlo Guizzardi,https://doi.org/10.1016/j.datak.2022.102012,null,J,no_arxiv,0
2022,Data & Knowl. Eng.,"Conceptual model visual simulation and the inductive learning of missing domain constraints.",Mattia Fumagalli; Tiago Prince Sales; Fernanda Araújo Baião; Giancarlo Guizzardi,https://doi.org/10.1016/j.datak.2022.102040,null,J,no_arxiv,0
2022,ER,"A FAIR Model Catalog for Ontology-Driven Conceptual Modeling Research.",Pedro Paulo F. Barcelos; Tiago Prince Sales; Mattia Fumagalli; Claudenir M. Fonseca; Isadora Valle Sousa; Elena Romanenko; Joshua Kritz; Giancarlo Guizzardi,https://doi.org/10.1007/978-3-031-17995-2_1,null,C,no_arxiv,0
2022,ER,"Incorporating Types of Types in Ontology-Driven Conceptual Modeling.",Claudenir M. Fonseca; Giancarlo Guizzardi; João Paulo A. Almeida; Tiago Prince Sales; Daniele Porello,https://doi.org/10.1007/978-3-031-17995-2_2,null,C,no_arxiv,0
2022,ER,"Pattern Discovery in Conceptual Models Using Frequent Itemset Mining.",Mattia Fumagalli; Tiago Prince Sales; Giancarlo Guizzardi,https://doi.org/10.1007/978-3-031-17995-2_4,null,C,no_arxiv,0
2022,ER,"Legal Power-Subjection Relations: Ontological Analysis and Modeling Pattern.",Cristine Griffo; Tiago Prince Sales; Giancarlo Guizzardi; João Paulo A. Almeida,https://doi.org/10.1007/978-3-031-17995-2_5,null,C,no_arxiv,0
2022,ER,"An Ontology of Security from a Risk Treatment Perspective.",Italo Jose da Silva Oliveira; Tiago Prince Sales; Riccardo Baratella; Mattia Fumagalli; Giancarlo Guizzardi,https://doi.org/10.1007/978-3-031-17995-2_26,null,C,no_arxiv,0
2021,Data & Knowl. Eng.,"Types and taxonomic structures in conceptual modeling: A novel ontological theory and engineering support.",Giancarlo Guizzardi; Claudenir M. Fonseca; João Paulo A. Almeida; Tiago Prince Sales; Alessander Botti Benevides; Daniele Porello,https://doi.org/10.1016/j.datak.2021.101891,null,J,no_arxiv,0
2021,Data & Knowl. Eng.,"An ontological analysis of software system anomalies and their associated risks.",Bruno Borlini Duarte; Ricardo de Almeida Falbo; Giancarlo Guizzardi; Renata S. S. Guizzardi; Vítor E. Silva Souza,https://doi.org/10.1016/j.datak.2021.101892,null,J,no_arxiv,0
2021,Data & Knowl. Eng.,"Multi-level conceptual modeling: Theory, language and application.",Claudenir M. Fonseca; João Paulo A. Almeida; Giancarlo Guizzardi; Victorio Albani de Carvalho,https://doi.org/10.1016/j.datak.2021.101894,null,J,no_arxiv,0
2021,Inf. Systems,"Service contract modeling in Enterprise Architecture: An ontology-based approach.",Cristine Griffo; João Paulo A. Almeida; Giancarlo Guizzardi; Julio Cesar Nardi,https://doi.org/10.1016/j.is.2019.101454,null,J,no_arxiv,0
2021,ER,"Forward Engineering Relational Schemas and High-Level Data Access from Conceptual Models.",Gustavo L. Guidoni; João Paulo A. Almeida; Giancarlo Guizzardi,https://doi.org/10.1007/978-3-030-89022-3_12,null,C,no_arxiv,0
2021,ER,"Trustworthiness Requirements: The Pix Case Study.",Glenda C. M. Amaral; Renata S. S. Guizzardi; Giancarlo Guizzardi; John Mylopoulos,https://doi.org/10.1007/978-3-030-89022-3_21,null,C,no_arxiv,0
2021,ER,"Ontological Unpacking as Explanation: The Case of the Viral Conceptual Model.",Giancarlo Guizzardi; Anna Bernasconi 0002; Oscar Pastor 0001; Veda C. Storey,https://doi.org/10.1007/978-3-030-89022-3_28,null,C,no_arxiv,0
2021,ER,"Type or Individual? Evidence of Large-Scale Conceptual Disarray in Wikidata.",Atílio A. Dadalto; João Paulo A. Almeida; Claudenir M. Fonseca; Giancarlo Guizzardi,https://doi.org/10.1007/978-3-030-89022-3_29,null,C,no_arxiv,0
2020,ER,"Transformation of Ontology-Based Conceptual Models into Relational Schemas.",Gustavo L. Guidoni; João Paulo A. Almeida; Giancarlo Guizzardi,https://doi.org/10.1007/978-3-030-62522-1_23,null,C,no_arxiv,0
2020,ER,"Ontology-Based Modeling and Analysis of Trustworthiness Requirements: Preliminary Results.",Glenda C. M. Amaral; Renata S. S. Guizzardi; Giancarlo Guizzardi; John Mylopoulos,https://doi.org/10.1007/978-3-030-62522-1_25,null,C,no_arxiv,0
2020,ER,"A Core Ontology for Economic Exchanges.",Daniele Porello; Giancarlo Guizzardi; Tiago Prince Sales; Glenda C. M. Amaral,https://doi.org/10.1007/978-3-030-62522-1_27,null,C,no_arxiv,0
2024,SoSyM,"Modeling competences in enterprise architecture: from knowledge, skills, and attitudes to organizational capabilities.",Rodrigo F. Calhau; João Paulo A. Almeida; Satyanarayana Kokkula; Giancarlo Guizzardi,https://doi.org/10.1007/s10270-024-01151-7,null,J,no_arxiv,0
2024,SoSyM,"Correction: Modeling competences in enterprise architecture: from knowledge, skills, and attitudes to organizational capabilities.",Rodrigo F. Calhau; João Paulo A. Almeida; Satyanarayana Kokkula; Giancarlo Guizzardi,https://doi.org/10.1007/s10270-024-01182-0,null,J,no_arxiv,0
2024,SoSyM,"Ontology-based security modeling in ArchiMate.",Italo Jose da Silva Oliveira; Tiago Prince Sales; João Paulo A. Almeida; Riccardo Baratella; Mattia Fumagalli; Giancarlo Guizzardi,https://doi.org/10.1007/s10270-024-01149-1,null,J,no_arxiv,0
2023,SoSyM,"An ontology-based approach to engineering ethicality requirements.",Renata S. S. Guizzardi; Glenda C. M. Amaral; Giancarlo Guizzardi; John Mylopoulos,https://doi.org/10.1007/s10270-023-01115-3,null,J,no_arxiv,0
2022,SoSyM,"Automated conceptual model clustering: a relator-centric approach.",Giancarlo Guizzardi; Tiago Prince Sales; João Paulo A. Almeida; Geert Poels,https://doi.org/10.1007/s10270-021-00919-5,null,J,no_arxiv,0
