2019,Inf. Sciences,"Evaluation of statistical and machine learning models for time series prediction: Identifying the state-of-the-art and the best conditions for the use of each model.",Antonio Rafael Sabino Parmezan; Vinícius M. A. de Souza; Gustavo E. A. P. A. Batista,https://doi.org/10.1016/j.ins.2019.01.076,null,J,no_arxiv,1
2018,Data Min. Knowl. Discov.,"Speeding up similarity search under dynamic time warping by pruning unpromising alignments.",Diego Furtado Silva; Rafael Giusti; Eamonn J. Keogh; Gustavo E. A. P. A. Batista,https://doi.org/10.1007/s10618-018-0557-y,null,J,no_arxiv,5
2018,KDD,"Classifying and Counting with Recurrent Contexts.",Denis Moreira dos Reis; André Gustavo Maletzke; Diego Furtado Silva; Gustavo E. A. P. A. Batista,https://doi.org/10.1145/3219819.3220059,top,C,no_arxiv,0
2018,ECML/PKDD,"One-Class Quantification.",Denis Moreira dos Reis; André Gustavo Maletzke; Everton Alvares Cherman; Gustavo Enrique De Almeida Prado Alves Batista,https://doi.org/10.1007/978-3-030-10925-7_17,null,C,no_arxiv,0
2016,KDD,"Fast Unsupervised Online Drift Detection Using Incremental Kolmogorov-Smirnov Test.",Denis Moreira dos Reis; Peter A. Flach; Stan Matwin; Gustavo E. A. P. A. Batista,https://doi.org/10.1145/2939672.2939836,top,C,no_arxiv,7
2016,SDM,"Speeding Up All-Pairwise Dynamic Time Warping Matrix Calculation.",Diego Furtado Silva; Gustavo E. A. P. A. Batista,https://doi.org/10.1137/1.9781611974348.94,null,C,no_arxiv,13
2015,SDM,"Data Stream Classification Guided by Clustering on Nonstationary Environments and Extreme Verification Latency.",Vinícius M. A. de Souza; Diego Furtado Silva; João Gama; Gustavo E. A. P. A. Batista,https://doi.org/10.1137/1.9781611974010.98,null,C,no_arxiv,17
2014,Data Min. Knowl. Discov.,"CID: an efficient complexity-invariant distance for time series.",Gustavo E. A. P. A. Batista; Eamonn J. Keogh; Oben Moses Tataw; Vinícius M. A. de Souza,https://doi.org/10.1007/s10618-013-0312-3,null,J,no_arxiv,71
2015,J. Intelligent & Robotic Syst.,"Exploring Low Cost Laser Sensors to Identify Flying Insect Species - Evaluation of Machine Learning and Signal Processing Methods.",Diego Furtado Silva; Vinícius M. A. de Souza; Daniel P. W. Ellis; Eamonn J. Keogh; Gustavo E. A. P. A. Batista,https://doi.org/10.1007/s10846-014-0168-9,null,J,no_arxiv,19
