2018,IST,"Feature interaction in software product line engineering: A systematic mapping study.",Larissa Rocha Soares; Pierre-Yves Schobbens; Ivan do Carmo Machado; Eduardo Santana de Almeida,https://doi.org/10.1016/j.infsof.2018.01.016,null,J,no_arxiv,1
2018,JSS,"On the implementation of dynamic software product lines: An exploratory study.",Michelle Larissa Luciano Carvalho; Matheus Lessa Goncalves Da Silva; Gecynalda Soares da Silva Gomes; Alcemir Rodrigues Santos; Ivan do Carmo Machado; Magno Lua de Jesus Souza; Eduardo Santana de Almeida,https://doi.org/10.1016/j.jss.2017.11.004,null,J,no_arxiv,1
2016,JSS,"Towards semi-automated assignment of software change requests.",Yguaratã Cerqueira Cavalcanti; Ivan do Carmo Machado; Paulo Anselmo da Motal S. Neto; Eduardo Santana de Almeida,https://doi.org/10.1016/j.jss.2016.01.038,null,J,no_arxiv,1
2016,SPLC,"RiPLE-HC: javascript systems meets spl composition.",Alcemir Rodrigues Santos; Ivan do Carmo Machado; Eduardo Santana de Almeida,https://doi.org/10.1145/2934466.2934486,null,C,no_arxiv,2
2014,IST,"On strategies for testing software product lines: A systematic literature review.",Ivan do Carmo Machado; John D. McGregor; Yguaratã Cerqueira Cavalcanti; Eduardo Santana de Almeida,https://doi.org/10.1016/j.infsof.2014.04.002,null,J,no_arxiv,30
2014,JSEP,"Challenges and opportunities for software change request repositories: a systematic mapping study.",Yguaratã Cerqueira Cavalcanti; Paulo Anselmo da Mota Silveira Neto; Ivan do Carmo Machado; Tassio Ferreira Vale; Eduardo Santana de Almeida; Silvio Romero de Lemos Meira,https://doi.org/10.1002/smr.1639,null,J,no_arxiv,12
