2018,Annals OR,"And/or-convexity: a graph convexity based on processes and deadlock models.",Carlos Vinícius G. C. Lima; Fábio Protti; Dieter Rautenbach; Uéverton S. Souza; Jayme Luiz Szwarcfiter,https://doi.org/10.1007/s10479-017-2666-1,null,J,no_arxiv,0
2018,Annals OR,"Perfect edge domination: hard and solvable cases.",Min Chih Lin; Vadim V. Lozin; Veronica A. Moyano; Jayme Luiz Szwarcfiter,https://doi.org/10.1007/s10479-017-2664-3,null,J,http://arxiv.org/abs/1705.08379v1,0
2013,Annals OR,"Algorithmic and structural aspects of the P 3-Radon number.",Mitre Costa Dourado; Dieter Rautenbach; Vinícius Fernandes dos Santos; Philipp Matthias Schäfer; Jayme Luiz Szwarcfiter; Alexandre Toman,https://doi.org/10.1007/s10479-013-1320-9,null,J,no_arxiv,2
2014,LATIN,"O(n) Time Algorithms for Dominating Induced Matching Problems.",Min Chih Lin; Michel J. Mizrahi; Jayme Luiz Szwarcfiter,https://doi.org/10.1007/978-3-642-54423-1_35,null,C,no_arxiv,1
2013,ISAAC,"An O *(1.1939 n ) Time Algorithm for Minimum Weighted Dominating Induced Matching.",Min Chih Lin; Michel J. Mizrahi; Jayme Luiz Szwarcfiter,https://doi.org/10.1007/978-3-642-45030-3_52,null,C,no_arxiv,3
2013,WG,"Towards a Provably Resilient Scheme for Graph-Based Watermarking.",Lucila Maria Souza Bento; Davidson R. Boccardo; Raphael Carlos Santos Machado; Vinícius Gusmão Pereira de Sá; Jayme Luiz Szwarcfiter,https://doi.org/10.1007/978-3-642-45043-3_6,null,C,no_arxiv,1
