2017,PRL,"Optimum-Path Forest based on k-connectivity: Theory and applications.",João Paulo Papa; Silas Evandro Nachif Fernandes; Alexandre Xavier Falcão,https://doi.org/10.1016/j.patrec.2016.07.026,null,J,no_arxiv,12
2017,PRL,"A binary-constrained Geometric Semantic Genetic Programming for feature selection purposes.",João Paulo Papa; Gustavo Henrique Rosa; Luciene P. Papa,https://doi.org/10.1016/j.patrec.2017.10.002,null,J,no_arxiv,2
2016,PR,"Improving semi-supervised learning through optimum connectivity.",Willian Paraguassu Amorim; Alexandre X. Falcão; João P. Papa; Marcelo H. de Carvalho,https://doi.org/10.1016/j.patcog.2016.04.020,null,J,no_arxiv,5
2016,PRL,"A new approach to contextual learning using interval arithmetic and its applications for land-use classification.",Danillo Roberto Pereira; João Paulo Papa,https://doi.org/10.1016/j.patrec.2016.03.020,null,J,no_arxiv,1
2014,PRL,"A path- and label-cost propagation approach to speedup the training of the optimum-path forest classifier.",Adriana S. Iwashita; João Paulo Papa; André N. de Souza; Alexandre X. Falcão; Roberto de Alencar Lotufo; V. M. Oliveira; Victor Hugo C. de Albuquerque; João Manuel R. S. Tavares,https://doi.org/10.1016/j.patrec.2013.12.018,null,J,no_arxiv,20
2014,ICPR,"A Binary Krill Herd Approach for Feature Selection.",Douglas Rodrigues; Luis A. M. Pereira; João Paulo Papa; Silke A. T. Weber,https://doi.org/10.1109/ICPR.2014.251,null,C,no_arxiv,3
2014,ICPR,"On the Training of Artificial Neural Networks with Radial Basis Function Using Optimum-Path Forest Clustering.",Gustavo H. Rosa; Kelton A. P. Costa; Leandro A. Passos Junior; João Paulo Papa; Alexandre X. Falcão; João Manuel R. S. Tavares,https://doi.org/10.1109/ICPR.2014.262,null,C,no_arxiv,3
