2022,Applied Soft Comput.,"QDS-COVID: A visual analytics system for interactive exploration of millions of COVID-19 healthcare records in Brazil.",Juan C. Carbajal Ipenza; Noemí Maritza Lapa Romero; Melina Loreto; Nivan Ferreira Júnior; João Luiz Dihl Comba,https://doi.org/10.1016/j.asoc.2022.109093,null,J,no_arxiv,0
2020,Future Generation CS,"Visual exploration of rating datasets and user groups.",Fabian Colque Zegarra; Juan C. Carbajal Ipenza; Behrooz Omidvar-Tehrani; Viviane P. Moreira; Sihem Amer-Yahia; João Luiz Dihl Comba,https://doi.org/10.1016/j.future.2019.12.011,null,J,no_arxiv,0
2023,Proc. VLDB,"SHEVA: A Visual Analytics System for Statistical Hypothesis Exploration.",Vicente Nejar de Almeida; Eduardo Ribeiro; Nassim Bouarour; João Luiz Dihl Comba; Sihem Amer-Yahia,https://www.vldb.org/pvldb/vol16/p4102-almeida.pdf,top,J,no_arxiv,0
2021,Computer Graphics Forum,"Guided Stable Dynamic Projections.",Eduardo Faccin Vernier; João Luiz Dihl Comba; Alexandru C. Telea,https://doi.org/10.1111/cgf.14291,null,J,no_arxiv,0
2020,Computer Graphics Forum,"Quantitative Evaluation of Time-Dependent Multidimensional Projection Techniques.",Eduardo Faccin Vernier; Rafael Garcia; Iron Prando da Silva; João Luiz Dihl Comba; Alexandru C. Telea,https://doi.org/10.1111/cgf.13977,null,J,no_arxiv,0
2020,Computer Graphics Forum,"Quantitative Comparison of Time-Dependent Treemaps.",Eduardo Faccin Vernier; Max Sondag; João Luiz Dihl Comba; Bettina Speckmann; Alexandru C. Telea; Kevin Verbeek,https://doi.org/10.1111/cgf.13989,null,J,no_arxiv,0
2020,IEEE TVCG,"Real-Time Exploration of Large Spatiotemporal Datasets Based on Order Statistics.",Cícero A. L. Pahins; Nivan Ferreira; João Luiz Dihl Comba,https://doi.org/10.1109/TVCG.2019.2914446,top,J,no_arxiv,0
