2016,Future Generation CS,"A provenance model based on declarative specifications for intensive data analyses in hemotherapy information systems.",Fernanda Nascimento Almeida; Gisela Tunes-da-Silva; Julio Cezar Brettas da Costa; Ester Cerdeira Sabino; Alfredo Mendrone-Junior; João Eduardo Ferreira,https://doi.org/10.1016/j.future.2015.09.019,null,J,no_arxiv,0
2015,BMC Bioinformatics,"Data-intensive analysis of HIV mutations.",Mina Ozahata; Ester C. Sabino; Ricardo Diaz; Roberto Marcondes Cesar Jr.; João Eduardo Ferreira,https://doi.org/10.1186/s12859-015-0452-0,null,J,no_arxiv,0
2018,BigData,"Integrating the University of São Paulo Security Mobile App to the Electronic Monitoring System.",João Eduardo Ferreira; Jose Antonio Visintin; Jun Okamoto; Mauro César Bernardes; Adriano Paterlini; Alexander Csoka Roque; Moises Ramalho Miguel,https://doi.org/10.1109/BigData.2018.8622069,null,C,no_arxiv,0
2020,Proc. VLDB,"ODIN: Automated Drift Detection and Recovery in Video Analytics.",Abhijit Suprem; Joy Arulraj; Calton Pu; João Eduardo Ferreira,http://www.vldb.org/pvldb/vol13/p2453-suprem.pdf,top,J,http://arxiv.org/abs/2009.05440v1,0
2020,CLOUD,"Wise Toolkit: Enabling Microservice-Based System Performance Experiments.",Rodrigo Alves Lima; Joshua Kimball; João Eduardo Ferreira; Calton Pu,https://doi.org/10.1007/978-3-030-59635-4_11,null,C,no_arxiv,0
2019,CLOUD,"Systematic Construction, Execution, and Reproduction of Complex Performance Benchmarks.",Rodrigo Alves Lima; Joshua Kimball; João Eduardo Ferreira; Calton Pu,https://doi.org/10.1007/978-3-030-23502-4_3,null,C,no_arxiv,0
2020,ACM TOIT,"Beyond Artificial Reality: Finding and Monitoring Live Events from Social Sensors.",Calton Pu; Abhijit Suprem; Rodrigo Alves Lima; Aibek Musaev; De Wang; Danesh Irani; Steve Webb; João Eduardo Ferreira,https://doi.org/10.1145/3374214,top,J,no_arxiv,0
2020,Computers & OR,"A filtered beam search method for the -machine permutation flowshop scheduling problem minimizing the earliness and tardiness penalties and the waiting time of the jobs.",Ernesto G. Birgin; João Eduardo Ferreira; Débora P. Ronconi,https://doi.org/10.1016/j.cor.2019.104824,null,J,no_arxiv,0
2015,EJOR,"List scheduling and beam search methods for the flexible job shop scheduling problem with sequencing flexibility.",Ernesto G. Birgin; João Eduardo Ferreira; Débora P. Ronconi,https://doi.org/10.1016/j.ejor.2015.06.023,null,J,no_arxiv,0
