2020,Applied Soft Comput.,"A metric for Filter Bubble measurement in recommender algorithms considering the news domain.",Gabriel Machado Lunardi; Guilherme Medeiros Machado; Vinícius Maran; José Palazzo M. de Oliveira,https://doi.org/10.1016/j.asoc.2020.106771,null,J,no_arxiv,0
2019,Applied Soft Comput.,"Situation-aware model for multi-objective decision making in ambient intelligence.",Milene Santos Teixeira; Vinícius Maran; José Palazzo Moreira de Oliveira; Michael Winter 0001; Alencar Machado,https://doi.org/10.1016/j.asoc.2019.105532,null,J,no_arxiv,0
2017,Expert Systems Appl.,"Reactive, proactive, and extensible situation-awareness in ambient assisted living.",Alencar Machado; Vinícius Maran; Iara Augustin; Leandro Krug Wives; José Palazzo Moreira de Oliveira,https://doi.org/10.1016/j.eswa.2017.01.033,null,J,no_arxiv,0
2020,Data & Knowl. Eng.,"An analysis of the collaboration network of the International Conference on Conceptual Modeling at the Age of 40.",Lucas Henrique C. Lima; Alberto H. F. Laender; Mirella M. Moro; José Palazzo M. de Oliveira,https://doi.org/10.1016/j.datak.2020.101866,null,J,no_arxiv,0
2018,Data & Knowl. Eng.,"Domain content querying using ontology-based context-awareness in information systems.",Vinícius Maran; Alencar Machado; Guilherme Medeiros Machado; Iara Augustin; José Palazzo M. de Oliveira,https://doi.org/10.1016/j.datak.2018.03.003,null,J,no_arxiv,0
2017,IST,"An experiment on an ontology-based support approach for process modeling.",Jonas Bulegon Gassen; Jan Mendling; Amel Bouzeghoub; Lucinéia Heloisa Thom; José Palazzo M. de Oliveira,https://doi.org/10.1016/j.infsof.2016.11.005,null,J,no_arxiv,0
