2025,Expert Systems Appl.,"PATSA-BIL: Pipeline for automated texture and structure analysis of borehole image logs.",André M. Souza; Matheus A. Cruz; Paola M. C. Braga; Rodrigo B. Piva; Rodrigo A. C. Dias; Paulo R. Siqueira; Willian A. Trevizan; Candida M. de Jesus; Camilla Bazzarella; Rodrigo Salvador Monteiro; Flávia Cristina Bernardini; Leandro A. F. Fernandes; Elaine P. M. de Sousa; Daniel de Oliveira 0001; Marcos Bedo,https://doi.org/10.1016/j.eswa.2025.127345,null,J,no_arxiv,0
2022,Expert Systems Appl.,"Linear and geometric algebra approaches for sphere and spherical shell intersections in Rn.",Carlile Lavor; Rafael Alves; Leandro A. F. Fernandes,https://doi.org/10.1016/j.eswa.2021.115993,null,J,no_arxiv,0
2024,Computers & Graphics,"From past to present: A tertiary investigation of twenty-four years of image inpainting.",Iany Macedo Barcelos; Taís Bruno Rabelo; Flavia Bernardini; Rodrigo Salvador Monteiro; Leandro Augusto Frata Fernandes,https://doi.org/10.1016/j.cag.2024.104010,null,J,no_arxiv,0
2024,CVIU,"Semantic manipulation through the lens of Geometric Algebra.",Raphael dos S. Evangelista; Andre Luiz da S. Pereira; Rogério Ferreira de Moraes; Leandro A. F. Fernandes,https://doi.org/10.1016/j.cviu.2023.103899,null,J,no_arxiv,0
2023,CVIU,"Improving the planarity and sharpness of monocularly estimated depth images using the Phong reflection model.",Roger Ripas; Leandro A. F. Fernandes,https://doi.org/10.1016/j.cviu.2023.103726,null,J,no_arxiv,0
2023,PRL,"An analysis of ConformalLayers' robustness to corruptions in natural images.",Eduardo Vera Sousa; Cristina Nader Vasconcelos; Leandro A. F. Fernandes,https://doi.org/10.1016/j.patrec.2022.11.002,null,J,no_arxiv,0
