2019,ACM Comput. Surveys,"Machine Learning in Network Centrality Measures: Tutorial and Outlook.",Felipe Grando; Lisandro Zambenedetti Granville; Luís C. Lamb,https://doi.org/10.1145/3237192,null,J,http://arxiv.org/abs/1810.11760v1,0
2018,IEEE Internet Computing,"Considering Jurisdiction When Assessing End-to-End Network Neutrality.",Marcio Barbosa de Carvalho; Vinicius Garcez Schaurich; Lisandro Zambenedetti Granville,https://doi.org/10.1109/MIC.2018.2877836,null,J,no_arxiv,0
2022,IEEE Comm. Magazine,"NFV Anomaly Detection: Case Study through a Security Module.",Lucas Bondan; Tim Wauters; Bruno Volckaert; Filip De Turck; Lisandro Zambenedetti Granville,https://doi.org/10.1109/MCOM.001.2100408,null,J,no_arxiv,0
2022,Computer Networks,"JurisNN: Judging traffic differentiations as network neutrality violations according to the regulation.",Márcio Barbosa de Carvalho; Lisandro Zambenedetti Granville,https://doi.org/10.1016/j.comnet.2021.108738,null,J,no_arxiv,0
2022,Computer Networks,"A deterministic approach for extracting network security intents.",Rafael Hengen Ribeiro; Arthur Selle Jacobs; Luciano Zembruzki; Ricardo Parizotto; Eder John Scheid; Alberto Egon Schaeffer Filho; Lisandro Zambenedetti Granville; Burkhard Stiller,https://doi.org/10.1016/j.comnet.2022.109109,null,J,no_arxiv,0
2022,CNSM,"On the Asymmetry of Internet eXchange Points -Why Should IXPs and CDNs Care?",Leandro M. Bertholdo; Sandro L. A. Ferreira; João M. Ceron; Lisandro Zambenedetti Granville; Ralph Holz; Roland van Rijswijk-Deij,https://doi.org/10.23919/CNSM55787.2022.9964817,null,C,no_arxiv,0
2022,NOMS,"Hosting Industry Centralization and Consolidation.",Luciano Zembruzki; Raffaele Sommese; Lisandro Zambenedetti Granville; Arthur Selle Jacobs; Mattijs Jonker; Giovane C. M. Moura,https://doi.org/10.1109/NOMS54207.2022.9789881,null,C,http://arxiv.org/abs/2109.01187v2,0
2021,IM,"Delay-aware Slicing and MAC Management using MCDA in IEEE 802.11 SD-RANs.",Pedro Heleno Isolani; Daniel J. Kulenkamp; Johann M. Márquez-Barja; Lisandro Zambenedetti Granville; Steven Latré; Violet R. Syrotiuk,https://ieeexplore.ieee.org/document/9463961,null,C,no_arxiv,0
2021,IM,"On the Transition of Legacy Networks to SDN - An Analysis on the Impact of Deployment Time, Number, and Location of Controllers.",Diogo Ferreira Thé Pontes; Marcos Fagundes Caetano; Geraldo Pereira Rocha Filho; Lisandro Zambenedetti Granville; Marcelo Antonio Marotta,https://ieeexplore.ieee.org/document/9464046,null,C,no_arxiv,0
2020,Computer Networks,"FT-Aurora: A highly available IaaS cloud manager based on replication.",Gustavo B. Heimovski; Rogério C. Turchetti; Juliano Araujo Wickboldt; Lisandro Zambenedetti Granville; Elias P. Duarte Jr.,https://doi.org/10.1016/j.comnet.2019.107041,null,J,no_arxiv,0
2020,Computer Networks,"IPro: An approach for intelligent SDN monitoring.",Edwin Ferney Castillo; Oscar Maurício Caicedo Rendón; Armando Ordóñez 0001; Lisandro Zambenedetti Granville,https://doi.org/10.1016/j.comnet.2020.107108,null,J,no_arxiv,0
2020,Computer Networks,"Virtual Network Functions Migration Cost: from Identification to Prediction.",Rafael de Jesus Martins; Cristiano Bonato Both; Juliano Araujo Wickboldt; Lisandro Zambenedetti Granville,https://doi.org/10.1016/j.comnet.2020.107429,null,J,no_arxiv,0
2020,CNSM,"SWEETEN: Automated Network Management Provisioning for 5G Microservices-Based Virtual Network Functions.",Rafael de Jesus Martins; Ariel Galante Dalla-Costa; Juliano Araujo Wickboldt; Lisandro Zambenedetti Granville,https://doi.org/10.23919/CNSM50824.2020.9269063,null,C,no_arxiv,0
2020,Networking,"Quantifying the Influence of Regulatory Instructions over the Detection of Network Neutrality Violations.",Marcio Barbosa de Carvalho; Vitor A. Cunha; Eduardo da Silva; Daniel Corujo; João Paulo Barraca; Rui L. Aguiar; Lisandro Zambenedetti Granville,https://ieeexplore.ieee.org/document/9142809,null,C,no_arxiv,0
2019,IEEE Comm. Magazine,"FENDE: Marketplace-Based Distribution, Execution, and Life Cycle Management of VNFs.",Lucas Bondan; Muriel Figueredo Franco; Leonardo da Cruz Marcuzzo; Giovanni Venâncio; Ricardo Luis dos Santos; Ricardo J. Pfitscher; Eder J. Scheid; Burkhard Stiller; Filip De Turck; Elias P. Duarte Jr.; Alberto E. Schaeffer Filho; Carlos Raniery Paula dos Santos; Lisandro Zambenedetti Granville,https://doi.org/10.1109/MCOM.2018.1800507,null,J,no_arxiv,0
2019,Computer Networks,"Flexible fine-grained baseband processing with network functions virtualization: Benefits and impacts.",Maicon Kist; Juliano Araujo Wickboldt; Lisandro Zambenedetti Granville; Juergen Rochol; Luiz A. DaSilva; Cristiano Bonato Both,https://doi.org/10.1016/j.comnet.2019.01.021,null,J,no_arxiv,0
2019,Computer Networks,"Guiltiness: A practical approach for quantifying virtual network functions performance.",Ricardo José Pfitscher; Arthur Selle Jacobs; Luciano Zembruzki; Ricardo Luis dos Santos; Eder John Scheid; Muriel Figueredo Franco; Alberto E. Schaeffer Filho; Lisandro Zambenedetti Granville,https://doi.org/10.1016/j.comnet.2019.06.001,null,J,no_arxiv,0
2019,IEEE Commun. Surv. Tutorials,"A Survey on the Programmability of Wireless MAC Protocols.",Pedro Heleno Isolani; Maxim Claeys; Carlos Donato; Lisandro Zambenedetti Granville; Steven Latré,https://doi.org/10.1109/COMST.2018.2881761,null,J,no_arxiv,0
2019,IM,"Enabling Dynamic SLA Compensation Using Blockchain-based Smart Contracts.",Eder John Scheid; Bruno Rodrigues 0001; Lisandro Zambenedetti Granville; Burkhard Stiller,http://dl.ifip.org/db/conf/im/im2019/188772.pdf,null,C,no_arxiv,0
2019,Networking,"BRAIN: Blockchain-based Reverse Auction for Infrastructure Supply in Virtual Network Functions-as-a -Service.",Muriel Figueredo Franco; Eder John Scheid; Lisandro Zambenedetti Granville; Burkhard Stiller,https://doi.org/10.23919/IFIPNetworking.2019.8816843,null,C,no_arxiv,0
2018,IEEE Comm. Magazine,"MEICAN: Simplifying DCN Life-Cycle Management from End-User and Operator Perspectives in Inter-Domain Environments.",Juliano Araujo Wickboldt; Mauricio Quatrin Guerreiro; Lisandro Zambenedetti Granville; Luciano Paschoal Gaspary; Marcos Felipe Schwarz; Chin Guok; Vangelis Chaniotakis; Andrew Lake; John Macauley,https://doi.org/10.1109/MCOM.2017.1601205,null,J,no_arxiv,0
2018,IEEE Commun. Surv. Tutorials,"Network-Wide Initiatives to Control Measurement Mechanisms: A Survey.",Jéferson Campos Nobre; Bruno Augusti Mozzaquatro; Lisandro Zambenedetti Granville,https://doi.org/10.1109/COMST.2018.2797170,null,J,no_arxiv,0
2018,NOMS,"Artificial neural network model to predict affinity for virtual network functions.",Arthur Selle Jacobs; Ricardo José Pfitscher; Ricardo Luis dos Santos; Muriel Figueredo Franco; Eder John Scheid; Lisandro Zambenedetti Granville,https://doi.org/10.1109/NOMS.2018.8406253,null,C,no_arxiv,0
2018,NOMS,"A model for quantifying performance degradation in virtual network function service chains.",Ricardo J. Pfitscher; Arthur Selle Jacobs; Eder J. Scheid; Muriel Figueredo Franco; Ricardo Luis dos Santos; Alberto E. Schaeffer Filho; Lisandro Zambenedetti Granville,https://doi.org/10.1109/NOMS.2018.8406268,null,C,no_arxiv,0
2022,CCS,"AI/ML for Network Security: The Emperor has no Clothes.",Arthur Selle Jacobs; Roman Beltiukov; Walter Willinger; Ronaldo A. Ferreira; Arpit Gupta; Lisandro Z. Granville,https://doi.org/10.1145/3548606.3560609,top,C,no_arxiv,0
