2019,Concurrency and Computation,"Performance modeling of a geophysics application to accelerate over-decomposition parameter tuning through simulation.",Rafael Keller Tesser; Lucas Mello Schnorr; Arnaud Legrand; Franz Christian Heinrich; Fabrice Dupros; Philippe O. A. Navaux,https://doi.org/10.1002/cpe.5012,null,J,no_arxiv,1
2018,Concurrency and Computation,"A visual performance analysis framework for task-based parallel applications running on hybrid clusters.",Vinícius Garcia Pinto; Lucas Mello Schnorr; Luka Stanisic; Arnaud Legrand; Samuel Thibault; Vincent Danjean,https://doi.org/10.1002/cpe.4472,null,J,no_arxiv,0
2017,Concurrency and Computation,"Performance and energy efficiency analysis of HPC physics simulation applications in a cluster of ARM processors.",Jean Luca Bez; Eliezer E. Bernart; Fernando Fernandes dos Santos; Lucas Mello Schnorr; Philippe Olivier Alexandre Navaux,https://doi.org/10.1002/cpe.4014,null,J,no_arxiv,4
2017,Euro-Par,"Using Simulation to Evaluate and Tune the Performance of Dynamic Load Balancing of an Over-Decomposed Geophysics Application.",Rafael Keller Tesser; Lucas Mello Schnorr; Arnaud Legrand; Fabrice Dupros; Philippe Olivier Alexandre Navaux,https://doi.org/10.1007/978-3-319-64203-1_14,null,C,no_arxiv,2
2017,PDP,"TWINS: Server Access Coordination in the I/O Forwarding Layer.",Jean Luca Bez; Francieli Zanon Boito; Lucas Mello Schnorr; Philippe O. A. Navaux; Jean-François Méhaut,https://doi.org/10.1109/PDP.2017.61,null,C,no_arxiv,3
2016,Inf. Sciences,"PhenoVis - A tool for visual phenological analysis of digital camera images using chronological percentage maps.",Roger A. Leite; Lucas Mello Schnorr; Jurandy Almeida; Bruna Alberton; Leonor Patricia C. Morellato; Ricardo da Silva Torres; João Luiz Dihl Comba,https://doi.org/10.1016/j.ins.2016.08.052,null,J,no_arxiv,4
