2020,ACM TOMM,"Dissecting the Performance of VR Video Streaming through the VR-EXP Experimentation Platform.",Roberto Irajá Tavares da Costa Filho; Marcelo Caggiani Luizelli; Stefano Petrangeli; Maria Torres Vega; Jeroen van der Hooft; Tim Wauters; Filip De Turck; Luciano Paschoal Gaspary,https://doi.org/10.1145/3360286,top,J,no_arxiv,0
2024,CNSM,"Multi-Tenant Programmable Switch Virtualization Leveraging Explicit Resource Sharing.",Ivan Peter Lamb; Pedro Arthur Pinheiro Rosa Duarte; Marcelo Caggiani Luizelli; Luciano Paschoal Gaspary; José Rodrigo Azambuja; Weverton Luis sa Costa Cordeiro,https://doi.org/10.23919/CNSM62983.2024.10814530,null,C,no_arxiv,0
2023,NOMS,"Responding to Network Failures at Data-plane Speeds with Network Programmability.",Jonatas Adilson Marques; Kirill Levchenko; Luciano Paschoal Gaspary,https://doi.org/10.1109/NOMS56928.2023.10154329,null,C,no_arxiv,0
2022,IEEE Comm. Magazine,"Managing Virtual Programmable Switches: Principles, Requirements, and Design Directions.",Guilherme Bueno; Mateus Saquetti; Pablo Rodrigues; Ivan Peter Lamb; Luciano Paschoal Gaspary; Marcelo Caggiani Luizelli; Mohamed Faten Zhani; José Rodrigo Azambuja; Weverton Cordeiro,https://doi.org/10.1109/MCOM.001.2100363,null,J,no_arxiv,0
2021,IM,"Programmable Low-End Networks: Powering Internet Connectivity for the Other Three Billion.",André Scheibe; Willian Reichert; Luciano Paschoal Gaspary; Weverton Cordeiro,https://ieeexplore.ieee.org/document/9464039,null,C,no_arxiv,0
2021,IM,"BUNGEE: An Adaptive Pushback Mechanism for DDoS Detection and Mitigation in P4 Data Planes.",Libardo Andrey Quintero González; Lucas Castanheira; Jonatas Adilson Marques; Alberto Schaeffer-Filho; Luciano Paschoal Gaspary,https://ieeexplore.ieee.org/document/9463992,null,C,no_arxiv,0
2020,J. Network Computer App.,"Reality shock in virtual network embedding: Flexibilizing demands for dealing with multiple operational requirements in SDNs.",Leonardo Richter Bays; Luciano Paschoal Gaspary,https://doi.org/10.1016/j.jnca.2019.102508,null,J,no_arxiv,0
2020,IEEE Trans. Net. Service  Mgmt.,"CAPEST: Offloading Network Capacity and Available Bandwidth Estimation to Programmable Data Planes.",Nicolas Kagami; Roberto Irajá Tavares da Costa Filho; Luciano Paschoal Gaspary,https://doi.org/10.1109/TNSM.2019.2934316,null,J,no_arxiv,0
2020,CoNEXT,"IntSight: diagnosing SLO violations with in-band network telemetry.",Jonatas Adilson Marques; Kirill Levchenko; Luciano Paschoal Gaspary,https://doi.org/10.1145/3386367.3431306,null,C,no_arxiv,0
