2020,GECCO,"A biased random key genetic algorithm applied to the VRPTW with skill requirements and synchronization constraints.",Alberto Francisco Kummer Neto; Luciana S. Buriol; Olinto César Bassi de Araújo,https://doi.org/10.1145/3377930.3390209,null,C,no_arxiv,0
2024,ITOR,"A biased random-key genetic algorithm for the home health care problem.",Alberto Francisco Kummer Neto; Olinto C. B. de Araújo; Luciana S. Buriol; Mauricio G. C. Resende,https://doi.org/10.1111/itor.13221,null,J,no_arxiv,0
2024,ITOR,"Comparative analysis of mathematical formulations for the two-dimensional guillotine cutting problem.",Henrique Becker; Mateus Martin; Olinto C. B. de Araújo; Luciana S. Buriol; Reinaldo Morabito,https://doi.org/10.1111/itor.13358,null,J,no_arxiv,0
2022,Computers & OR,"A relax-and-fix and fix-and-optimize algorithm for a Maritime Inventory Routing Problem.",Marcelo Wuttig Friske; Luciana S. Buriol; Eduardo Camponogara,https://doi.org/10.1016/j.cor.2021.105520,null,J,no_arxiv,0
2021,Annals OR,"An integer programming approach for the physician rostering problem.",Toni Ismael Wickert; Alberto Francisco Kummer Neto; Márcio M. Boniatti; Luciana S. Buriol,https://doi.org/10.1007/s10479-020-03552-5,null,J,no_arxiv,0
2020,Computers & OR,"A study on the pickup and delivery problem with time windows: Matheuristics and new instances.",Carlo S. Sartori; Luciana S. Buriol,https://doi.org/10.1016/j.cor.2020.105065,null,J,no_arxiv,0
