2021,Int. J. HC Studies,"UX information in the daily work of an agile team: A distributed cognition analysis.",Luciana A. M. Zaina; Helen Sharp; Leonor Barroca 0001,https://doi.org/10.1016/j.ijhcs.2020.102574,null,J,no_arxiv,0
2019,EICS,"PWA-EU: Extending PWA Approach for Promoting Customization based on User Preferences.",Giulia de Andrade Cardieri; Luciana A. M. Zaina,https://doi.org/10.1145/3331152,null,C,no_arxiv,0
2018,Interact. Comput.,"An Empirical Evidence of Barriers in a Big Data Infrastructure.",Hashim Iqbal Chunpir; Torsten Rathmann; Luciana Martinez Zaina,https://doi.org/10.1093/iwc/iwy024,null,J,no_arxiv,0
2020,IEEE Trans. Net. Service  Mgmt.,"Usability Matters: A Human-Computer Interaction Study on Network Management Tools.",Fábio Luciano Verdi; Hélio Tibagí de Oliveira; Leobino N. Sampaio; Luciana A. M. Zaina,https://doi.org/10.1109/TNSM.2020.2987036,null,J,no_arxiv,0
2022,IST,"An approach to explore sequential interactions in cognitive activities of software engineering.",Joelma Choma; Eduardo M. Guerra 0001; Tiago Silva da Silva; Luciana Martinez Zaina,https://doi.org/10.1016/j.infsof.2021.106730,null,J,no_arxiv,0
2021,IST,"UX work in software startups: A thematic analysis of the literature.",Jullia Saad; Suellen Martinelli; Letícia S. Machado; Cleidson R. B. de Souza; Alexandre Alvaro; Luciana Aparecida Martinez Zaina,https://doi.org/10.1016/j.infsof.2021.106688,null,J,no_arxiv,0
