2021,Networks,"Optimizing concurrency under Scheduling by Edge Reversal.",Carlos E. Marciano; Gladstone M. Arantes Jr.; Abilio Lucena; Luidi Gelabert Simonetti; Luérbio Faria; Felipe M. G. França,https://doi.org/10.1002/net.22014,null,J,no_arxiv,0
2023,Discrete Applied Math.,"Results about the total chromatic number and the conformability of some families of circulant graphs.",Luérbio Faria; Mauro Nigro; Myriam Preissmann; Diana Sasaki,https://doi.org/10.1016/j.dam.2023.07.003,null,J,no_arxiv,0
2023,Discrete Mathematics,"Partitions and well-coveredness: The graph sandwich problem.",Sancrey Rodrigues Alves; Fernanda Couto; Luérbio Faria; Sylvain Gravier; Sulamita Klein; Uéverton S. Souza,https://doi.org/10.1016/j.disc.2022.113253,null,J,no_arxiv,0
2022,Theor. Comput. Sci.,"On the probe problem for (, )-well-coveredness: Algorithms and complexity.",Luérbio Faria; Uéverton S. Souza,https://doi.org/10.1016/j.tcs.2022.08.006,null,J,no_arxiv,0
2020,Discrete Applied Math.,"Characterizations, probe and sandwich problems on (k, ℓ)-cographs.",Fernanda Couto; Luérbio Faria; Sylvain Gravier; Sulamita Klein; Vinícius Fernandes dos Santos,https://doi.org/10.1016/j.dam.2020.04.002,null,J,no_arxiv,0
2020,Discrete Applied Math.,"Maximum cuts in edge-colored graphs.",Luérbio Faria; Sulamita Klein; Ignasi Sau; Uéverton S. Souza; Rubens Sucupira,https://doi.org/10.1016/j.dam.2019.02.038,null,J,no_arxiv,0
2020,LATIN,"Graph Sandwich Problem for the Property of Being Well-Covered and Partitionable into k Independent Sets and ℓ Cliques.",Sancrey Rodrigues Alves; Fernanda Couto; Luérbio Faria; Sylvain Gravier; Sulamita Klein; Uéverton S. Souza,https://doi.org/10.1007/978-3-030-61792-9_46,null,C,no_arxiv,0
