2018,PACT,"VW-SLP: auto-vectorization with adaptive vector width.",Vasileios Porpodas; Rodrigo C. O. Rocha; Luís F. W. Góes,https://doi.org/10.1145/3243176.3243189,null,C,no_arxiv,0
2017,Concurrency and Computation,"CAP Bench: a benchmark suite for performance and energy evaluation of low-power many-core processors.",Matheus A. Souza; Pedro Henrique Penna; Matheus M. Queiroz; Alyson D. Pereira; Luís Fabrício Wanderley Góes; Henrique C. Freitas; Márcio Castro; Philippe O. A. Navaux; Jean-François Méhaut,https://doi.org/10.1002/cpe.3892,null,J,no_arxiv,2
2017,Concurrency and Computation,"TOAST: Automatic tiling for iterative stencil computations on GPUs.",Rodrigo C. O. Rocha; Alyson D. Pereira; Luiz Ramos; Luís F. W. Góes,https://doi.org/10.1002/cpe.4053,null,J,no_arxiv,5
2015,Concurrency and Computation,"PSkel: A stencil programming framework for CPU-GPU systems.",Alyson D. Pereira; Luiz Eduardo da Silva Ramos; Luís Fabrício Wanderley Góes,https://doi.org/10.1002/cpe.3479,null,J,no_arxiv,11
2019,SCP,"Automatic parallelization of recursive functions with rewriting rules.",Rodrigo C. O. Rocha; Luís F. W. Góes; Fernando Magno Quintão Pereira,https://doi.org/10.1016/j.scico.2018.01.004,null,J,no_arxiv,0
2019,CGO,"Super-Node SLP: Optimized Vectorization for Code Sequences Containing Operators and Their Inverse Elements.",Vasileios Porpodas; Rodrigo C. O. Rocha; Evgueni Brevnov; Luís F. W. Góes; Timothy G. Mattson,https://doi.org/10.1109/CGO.2019.8661192,null,C,no_arxiv,0
2018,CGO,"Look-ahead SLP: auto-vectorization in the presence of commutative operations.",Vasileios Porpodas; Rodrigo C. O. Rocha; Luís F. W. Góes,https://doi.org/10.1145/3168807,null,C,no_arxiv,1
