2017,PDP,"Softening Up the Network for Scientific Applications.",Celio Trois; Luis Carlos Erpen De Bona; Marcos Didonet Del Fabro; Magnos Martinello; Sarvesh Bidkar; Reza Nejabati; Dimitra Simeonidou,https://doi.org/10.1109/PDP.2017.19,null,C,no_arxiv,0
2020,Concurr. & Computation,"ControlChain: A new stage on the IoT access control authorization.",Otto Julio Ahlert Pinno; André Ricardo Abed Grégio; Luis Carlos Erpen De Bona,https://doi.org/10.1002/cpe.5238,null,J,no_arxiv,0
2021,Computer Networks,"A Holistic Approach for Locating Traffic Differentiation in the Internet.",Thiago Garrett; Luis C. E. Bona; Elias Procópio Duarte Jr.,https://doi.org/10.1016/j.comnet.2021.108489,null,J,no_arxiv,0
2018,IEEE Commun. Surv. Tutorials,"Monitoring Network Neutrality: A Survey on Traffic Differentiation Detection.",Thiago Garrett; Ligia Eliana Setenareski; Leticia Mara Peres; Luis C. E. Bona; Elias Procópio Duarte Jr.,https://doi.org/10.1109/COMST.2018.2812641,null,J,no_arxiv,0
2018,MASCOTS,"Freezing Time: A New Approach for Emulating Fast Storage Devices Using VM.",Luis C. E. Bona; Alessandro Elias; Andre P. Ziviani; Toni Cortes; Ramon Nou; Marco A. Z. Alves,https://doi.org/10.1109/MASCOTS.2018.00010,null,C,no_arxiv,0
2017,Computer Comm.,"Improving the performance and reproducibility of experiments on large-scale testbeds with k-cores.",Thiago Garrett; Luis C. E. Bona; Elias Procópio Duarte Jr.,https://doi.org/10.1016/j.comcom.2017.05.016,null,J,no_arxiv,0
