2019,Expert Systems Appl.,"Multiple instance learning for histopathological breast cancer image classification.",P. J. Sudharshan; Caroline Petitjean; Fabio A. Spanhol; Luiz Eduardo Soares de Oliveira; Laurent Heutte; Paul Honeine,https://doi.org/10.1016/j.eswa.2018.09.049,null,J,no_arxiv,16
2018,Expert Systems Appl.,"Adapting dynamic classifier selection for concept drift.",Paulo R. L. Almeida; Luiz S. Oliveira; Alceu S. Britto Jr.; Robert Sabourin,https://doi.org/10.1016/j.eswa.2018.03.021,null,J,no_arxiv,12
2017,Applied Soft Comput.,"An evaluation of Convolutional Neural Networks for music classification using spectrograms.",Yandre M. G. Costa; Luiz S. Oliveira; Carlos Nascimento Silla Jr.,https://doi.org/10.1016/j.asoc.2016.12.024,null,J,no_arxiv,37
2017,Expert Systems Appl.,"Bias effect on predicting market trends with EMD.",Dennis Carnelossi Furlaneto; Luiz S. Oliveira; David Menotti; George D. C. Cavalcanti,https://doi.org/10.1016/j.eswa.2017.03.053,null,J,no_arxiv,5
2015,Expert Systems Appl.,"PKLot - A robust dataset for parking lot classification.",Paulo Ricardo Lisboa de Almeida; Luiz S. Oliveira; Alceu S. Britto Jr.; Eunelson Jose da Silva Junior; Alessandro L. Koerich,https://doi.org/10.1016/j.eswa.2015.02.009,null,J,no_arxiv,39
2017,IEEE Trans. Computers,"Towards an Energy-Efficient Anomaly-Based Intrusion Detection Engine for Embedded Systems.",Eduardo Viegas; Altair Olivo Santin; Andre Luiz Pereira de Franca; Ricardo P. Jasinski; Volnei A. Pedroni; Luiz S. Oliveira,https://doi.org/10.1109/TC.2016.2560839,null,J,no_arxiv,25
2017,Computer Networks,"Toward a reliable anomaly-based intrusion detection in real-world environments.",Eduardo Viegas; Altair Olivo Santin; Luiz S. Oliveira,https://doi.org/10.1016/j.comnet.2017.08.013,null,J,no_arxiv,13
2019,IEEE Trans. Inf. Forensics Sec.,"Characterizing and Evaluating Adversarial Examples for Offline Handwritten Signature Verification.",Luiz G. Hafemann; Robert Sabourin; Luiz S. Oliveira,https://doi.org/10.1109/TIFS.2019.2894031,null,J,http://arxiv.org/abs/1901.03398v1,2
2018,IEEE Security & Privacy,"The Need for Speed: An Analysis of Brazilian Malware Classifers.",Fabricio Ceschin; Felipe Pinage; Marcos Castilho; David Menotti; Luiz S. Oliveira; Andre Gregio,https://doi.org/10.1109/MSEC.2018.2875369,null,J,no_arxiv,0
2018,IEEE Trans. Inf. Forensics Sec.,"Learning Deep Off-the-Person Heart Biometrics Representations.",Eduardo José da S. Luz; Gladston J. P. Moreira; Luiz S. Oliveira; William Robson Schwartz; David Menotti,https://doi.org/10.1109/TIFS.2017.2784362,null,J,no_arxiv,9
2019,CVPR,"Decoupling Direction and Norm for Efficient Gradient-Based L2 Adversarial Attacks and Defenses.",Jérôme Rony; Luiz G. Hafemann; Luiz S. Oliveira; Ismail Ben Ayed; Robert Sabourin; Eric Granger,http://openaccess.thecvf.com/content_CVPR_2019/html/Rony_Decoupling_Direction_and_Norm_for_Efficient_Gradient-Based_L2_Adversarial_Attacks_CVPR_2019_paper.html,top,C,no_arxiv,
2018,PR,"A framework for dynamic classifier selection oriented by the classification problem difficulty.",Andre L. Brun; Alceu S. Britto Jr.; Luiz S. Oliveira; Fabrício Enembreck; Robert Sabourin,https://doi.org/10.1016/j.patcog.2017.10.038,null,J,no_arxiv,10
2018,PR,"Handwritten digit segmentation: Is it still necessary?",Andre G. Hochuli; Luiz S. Oliveira; Alceu de Souza Britto Jr.; Robert Sabourin,https://doi.org/10.1016/j.patcog.2018.01.004,null,J,no_arxiv,5
2017,PR,"Learning features for offline handwritten signature verification using deep convolutional neural networks.",Luiz G. Hafemann; Robert Sabourin; Luiz S. Oliveira,https://doi.org/10.1016/j.patcog.2017.05.012,null,J,http://arxiv.org/abs/1705.05787v1,45
2016,PRL,"Combining diversity measures for ensemble pruning.",George D. C. Cavalcanti; Luiz S. Oliveira; Thiago J. M. Moura; Guilherme V. Carvalho,https://doi.org/10.1016/j.patrec.2016.01.029,null,J,no_arxiv,22
2015,MVAP,"Forest species recognition based on dynamic classifier selection and dissimilarity feature vector representation.",J. G. Martins; Luiz S. Oliveira; Alceu S. Britto Jr.; Robert Sabourin,https://doi.org/10.1007/s00138-015-0659-0,null,J,no_arxiv,11
2015,PRL,"A new algorithm for number of holes attribute filtering of grey-level images.",Juan Climent; Luiz S. Oliveira,https://doi.org/10.1016/j.patrec.2014.10.012,null,J,no_arxiv,4
2014,MVAP,"Forest species recognition using macroscopic images.",Pedro L. Paula Filho; Luiz S. Oliveira; Silvana Nisgoski; Alceu de Souza Britto Jr.,https://doi.org/10.1007/s00138-014-0592-7,null,J,no_arxiv,22
2014,PR,"Dynamic selection of classifiers - A comprehensive review.",Alceu S. Britto Jr.; Robert Sabourin; Luiz E. Soares de Oliveira,https://doi.org/10.1016/j.patcog.2014.05.003,null,J,no_arxiv,118
