2021,IEEE Software,"On the Relationship Between Technical Debt Management and Process Models.",Nicolli Rios; Sávio Freire; Boris Perez; Camilo Castellanos; Darío Correal; Manoel G. Mendonça; Davide Falessi; Clemente Izurieta; Carolyn B. Seaman; Rodrigo Oliveira Spínola,https://doi.org/10.1109/MS.2021.3058652,null,J,no_arxiv,0
2021,IEEE Software,"Pitfalls and Solutions for Technical Debt Management in Agile Software Projects.",Sávio Freire; Nicolli Rios; Boris Pérez; Camilo Castellanos; Darío Correal; Robert Ramac; Vladimir Mandic; Nebojsa Tausan; Alexia Pacheco; Gustavo López 0001; Manoel Gomes de Mendonça Neto; Clemente Izurieta; Davide Falessi; Carolyn Seaman; Rodrigo Oliveira Spínola,https://doi.org/10.1109/MS.2021.3101990,null,J,no_arxiv,0
2020,EMSE,"The practitioners' point of view on the concept of technical debt and its causes and consequences: a design for a global family of industrial surveys and its first results from Brazil.",Nicolli Rios; Rodrigo Oliveira Spínola; Manoel G. Mendonça; Carolyn B. Seaman,https://doi.org/10.1007/s10664-020-09832-9,null,J,no_arxiv,0
2020,IST,"Identifying self-admitted technical debt through code comment analysis with a contextualized vocabulary.",Mário André de Freitas Farias; Manoel Gomes de Mendonça Neto; Marcos Kalinowski; Rodrigo Oliveira Spínola,https://doi.org/10.1016/j.infsof.2020.106270,null,J,no_arxiv,0
2018,IST,"A tertiary study on technical debt: Types, management strategies, research trends, and base information for practitioners.",Nicolli S. R. Alves; Manoel Gomes de Mendonça Neto; Rodrigo Oliveira Spínola,https://doi.org/10.1016/j.infsof.2018.05.010,null,J,no_arxiv,0
2018,JSS,"A systematic review on the code smell effect.",José Amâncio M. Santos; João B. Rocha-Junior; Luciana Carla Lins Prates; Rogeres Santos do Nascimento; Mydiã Falcão Freitas; Manoel Gomes de Mendonça Neto,https://doi.org/10.1016/j.jss.2018.07.035,null,J,no_arxiv,0
