2021,Proc. VLDB,"Data Management in Microservices: State of the Practice, Challenges, and Research Directions.",Rodrigo N. Laigner; Yongluan Zhou; Marcos Antonio Vaz Salles; Yijian Liu; Marcos Kalinowski,http://www.vldb.org/pvldb/vol14/p3348-laigner.pdf,top,J,http://arxiv.org/abs/2103.00170v2,0
2020,Inf. Systems,"XChange: A semantic diff approach for XML documents.",Alessandreia Marta de Oliveira; Troy C. Kohwalter; Marcos Kalinowski; Leonardo Murta 0001; Vanessa Braganholo,https://doi.org/10.1016/j.is.2020.101610,null,J,no_arxiv,0
2025,IST,"A multivocal literature review on the benefits and limitations of industry-leading AutoML tools.",Luigi Quaranta; Kelly Azevedo; Fabio Calefato; Marcos Kalinowski,https://doi.org/10.1016/j.infsof.2024.107608,null,J,no_arxiv,0
2025,JSS,"Attributes of a great requirements engineer.",Larissa Barbosa L. Pinheiro; Sávio Freire; Rita Suzana Pitangueira Maciel; Manoel G. Mendonça; Marcos Kalinowski; Zadia Codabux; Rodrigo O. Spínola,https://doi.org/10.1016/j.jss.2024.112200,null,J,http://arxiv.org/abs/2411.00966v1,0
2024,EMSE,"Investigating the online recruitment and selection journey of novice software engineers: Anti-patterns and recommendations.",Miguel Setúbal; Tayana Conte; Marcos Kalinowski; Allysson Allex Araújo,https://doi.org/10.1007/s10664-024-10498-w,null,J,no_arxiv,0
2024,JSS,"Identifying concerns when specifying machine learning-enabled systems: A perspective-based approach.",Hugo Villamizar; Marcos Kalinowski; Hélio Lopes 0001; Daniel Méndez 0001,https://doi.org/10.1016/j.jss.2024.112053,null,J,no_arxiv,0
2024,TSE,"On the Usefulness of Automatically Generated Microservice Architectures.",Luiz Carvalho; Thelma Elita Colanzi; Wesley K. G. Assunção; Alessandro F. Garcia 0001; Juliana Alves Pereira; Marcos Kalinowski; Rafael Maiani de Mello; Maria Julia de Lima; Carlos Lucena,https://doi.org/10.1109/TSE.2024.3361209,top,J,no_arxiv,0
2023,IST,"Lessons learned to improve the UX practices in agile projects involving data science and process automation.",Bruna Ferreira; Silvio Marques; Marcos Kalinowski; Hélio Lopes 0001; Simone D. J. Barbosa,https://doi.org/10.1016/j.infsof.2022.107106,null,J,http://arxiv.org/abs/2211.13827v1,0
2023,IST,"Negative effects of gamification in education software: Systematic mapping and practitioner perceptions.",Cláuvin Almeida; Marcos Kalinowski; Anderson G. Uchôa; Bruno Feijó,https://doi.org/10.1016/j.infsof.2022.107142,null,J,no_arxiv,0
2023,IST,"A systematic mapping study and practitioner insights on the use of software engineering practices to develop MVPs.",Silvio Alonso; Marcos Kalinowski; Bruna Ferreira; Simone D. J. Barbosa; Hélio Lopes 0001,https://doi.org/10.1016/j.infsof.2022.107144,null,J,no_arxiv,0
2023,JSS,"Psychometric instruments in software engineering research on personality: Status quo after fifty years.",Danilo Almeida Felipe; Marcos Kalinowski; Daniel Graziotin; Jean Carlos Natividade,https://doi.org/10.1016/j.jss.2023.111740,null,J,http://arxiv.org/abs/2211.13817v3,0
2023,ESEM,"Assessing the Use of AutoML for Data-Driven Software Engineering.",Fabio Calefato; Luigi Quaranta; Filippo Lanubile; Marcos Kalinowski,https://doi.org/10.1109/ESEM56168.2023.10304796,null,C,no_arxiv,0
2022,IST,"Successful combination of database search and snowballing for identification of primary studies in systematic literature studies.",Claes Wohlin; Marcos Kalinowski; Kátia Romero Felizardo; Emilia Mendes,https://doi.org/10.1016/j.infsof.2022.106908,null,J,no_arxiv,0
2022,JSS,"Cataloging dependency injection anti-patterns in software systems.",Rodrigo Laigner; Diogo S. Mendonça; Alessandro F. Garcia 0001; Marcos Kalinowski,https://doi.org/10.1016/j.jss.2021.111125,null,J,no_arxiv,0
2022,SQJ,"An empirical investigation on the challenges of creating custom static analysis rules for defect localization.",Diogo S. Mendonça; Marcos Kalinowski,https://doi.org/10.1007/s11219-021-09580-z,null,J,http://arxiv.org/abs/2011.12886v3,0
2022,TSE,"What Makes Agile Software Development Agile?",Marco Kuhrmann; Paolo Tell; Regina Hebig; Jil Klünder; Jürgen Münch; Oliver Linssen; Dietmar Pfahl; Michael Felderer; Christian R. Prause; Stephen G. MacDonell; Joyce Nakatumba-Nabende; David Raffo; Sarah Beecham; Eray Tüzün; Gustavo López 0001; Nicolás Paez; Diego Fontdevila; Sherlock A. Licorish; Steffen Küpper; Günther Ruhe; Eric Knauss; Özden Özcan-Top; Paul M. Clarke; Fergal McCaffery; Marcela Genero; Aurora Vizcaíno; Mario Piattini; Marcos Kalinowski; Tayana Conte; Rafael Prikladnicki; Stephan Krusche; Ahmet Coskunçay; Ezequiel Scott; Fabio Calefato; Svetlana Pimonova; Rolf-Helge Pfeiffer; Ulrik Pagh Schultz; Rogardt Heldal; Masud Fazal-Baqaie; Craig Anslow; Maleknaz Nayebi; Kurt Schneider; Stefan Sauer 0001; Dietmar Winkler 0001; Stefan Biffl; María Cecilia Bastarrica; Ita Richardson,https://doi.org/10.1109/TSE.2021.3099532,top,J,http://arxiv.org/abs/2109.11435v1,0
2020,EMSE,"Pandemic programming.",Paul Ralph; Sebastian Baltes; Gianisa Adisaputri; Richard Torkar; Vladimir Kovalenko; Marcos Kalinowski; Nicole Novielli; Shin Yoo; Xavier Devroey; Xin Tan 0003; Minghui Zhou 0001; Burak Turhan; Rashina Hoda; Hideaki Hata; Gregorio Robles; Amin Milani Fard; Rana Alkadhi,https://doi.org/10.1007/s10664-020-09875-y,null,J,no_arxiv,0
2020,IST,"Identifying self-admitted technical debt through code comment analysis with a contextualized vocabulary.",Mário André de Freitas Farias; Manoel Gomes de Mendonça Neto; Marcos Kalinowski; Rodrigo Oliveira Spínola,https://doi.org/10.1016/j.infsof.2020.106270,null,J,no_arxiv,0
2020,IST,"On the performance of hybrid search strategies for systematic literature reviews in software engineering.",Érica Mourão; João Felipe Pimentel; Leonardo Murta 0001; Marcos Kalinowski; Emilia Mendes; Claes Wohlin,https://doi.org/10.1016/j.infsof.2020.106294,null,J,http://arxiv.org/abs/2004.09741v1,0
2020,IST,"Guidelines for the search strategy to update systematic literature reviews in software engineering.",Claes Wohlin; Emilia Mendes; Kátia Romero Felizardo; Marcos Kalinowski,https://doi.org/10.1016/j.infsof.2020.106366,null,J,http://arxiv.org/abs/2006.05542v1,0
2020,JSS,"When to update systematic literature reviews in software engineering.",Emilia Mendes; Claes Wohlin; Kátia Romero Felizardo; Marcos Kalinowski,https://doi.org/10.1016/j.jss.2020.110607,null,J,http://arxiv.org/abs/2004.06183v1,0
2020,REJ,"An efficient approach for reviewing security-related aspects in agile requirements specifications of web applications.",Hugo Villamizar; Marcos Kalinowski; Alessandro F. Garcia 0001; Daniel Méndez 0001,https://doi.org/10.1007/s00766-020-00338-w,null,J,no_arxiv,0
