2020,ACM TOG,"The leopard never changes its spots: realistic pigmentation pattern formation by coupling tissue growth with reaction-diffusion.",Marcelo de Gomensoro Malheiros; Henrique Fensterseifer; Marcelo Walter,https://dl.acm.org/doi/10.1145/3386569.3392478,top,J,no_arxiv,0
2019,Computer Graphics Forum,"Appearance Modelling of Living Human Tissues.",Augusto L. P. Nunes; Anderson Maciel; Gary W. Meyer; Nigel W. John; Gladimir V. G. Baranoski; Marcelo Walter,https://doi.org/10.1111/cgf.13604,null,J,no_arxiv,0
2018,Computers & Graphics,"A survey of the contents in introductory Computer Graphics courses.",Dennis Giovani Balreira; Marcelo Walter; Dieter W. Fellner,https://doi.org/10.1016/j.cag.2018.10.001,null,J,no_arxiv,1
2017,Computer Graphics Forum,"Synthesis of Human Skin Pigmentation Disorders.",Renan Sales Barros; Marcelo Walter,https://doi.org/10.1111/cgf.12943,null,J,no_arxiv,3
2016,Computers & Graphics,"Spatial sorting: An efficient strategy for approximate nearest neighbor searching.",Marcelo de Gomensoro Malheiros; Marcelo Walter,https://doi.org/10.1016/j.cag.2016.03.006,null,J,no_arxiv,3
2020,PRL,"Assessing similarity in handwritten texts.",Dennis Giovani Balreira; Danilo Marcondes Filho; Marcelo Walter,https://doi.org/10.1016/j.patrec.2020.08.011,null,J,no_arxiv,0
