2019,Expert Systems Appl.,"Quality assessment of collaboratively-created web content with no manual intervention based on soft multi-view generation.",Luiz Felipe Gonçalves Magalhães; Marcos André Gonçalves; Sérgio Daniel Canuto; Daniel Hasan Dalip; Marco Cristo; Pável Calado,https://doi.org/10.1016/j.eswa.2019.04.053,null,J,no_arxiv,0
2019,Concurrency and Computation,"Parallel rule-based selective sampling and on-demand learning to rank.",Mateus Ferreira e Freitas; Daniel Xavier de Sousa; Wellington S. Martins; Thierson Couto Rosa; Rodrigo M. Silva; Marcos André Gonçalves,https://doi.org/10.1002/cpe.4464,null,J,no_arxiv,0
2022,Inf. Sciences,"How to build high quality L2R training data: Unsupervised compression-based selective sampling for learning to rank.",Rodrigo M. Silva; Guilherme C. M. Gomes; Mário S. Alvim; Marcos André Gonçalves,https://doi.org/10.1016/j.ins.2022.04.012,null,J,no_arxiv,0
2022,Inf. Sciences,"A reinforcement learning approach for single redundant view co-training text classification.",Bruno B. M. Paiva; Erickson R. Nascimento; Marcos André Gonçalves; Fabiano Belém,https://doi.org/10.1016/j.ins.2022.09.065,null,J,no_arxiv,0
2021,Inf. Sciences,"Individualized extreme dominance (IndED): A new preference-based method for multi-objective recommender systems.",Reinaldo Silva Fortes; Daniel Xavier de Sousa; Dayanne Gouveia Coelho; Anísio Mendes Lacerda; Marcos André Gonçalves,https://doi.org/10.1016/j.ins.2021.05.037,null,J,no_arxiv,0
2020,Inf. Systems,"Exploiting semantic relationships for unsupervised expansion of sentiment lexicons.",Felipe Viegas; Mário S. Alvim; Sérgio D. Canuto; Thierson Rosa; Marcos André Gonçalves; Leonardo Rocha 0001,https://doi.org/10.1016/j.is.2020.101606,null,J,no_arxiv,0
2019,ACM TOIS,"Risk-Sensitive Learning to Rank with Evolutionary Multi-Objective Feature Selection.",Daniel Xavier de Sousa; Sérgio D. Canuto; Marcos André Gonçalves; Thierson Couto Rosa; Wellington Santos Martins,https://doi.org/10.1145/3300196,top,J,no_arxiv,0
2023,Inf. Process. Mgmt.,"On the class separability of contextual embeddings representations - or The classifier does not matter when the (text) representation is so good!.",Cláudio Moisés Valiense de Andrade; Fabiano Belém; Washington Cunha; Celso França; Felipe Viegas; Leonardo Rocha 0001; Marcos André Gonçalves,https://doi.org/10.1016/j.ipm.2023.103336,null,J,no_arxiv,0
2023,SIGIR,"An Effective, Efficient, and Scalable Confidence-based Instance Selection Framework for Transformer-Based Text Classification.",Washington Cunha; Celso França; Guilherme Fonseca; Leonardo Rocha 0001; Marcos André Gonçalves,https://doi.org/10.1145/3539618.3591638,top,C,no_arxiv,0
2022,SIGIR,"Risk-Sensitive Deep Neural Learning to Rank.",Pedro Henrique Silva Rodrigues; Daniel Xavier de Sousa; Thierson Couto Rosa; Marcos André Gonçalves,https://doi.org/10.1145/3477495.3532056,top,C,no_arxiv,0
2021,Inf. Process. Mgmt.,"On the cost-effectiveness of neural and non-neural approaches and representations for text classification: A comprehensive comparative study.",Washington Cunha; Vítor Mangaravite; Christian Gomes; Sérgio D. Canuto; Elaine Resende; Cecilia Nascimento; Felipe Viegas; Celso França; Wellington Santos Martins; Jussara M. Almeida; Thierson Rosa; Leonardo Rocha 0001; Marcos André Gonçalves,https://doi.org/10.1016/j.ipm.2020.102481,null,J,no_arxiv,0
2020,Inf. Process. Mgmt.,"Fine-grained tourism prediction: Impact of social and environmental features.",Amir Khatibi; Fabiano Belém; Ana Paula Couto da Silva; Jussara M. Almeida; Marcos André Gonçalves,https://doi.org/10.1016/j.ipm.2019.102057,null,J,no_arxiv,0
2020,Inf. Process. Mgmt.,"Extended pre-processing pipeline for text classification: On the role of meta-feature representations, sparsification and selective sampling.",Washington Cunha; Sérgio D. Canuto; Felipe Viegas; Thiago Salles; Christian Gomes; Vítor Mangaravite; Elaine Resende; Thierson Rosa; Marcos André Gonçalves; Leonardo Rocha 0001,https://doi.org/10.1016/j.ipm.2020.102263,null,J,no_arxiv,0
2020,Inf. Process. Mgmt.,"Fixing the curse of the bad product descriptions - Search-boosted tag recommendation for E-commerce products.",Fabiano Muniz Belém; Rodrigo M. Silva; Cláudio Moisés Valiense de Andrade; Gabriel Person; Felipe Mingote; Raphael Ballet; Helton Alponti; Henrique P. de Oliveira; Jussara M. Almeida; Marcos André Gonçalves,https://doi.org/10.1016/j.ipm.2020.102289,null,J,no_arxiv,0
2020,CIKM,"Keep it Simple, Lazy - MetaLazy: A New MetaStrategy for Lazy Text Classification.",Luiz Felipe Mendes; Marcos André Gonçalves; Washington Cunha; Leonardo Rocha 0001; Thierson Couto Rosa; Wellington Martins,https://doi.org/10.1145/3340531.3412180,null,C,no_arxiv,0
2019,Inf. Process. Mgmt.,"Exploiting syntactic and neighbourhood attributes to address cold start in tag recommendation.",Fabiano Muniz Belém; André G. Heringer; Jussara M. Almeida; Marcos André Gonçalves,https://doi.org/10.1016/j.ipm.2018.12.009,null,J,no_arxiv,0
2019,JCDL,"Automatic Generation of Initial Reading Lists: Requirements and Solutions.",Pablo Figueira; Fabiano Belém; Jussara M. Almeida; Marcos André Gonçalves,https://doi.org/10.1109/JCDL.2019.00011,null,C,no_arxiv,0
2019,SIGIR,"Similarity-Based Synthetic Document Representations for Meta-Feature Generation in Text Classification.",Sérgio D. Canuto; Thiago Salles; Thierson Couto Rosa; Marcos André Gonçalves,https://doi.org/10.1145/3331184.3331239,top,C,no_arxiv,0
2019,WebSci,"Characterizing Attention Cascades in WhatsApp Groups.",Josemar Alves Caetano; Gabriel Magno; Marcos André Gonçalves; Jussara M. Almeida; Humberto Torres Marques-Neto; Virgílio A. F. Almeida,https://doi.org/10.1145/3292522.3326018,null,C,http://arxiv.org/abs/1905.00825v2,0
2019,WSDM,"CluWords: Exploiting Semantic Word Clustering Representation for Enhanced Topic Modeling.",Felipe Viegas; Sérgio D. Canuto; Christian Gomes; Washington Luiz; Thierson Rosa; Sabir Ribas; Leonardo Rocha 0001; Marcos André Gonçalves,https://doi.org/10.1145/3289600.3291032,top,C,no_arxiv,0
2019,PR,"Hierarchical Clustering-Based Graphs for Large Scale Approximate Nearest Neighbor Search.",Javier Alvaro Vargas Muñoz; Marcos André Gonçalves; Zanoni Dias; Ricardo da Silva Torres,https://doi.org/10.1016/j.patcog.2019.106970,null,J,no_arxiv,0
