2023,Robotics & Autonomous Syst.,"A Survey on the autonomous exploration of confined subterranean spaces: Perspectives from real-word and industrial robotic deployments.",Héctor Azpúrua; Maíra Saboia da Silva; Gustavo Medeiros Freitas; Lillian Clark; Ali-akbar Agha-mohammadi; Gustavo Pessin; Mario F. M. Campos; Douglas G. Macharet,https://doi.org/10.1016/j.robot.2022.104304,null,J,no_arxiv,0
2021,Autonomous Robots,"Estimating boundary dynamics using robotic sensor networks with pointwise measurements.",David Saldaña; Renato M. Assunção; M. Ani Hsieh; Mario F. M. Campos; Vijay Kumar 0001,https://doi.org/10.1007/s10514-020-09954-5,null,J,no_arxiv,0
2021,J. Intelligent & Robotic Syst.,"Three-Dimensional Mapping with Augmented Navigation Cost through Deep Learning.",Felipe G. Oliveira; Armando Alves Neto; David Howard; Paulo V. K. Borges; Mario F. M. Campos; Douglas G. Macharet,https://doi.org/10.1007/s10846-020-01304-y,null,J,no_arxiv,0
2021,ICRA,"Three-dimensional Terrain Aware Autonomous Exploration for Subterranean and Confined Spaces.",Héctor Azpúrua; Mario F. M. Campos; Douglas G. Macharet,https://doi.org/10.1109/ICRA48506.2021.9561099,null,C,no_arxiv,0
2020,J. Intelligent & Robotic Syst.,"Extending Maps with Semantic and Contextual Object Information for Robot Navigation: a Learning-Based Framework Using Visual and Depth Cues.",Renato Martins; Dhiego Bersan; Mario F. M. Campos; Erickson R. Nascimento,https://doi.org/10.1007/s10846-019-01136-5,null,J,no_arxiv,0
2021,IMAVIS,"Introducing the structural bases of typicality effects in deep learning.",Omar Vidal Pino; Erickson R. Nascimento; Mario F. M. Campos,https://doi.org/10.1016/j.imavis.2021.104249,null,J,http://arxiv.org/abs/2107.03279v1,0
2021,IEEE TPAMI,"A Sparse Sampling-Based Framework for Semantic Fast-Forward of First-Person Videos.",Michel Melo Silva; Washington L. S. Ramos; Mario F. M. Campos; Erickson R. Nascimento,https://doi.org/10.1109/TPAMI.2020.2983929,top,J,no_arxiv,0
