2021,Expert Systems Appl.,"Quantum-inspired neuro coevolution model applied to coordination problems.",Eduardo Dessupoio Moreira Dias; Marley Maria Bernardes Rebuzzi Vellasco; André Vargas Abs da Cruz,https://doi.org/10.1016/j.eswa.2020.114133,null,J,no_arxiv,0
2019,Applied Soft Comput.,"PSO+: A new particle swarm optimization algorithm for constrained problems.",Manoela Kohler; Marley M. B. R. Vellasco; Ricardo Tanscheit,https://doi.org/10.1016/j.asoc.2019.105865,null,J,no_arxiv,0
2019,Expert Systems Appl.,"Classifying Periodic Astrophysical Phenomena from non-survey optimized variable-cadence observational data.",Paul R. McWhirter; Abir Hussain; Dhiya Al-Jumeily; Iain A. Steele; Marley M. B. R. Vellasco,https://doi.org/10.1016/j.eswa.2019.04.035,null,J,no_arxiv,0
2019,GECCO,"Resource optimization for elective surgical procedures using quantum-inspired genetic algorithms.",René González Hernandez; Marley M. B. R. Vellasco; Karla Figueiredo,https://doi.org/10.1145/3321707.3321786,null,C,no_arxiv,0
2018,Applied Soft Comput.,"DetectA: abrupt concept drift detection in non-stationary environments.",Tatiana Escovedo; Adriano S. Koshiyama; André Vargas Abs da Cruz; Marley M. B. R. Vellasco,https://doi.org/10.1016/j.asoc.2017.10.031,null,J,no_arxiv,0
2018,Expert Systems Appl.,"A unified solution in fuzzy capital budgeting.",Antonio Carlos Sampaio Filho; Marley M. B. R. Vellasco; Ricardo Tanscheit,https://doi.org/10.1016/j.eswa.2018.01.002,null,J,no_arxiv,0
2017,Expert Systems Appl.,"Quantum inspired evolutionary algorithm for ordering problems.",Luciano R. Silveira; Ricardo Tanscheit; Marley M. B. R. Vellasco,https://doi.org/10.1016/j.eswa.2016.08.067,null,J,no_arxiv,0
