2017,GPCE,"Avoiding useless mutants.",Leonardo Fernandes; Márcio Ribeiro; Luiz Carvalho; Rohit Gheyi; Melina Mongiovi; André L. M. Santos; Ana Cavalcanti; Fabiano Cutigi Ferrari; José Carlos Maldonado,https://doi.org/10.1145/3136040.3136053,null,C,no_arxiv,5
2016,GPCE,"A change-centric approach to compile configurable systems with #ifdefs.",Larissa Braz; Rohit Gheyi; Melina Mongiovi; Márcio Ribeiro; Flávio Medeiros; Leopoldo Teixeira,https://doi.org/10.1145/2993236.2993250,null,C,no_arxiv,4
2018,TSE,"Detecting Overly Strong Preconditions in Refactoring Engines.",Melina Mongiovi; Rohit Gheyi; Gustavo Soares; Márcio Ribeiro; Paulo Borba; Leopoldo Teixeira,https://doi.org/10.1109/TSE.2017.2693982,top,J,no_arxiv,1
2017,FSE,"Understanding the impact of refactoring on smells: a longitudinal study of 23 software projects.",Diego Cedrim; Alessandro Garcia; Melina Mongiovi; Rohit Gheyi; Leonardo da Silva Sousa; Rafael Maiani de Mello; Baldoino Fonseca; Márcio Ribeiro; Alexander Chávez,https://doi.org/10.1145/3106237.3106259,top,C,no_arxiv,4
2014,SCP,"Making refactoring safer through impact analysis.",Melina Mongiovi; Rohit Gheyi; Gustavo Soares; Leopoldo Teixeira; Paulo Borba,https://doi.org/10.1016/j.scico.2013.11.001,null,J,no_arxiv,
2014,ICSME,"Scaling Testing of Refactoring Engines.",Melina Mongiovi; Gustavo Mendes; Rohit Gheyi; Gustavo Soares; Márcio Ribeiro,https://doi.org/10.1109/ICSME.2014.59,null,C,no_arxiv,6
