2018,Applied Soft Comput.,"Exploring the probabilistic graphic model of a hybrid multi-objective Bayesian estimation of distribution algorithm.",Marcella S. R. Martins; Myriam Regattieri Delgado; Ricardo Lüders; Roberto Santana; Richard A. Gonçalves; Carolina P. de Almeida,https://doi.org/10.1016/j.asoc.2018.08.039,null,J,no_arxiv,0
2018,GECCO,"A fitness landscape analysis of the travelling thief problem.",Mohamed El Yafrani; Marcella S. R. Martins; Mehdi El Krari; Markus Wagner 0007; Myriam Regattieri de Biase da Silva Delgado; Belaïd Ahiod; Ricardo Lüders,https://doi.org/10.1145/3205455.3205537,null,C,no_arxiv,0
2017,GECCO,"Estimating stop conditions of swarm based stochastic metaheuristic algorithms.",Peter Frank Perroni; Daniel Weingaertner; Myriam Regattieri Delgado,https://doi.org/10.1145/3071178.3071326,null,C,no_arxiv,1
2016,Expert Systems Appl.,"A social-aware routing protocol for opportunistic networks.",Ana Cristina B. Kochem Vendramin; Anelise Munaretto; Myriam Regattieri Delgado; Mauro Fonseca; Aline Carneiro Viana,https://doi.org/10.1016/j.eswa.2016.01.039,null,J,no_arxiv,8
2016,Expert Systems Appl.,"ADEMO/D: An adaptive differential evolution for protein structure prediction problem.",Sandra M. Venske; Richard A. Gonçalves; Elaine M. Benelli; Myriam Regattieri Delgado,https://doi.org/10.1016/j.eswa.2016.03.009,null,J,no_arxiv,9
2016,Neurocomputing,"Extreme Learning Surrogate Models in Multi-objective Optimization based on Decomposition.",Lucas M. Pavelski; Myriam Regattieri Delgado; Carolina P. de Almeida; Richard A. Gonçalves; Sandra M. Venske,https://doi.org/10.1016/j.neucom.2015.09.111,null,J,no_arxiv,7
2016,GECCO,"HMOBEDA: Hybrid Multi-objective Bayesian Estimation of Distribution Algorithm.",Marcella S. R. Martins; Myriam Regattieri de Biase da Silva Delgado; Roberto Santana; Ricardo Lüders; Richard Aderbal Gonçalves; Carolina Paula de Almeida,https://doi.org/10.1145/2908812.2908826,null,C,no_arxiv,1
2014,Neurocomputing,"ADEMO/D: Multiobjective optimization by an adaptive differential evolution algorithm.",Sandra M. Venske; Richard A. Gonçalves; Myriam Regattieri Delgado,https://doi.org/10.1016/j.neucom.2013.06.043,null,J,no_arxiv,33
