2019,RecSys,"Online learning to rank for sequential music recommendation.",Bruno L. Pereira; Alberto Ueda; Gustavo Penha; Rodrygo L. T. Santos; Nivio Ziviani,https://doi.org/10.1145/3298689.3347019,null,C,no_arxiv,0
2018,BigData,"Dynamic Prediction of ICU Mortality Risk Using Domain Adaptation.",Tiago Alves 0002; Alberto H. F. Laender; Adriano Veloso; Nivio Ziviani,https://doi.org/10.1109/BigData.2018.8621927,null,C,no_arxiv,2
2018,VLDB,"Information and Data Management at PUC-Rio and UFMG.",Antonio L. Furtado; Nivio Ziviani,http://www.vldb.org/pvldb/vol11/p2114-furtado.pdf,top,C,no_arxiv,
2018,Inf. Retr. Journal.,"Website replica detection with distant supervision.",Cristiano R. de Carvalho; Edleno Silva de Moura; Adriano Veloso; Nivio Ziviani,https://doi.org/10.1007/s10791-017-9320-z,null,J,no_arxiv,1
2017,SIGIR,"Intent-Aware Semantic Query Annotation.",Rafael Glater; Rodrygo L. T. Santos; Nivio Ziviani,https://doi.org/10.1145/3077136.3080825,top,C,no_arxiv,2
2015,Inf. Retr. Journal.,"A genetic programming framework to schedule webpage updates.",Aécio S. R. Santos; Cristiano R. de Carvalho; Jussara M. Almeida; Edleno Silva de Moura; Altigran Soares da Silva; Nivio Ziviani,https://doi.org/10.1007/s10791-014-9248-5,null,J,no_arxiv,6
2015,Inf. Retr. Journal.,"Improving daily deals recommendation using explore-then-exploit strategies.",Anísio Lacerda; Rodrygo L. T. Santos; Adriano Veloso; Nivio Ziviani,https://doi.org/10.1007/s10791-014-9249-4,null,J,no_arxiv,4
