2021,IPDPS,"CBNet: Minimizing Adjustments in Concurrent Demand-Aware Tree Networks.",Otavio Augusto de Oliveira Souza; Olga Goussevskaia; Stefan Schmid 0001,https://doi.org/10.1109/IPDPS49936.2021.00046,null,C,no_arxiv,0
2017,ACM TOMM,"Mixtape: Using Real-Time User Feedback to Navigate Large Media Collections.",Luciana Fujii Pontello; Pedro H. F. Holanda; Bruno Guilherme; João Paulo V. Cardoso; Olga Goussevskaia; Ana Paula Couto da Silva,https://doi.org/10.1145/3105969,top,J,no_arxiv,0
2019,INFOCOM,"Distributed Self-Adjusting Tree Networks.",Bruna Soares Peres; Otavio Augusto de Oliveira Souza; Olga Goussevskaia; Chen Avin; Stefan Schmid 0001,https://doi.org/10.1109/INFOCOM.2019.8737417,null,C,no_arxiv,0
2018,Ad Hoc Networks,"Mobile Matrix: Routing under mobility in IoT, IoMT, and Social IoT.",Bruno P. Santos; Olga Goussevskaia; Luiz Filipe M. Vieira; Marcos Augusto M. Vieira; Antonio A. F. Loureiro,https://doi.org/10.1016/j.adhoc.2018.05.012,null,J,no_arxiv,0
2018,Computer Networks,"Matrix: Multihop Address allocation and dynamic any-To-any Routing for 6LoWPAN.",Bruna Soares Peres; Bruno P. Santos; Otavio Augusto de Oliveira Souza; Olga Goussevskaia; Marcos Augusto M. Vieira; Luiz Filipe M. Vieira; Antonio A. F. Loureiro,https://doi.org/10.1016/j.comnet.2018.04.017,null,J,no_arxiv,0
2017,Computer Networks,"Connectivity with backbone structures in obstructed wireless networks.",Manassés Ferreira Neto; Olga Goussevskaia; Vinícius Fernandes dos Santos,https://doi.org/10.1016/j.comnet.2017.08.023,null,J,no_arxiv,0
