2020,ACM Comput. Surveys,"A Survey of DevOps Concepts and Challenges.",Leonardo A. F. Leite; Carla Rocha; Fabio Kon; Dejan S. Milojicic; Paulo Meirelles,https://doi.org/10.1145/3359981,null,J,http://arxiv.org/abs/1909.05409v4,0
2023,IST,"CADV: A software visualization approach for code annotations distribution.",Phyllipe Lima; Jorge Melegati; Everaldo Gomes; Nathalya Stefhany Pereira; Eduardo M. Guerra 0001; Paulo Meirelles,https://doi.org/10.1016/j.infsof.2022.107089,null,J,http://arxiv.org/abs/2112.10938v3,0
2023,TSE,"A Theory of Organizational Structures for Development and Infrastructure Professionals.",Leonardo A. F. Leite; Nelson Lago; Claudia de O. Melo; Fabio Kon; Paulo Meirelles,https://doi.org/10.1109/TSE.2022.3199169,top,J,no_arxiv,0
2021,IST,"The organization of software teams in the quest for continuous delivery: A grounded theory approach.",Leonardo A. F. Leite; Gustavo Pinto 0001; Fabio Kon; Paulo Meirelles,https://doi.org/10.1016/j.infsof.2021.106672,null,J,http://arxiv.org/abs/2008.08652v4,0
2021,IEEE Software,"Improving Parallelism in Git and GNU Compiler Collection: Strategies, Difficulties, and Lessons Learned.",Matheus Tavares Bernardino; Giuliano Belinassi; Paulo Meirelles; Eduardo Martins Guerra; Alfredo Goldman,https://doi.org/10.1109/MS.2020.3020932,null,J,no_arxiv,0
2021,ICSE,"What Makes a Great Maintainer of Open Source Projects?",Edson Dias; Paulo Meirelles; Fernando Castor; Igor Steinmacher; Igor Wiese; Gustavo Pinto 0001,https://doi.org/10.1109/ICSE43902.2021.00093,top,C,no_arxiv,0
2020,JSS,"Leading successful government-academia collaborations using FLOSS and agile values.",Melissa Wen; Rodrigo Siqueira; Nelson Lago; Diego Camarinha; Antonio Terceiro; Fabio Kon; Paulo Meirelles,https://doi.org/10.1016/j.jss.2020.110548,null,J,no_arxiv,0
