2017,Soft Computing,"Multi-objective optimization of multimedia embedded systems using genetic algorithms and stochastic simulation.",Bruno Costa e Silva Nogueira; Paulo Romero Martins Maciel; Eduardo Tavares; Ricardo M. A. Silva; Ermeson Carneiro de Andrade,https://doi.org/10.1007/s00500-016-2061-x,null,J,no_arxiv,3
2018,Supercomputing,"Performance prediction for supporting mobile applications' offloading.",Thiago Felipe da Silva Pinheiro; Francisco Airton Silva; Iure Fe; Sokol Kosta; Paulo Romero Martins Maciel,https://doi.org/10.1007/s11227-018-2414-6,null,J,no_arxiv,0
2018,Supercomputing,"Models for availability and power consumption evaluation of a private cloud with VMM rejuvenation enabled by VM Live Migration.",Matheus Torquato 0001; Umesh Ml; Paulo R. M. Maciel,https://doi.org/10.1007/s11227-018-2485-4,null,J,no_arxiv,2
2016,Supercomputing,"Benchmark applications used in mobile cloud computing research: a systematic mapping study.",Francisco Airton Silva; Germano Zaicaner; Eder Quesado; Matheus Dornelas; Bruno Silva 0001; Paulo Romero Martins Maciel,https://doi.org/10.1007/s11227-016-1674-2,null,J,no_arxiv,14
2015,Supercomputing,"SmartRank: a smart scheduling tool for mobile cloud computing.",Francisco Airton Silva; Paulo Romero Martins Maciel; Rubens Romero Martins Matos,https://doi.org/10.1007/s11227-015-1423-y,null,J,no_arxiv,4
2019,J. Grid Comput.,"Performability Evaluation and Optimization of Workflow Applications in Cloud Environments.",Danilo Oliveira; André Brinkmann; Nelson Rosa; Paulo Romero Martins Maciel,https://doi.org/10.1007/s10723-019-09476-0,null,J,no_arxiv,0
2017,J. Grid Comput.,"Redundant Eucalyptus Private Clouds: Availability Modeling and Sensitivity Analysis.",Rubens de S. Matos; Jamilson Dantas; Jean Araujo; Kishor S. Trivedi; Paulo Romero Martins Maciel,https://doi.org/10.1007/s10723-016-9381-z,null,J,no_arxiv,10
2018,IEEE Trans. Mobile Comput.,"Mobile Cloud Performance Evaluation Using Stochastic Models.",Francisco Airton Silva; Sokol Kosta; Matheus Rodrigues; Danilo Oliveira; Teresa Maciel; Alessandro Mei; Paulo R. M. Maciel,https://doi.org/10.1109/TMC.2017.2749577,top,J,no_arxiv,4
2015,Computer Networks,"An automated approach to dependability evaluation of virtual networks.",Victor Lira; Eduardo Antonio Guimarães Tavares; Paulo Romero Martins Maciel,https://doi.org/10.1016/j.comnet.2015.05.016,null,J,no_arxiv,3
