2015,Applied Soft Comput.,"Emphasizing typing signature in keystroke dynamics using immune algorithms.",Paulo Henrique Pisani; Ana Carolina Lorena,https://doi.org/10.1016/j.asoc.2015.05.008,null,J,no_arxiv,0
2019,ACM Comput. Surveys,"Adaptive Biometric Systems: Review and Perspectives.",Paulo Henrique Pisani; Abir Mhenni; Romain Giot; Estelle Cherrier; Norman Poh; André Carlos Ponce de Leon Ferreira de Carvalho; Christophe Rosenberger; Najoua Essoukri Ben Amara,https://doi.org/10.1145/3344255,null,J,no_arxiv,0
2015,J. Intelligent & Robotic Syst.,"Adaptive Positive Selection for Keystroke Dynamics.",Paulo Henrique Pisani; Ana Carolina Lorena; André Carlos Ponce de Leon Ferreira de Carvalho,https://doi.org/10.1007/s10846-014-0148-0,null,J,no_arxiv,0
2017,Computers & Security,"Score normalization applied to adaptive biometric systems.",Paulo Henrique Pisani; Norman Poh; André C. P. L. F. de Carvalho; Ana Carolina Lorena,https://doi.org/10.1016/j.cose.2017.07.014,null,J,no_arxiv,0
2016,Computers & Security,"Enhanced template update: Application to keystroke dynamics.",Paulo Henrique Pisani; Romain Giot; André C. P. L. F. de Carvalho; Ana Carolina Lorena,https://doi.org/10.1016/j.cose.2016.04.004,null,J,no_arxiv,0
2020,PR,"Manifold learning for user profiling and identity verification using motion sensors.",Geise Santos; Paulo Henrique Pisani; Roberto Leyva; Chang-Tsun Li; Tiago Tavares; Anderson Rocha 0001,https://doi.org/10.1016/j.patcog.2020.107408,null,J,no_arxiv,0
