2017,Multimedia Syst.,"Management of virtual network resources for multimedia applications.",Rafael L. Gomes; Luiz Fernando Bittencourt; Edmundo Roberto Mauro Madeira; Eduardo Cerqueira; Mario Gerla,https://doi.org/10.1007/s00530-015-0501-6,null,J,no_arxiv,0
2020,IEEE Comm. Magazine,"Reliability-Aware Network Slicing in Elastic Demand Scenarios.",Rafael L. Gomes; Luiz F. Bittencourt; Edmundo R. M. Madeira,https://doi.org/10.1109/MCOM.001.2000753,null,J,no_arxiv,0
2020,NOMS,"Reliable Network Slices based on Elastic Network Resource Demand.",Gabriel da Silva; Dyego Oliveira; Rafael L. Gomes; Luiz F. Bittencourt; Edmundo R. M. Madeira,https://doi.org/10.1109/NOMS47738.2020.9110316,null,C,no_arxiv,0
2017,Computer Comm.,"Two-criteria Pareto frontier for virtual network allocation on Edge-as-a-Service networks.",Rafael L. Gomes; Luiz F. Bittencourt; Edmundo R. M. Madeira; Eduardo Cerqueira; Mario Gerla,https://doi.org/10.1016/j.comcom.2017.01.009,null,J,no_arxiv,0
2016,Computer Networks,"Bandwidth-aware allocation of resilient Virtual Software Defined Networks.",Rafael L. Gomes; Luiz F. Bittencourt; Edmundo R. M. Madeira; Eduardo Cerqueira; Mario Gerla,https://doi.org/10.1016/j.comnet.2016.02.024,null,J,no_arxiv,0
2016,J. Network Computer App.,"A combined energy-bandwidth approach to allocate resilient virtual software defined networks.",Rafael L. Gomes; Luiz F. Bittencourt; Edmundo R. M. Madeira; Eduardo Cerqueira; Mario Gerla,https://doi.org/10.1016/j.jnca.2016.02.024,null,J,no_arxiv,0
2016,IEEE Trans. Net. Service  Mgmt.,"Software-Defined Management of Edge as a Service Networks.",Rafael L. Gomes; Luiz F. Bittencourt; Edmundo R. M. Madeira; Eduardo Coelho Cerqueira; Mario Gerla,https://doi.org/10.1109/TNSM.2016.2538821,null,J,no_arxiv,0
