2021,Opt Letters,"Iterated local search for the generalized independent set problem.",Bruno Costa e Silva Nogueira; Rian G. S. Pinheiro; Eduardo Tavares,https://doi.org/10.1007/s11590-020-01643-7,null,J,no_arxiv,0
2020,Annals OR,"A GPU based local search algorithm for the unweighted and weighted maximum s-plex problems.",Bruno C. S. Nogueira; Rian G. S. Pinheiro,https://doi.org/10.1007/s10479-019-03159-5,null,J,no_arxiv,0
2020,Annals OR,"Efficient approaches for the Flooding Problem on graphs.",André Renato Villela da Silva; Luiz Satoru Ochi; Bruno José da Silva Barros; Rian Gabriel S. Pinheiro,https://doi.org/10.1007/s10479-018-2796-0,null,J,no_arxiv,0
2018,Computers & OR,"A CPU-GPU local search heuristic for the maximum weight clique problem on massive graphs.",Bruno C. S. Nogueira; Rian G. S. Pinheiro,https://doi.org/10.1016/j.cor.2017.09.023,null,J,no_arxiv,0
2018,Opt Letters,"A matheuristic for the cell formation problem.",Rian Gabriel S. Pinheiro; Ivan C. Martins; Fábio Protti; Luiz Satoru Ochi,https://doi.org/10.1007/s11590-017-1200-3,null,J,no_arxiv,0
2018,Opt Letters,"A hybrid iterated local search heuristic for the maximum weight independent set problem.",Bruno C. S. Nogueira; Rian G. S. Pinheiro; Anand Subramanian 0001,https://doi.org/10.1007/s11590-017-1128-7,null,J,no_arxiv,0
2021,Discrete Applied Math.,"The biclique partitioning polytope.",Gilberto Farias de Sousa Filho; Teobaldo Bulhões; Lucídio dos Anjos F. Cabral; Luiz Satoru Ochi; Fábio Protti; Rian G. S. Pinheiro,https://doi.org/10.1016/j.dam.2021.05.023,null,J,no_arxiv,0
