2019,Computers & Graphics,"OMiCroN - Oblique Multipass Hierarchy Creation while Navigating.",Vinícius da Silva; Claudio Esperança; Ricardo Marroquim,https://doi.org/10.1016/j.cag.2019.08.016,null,J,no_arxiv,0
2018,Computer Graphics Forum,"Acquisition and Validation of Spectral Ground Truth Data for Predictive Rendering of Rough Surfaces.",Olaf Clausen; Ricardo Marroquim; Arnulph Fuhrmann,https://doi.org/10.1111/cgf.13470,null,J,no_arxiv,0
2017,Computers & Graphics,"DiLight: Digital light table - Inbetweening for 2D animations using guidelines.",Leonardo Carvalho; Ricardo Marroquim; Emilio Vital Brazil,https://doi.org/10.1016/j.cag.2017.04.001,null,J,no_arxiv,0
2017,Computers & Graphics,"Assisted color acquisition for 3D models.",Daniel Coutinho; Ricardo Marroquim; Matteo Dellepiane; Roberto Scopigno,https://doi.org/10.1016/j.cag.2017.08.011,null,J,no_arxiv,0
2016,Computers & Graphics,"Graph-based interactive volume exploration.",Daniel Ponciano; Marcos Seefelder; Ricardo Marroquim,https://doi.org/10.1016/j.cag.2016.06.007,null,J,no_arxiv,0
2021,MVAP,"Monocular 3D reconstruction of sail flying shape using passive markers.",Luiz Maurilio Maciel; Ricardo Marroquim; Marcelo Bernardes Vieira; Kevyn Swhants Ribeiro; Alexandre Alho,https://doi.org/10.1007/s00138-020-01149-3,null,J,no_arxiv,0
2019,IEEE TIP,"On GPU Connected Components and Properties: A Systematic Evaluation of Connected Component Labeling Algorithms and Their Extension for Property Extraction.",Pedro Asad; Ricardo Marroquim; Andrea L. e L. Souza,https://doi.org/10.1109/TIP.2018.2851445,null,J,no_arxiv,0
