2021,Expert Systems Appl.,"Preventing the generation of inconsistent sets of crisp classification rules.",Thiago Zafalon Miranda; Diorge Brognara Sardinha; Ricardo Cerri,https://doi.org/10.1016/j.eswa.2020.113811,null,J,no_arxiv,0
2020,Applied Soft Comput.,"DSTARS: A multi-target deep structure for tracking asynchronous regressor stacking.",Saulo Martiello Mastelini; Everton Jose Santana; Ricardo Cerri; Sylvio Barbon Jr.,https://doi.org/10.1016/j.asoc.2020.106215,null,J,no_arxiv,0
2019,Applied Soft Comput.,"Inducing Hierarchical Multi-label Classification rules with Genetic Algorithms.",Ricardo Cerri; Márcio P. Basgalupp; Rodrigo C. Barros; André C. P. L. F. de Carvalho,https://doi.org/10.1016/j.asoc.2019.01.017,null,J,no_arxiv,0
2019,GECCO,"A lexicographic genetic algorithm for hierarchical classification rule induction.",Gean Trindade Pereira; Paulo Henrique Ribeiro Gabriel; Ricardo Cerri,https://doi.org/10.1145/3321707.3321863,null,C,no_arxiv,0
2018,Neurocomputing,"Applying multi-label techniques in emotion identification of short texts.",Alex Marino Goncalves de Almeida; Ricardo Cerri; Emerson Cabrera Paraiso; Rafael Gomes Mantovani; Sylvio Barbon Junior,https://doi.org/10.1016/j.neucom.2018.08.053,null,J,no_arxiv,0
2016,BMC Bioinformatics,"Reduction strategies for hierarchical multi-label classification in protein function prediction.",Ricardo Cerri; Rodrigo C. Barros; André C. P. L. F. de Carvalho; Yaochu Jin,https://doi.org/10.1186/s12859-016-1232-1,null,J,no_arxiv,0
2020,Data Min. Knowl. Discov.,"Active learning for hierarchical multi-label classification.",Felipe Kenji Nakano; Ricardo Cerri; Celine Vens,https://doi.org/10.1007/s10618-020-00704-w,null,J,no_arxiv,0
2020,ECML/PKDD,"Predictive Bi-clustering Trees for Hierarchical Multi-label Classification.",Bruna Zamith Santos; Felipe Kenji Nakano; Ricardo Cerri; Celine Vens,https://doi.org/10.1007/978-3-030-67664-3_42,null,C,no_arxiv,0
2018,ICML,"Hierarchical Multi-Label Classification Networks.",Jonatas Wehrmann; Ricardo Cerri; Rodrigo C. Barros,http://proceedings.mlr.press/v80/wehrmann18a.html,top,C,no_arxiv,0
