2023,Discrete Applied Math.,"Domination and convexity problems in the target set selection model.",Rafael T. Araújo; Rudini M. Sampaio,https://doi.org/10.1016/j.dam.2022.12.021,null,J,no_arxiv,0
2023,Theor. Comput. Sci.,"The connected greedy coloring game.",Carlos V. G. C. Lima; Thiago Marcilon; Nicolas Almeida Martins; Rudini Menezes Sampaio,https://doi.org/10.1016/j.tcs.2022.10.034,null,J,no_arxiv,0
2022,Theor. Comput. Sci.,"PSPACE-hardness of variants of the graph coloring game.",Carlos V. G. C. Lima; Thiago Marcilon; Nicolas Almeida Martins; Rudini M. Sampaio,https://doi.org/10.1016/j.tcs.2022.01.030,null,J,no_arxiv,0
2022,Theor. Comput. Sci.,"Spy game: FPT-algorithm, hardness and graph products.",Eurinardo Rodrigues Costa; Nicolas Almeida Martins; Rudini M. Sampaio,https://doi.org/10.1016/j.tcs.2022.05.015,null,J,no_arxiv,0
2020,Theor. Comput. Sci.,"PSPACE-completeness of two graph coloring games.",Eurinardo Rodrigues Costa; Victor Lage Pessoa; Rudini M. Sampaio; Ronan Soares,https://doi.org/10.1016/j.tcs.2020.03.022,null,J,no_arxiv,0
2020,LATIN,"Hardness of Variants of the Graph Coloring Game.",Thiago Marcilon; Nicolas Almeida Martins; Rudini Menezes Sampaio,https://doi.org/10.1007/978-3-030-61792-9_28,null,C,no_arxiv,0
2019,Theor. Comput. Sci.,"On the parameterized complexity of the geodesic hull number.",Mamadou Moustapha Kanté; Thiago Braga Marcilon; Rudini M. Sampaio,https://doi.org/10.1016/j.tcs.2019.05.005,null,J,no_arxiv,0
2018,Discrete Applied Math.,"The convexity of induced paths of order three and applications: Complexity aspects.",Rafael T. Araújo; Rudini M. Sampaio; Vinícius Fernandes dos Santos; Jayme Luiz Szwarcfiter,https://doi.org/10.1016/j.dam.2017.11.007,null,J,no_arxiv,0
2018,Discrete Applied Math.,"Limits of k-dimensional poset sequences.",Ricardo Cordeiro Corrêa; Carlos Hoppen; Rudini Menezes Sampaio,https://doi.org/10.1016/j.dam.2016.12.031,null,J,no_arxiv,0
2018,Discrete Applied Math.,"The maximum infection time of the P3 convexity in graphs with bounded maximum degree.",Thiago Braga Marcilon; Rudini M. Sampaio,https://doi.org/10.1016/j.dam.2018.05.053,null,J,no_arxiv,0
2018,Discrete Mathematics,"Minimum density of identifying codes of king grids.",Rennan Dantas; Frédéric Havet; Rudini M. Sampaio,https://doi.org/10.1016/j.disc.2018.06.035,null,J,no_arxiv,0
2018,Theor. Comput. Sci.,"Locally identifying coloring of graphs with few P4s.",Nicolas Almeida Martins; Rudini M. Sampaio,https://doi.org/10.1016/j.tcs.2017.10.015,null,J,no_arxiv,0
2018,Theor. Comput. Sci.,"The maximum time of 2-neighbor bootstrap percolation: Complexity results.",Thiago Braga Marcilon; Rudini Menezes Sampaio,https://doi.org/10.1016/j.tcs.2017.10.014,null,J,http://arxiv.org/abs/1508.06874v1,0
2018,Theor. Comput. Sci.,"Spy-game on graphs: Complexity and simple topologies.",Nathann Cohen; Nicolas Almeida Martins; Fionn Mc Inerney; Nicolas Nisse; Stéphane Pérennes; Rudini M. Sampaio,https://doi.org/10.1016/j.tcs.2017.11.015,null,J,no_arxiv,0
