2019,IST,"On the need to update systematic literature reviews.",Vilmar Nepomuceno; Sérgio Soares,https://doi.org/10.1016/j.infsof.2019.01.005,null,J,no_arxiv,2
2019,IST,"PrioriTTVs: A process aimed at supporting researchers to prioritize threats to validity and their mitigation actions when planning controlled experiments in SE.",Eudis Teixeira; Liliane Fonseca; Bruno Cartaxo; Sérgio Soares,https://doi.org/10.1016/j.infsof.2019.07.008,null,J,no_arxiv,0
2019,ESEM,"Software Engineering Research Community Viewpoints on Rapid Reviews.",Bruno Cartaxo; Gustavo Pinto 0001; Baldoino Fonseca; Márcio Ribeiro; Pedro Pinheiro; Maria Teresa Baldassarre; Sérgio Soares,https://doi.org/10.1109/ESEM.2019.8870144,null,C,http://arxiv.org/abs/1906.11351v1,0
2019,ASE,"Semistructured Merge in JavaScript Systems.",Alberto Trindade Tavares; Paulo Borba; Guilherme Cavalcanti; Sérgio Soares,https://doi.org/10.1109/ASE.2019.00098,top,C,no_arxiv,0
2018,IST,"Towards a model to transfer knowledge from software engineering research to practice.",Bruno Cartaxo; Gustavo Pinto 0001; Sérgio Soares,https://doi.org/10.1016/j.infsof.2018.01.001,null,J,no_arxiv,5
2016,ESEM,"Evidence Briefings: Towards a Medium to Transfer Knowledge from Systematic Reviews to Practitioners.",Bruno Cartaxo; Gustavo Pinto 0001; Elton Vieira; Sérgio Soares,https://doi.org/10.1145/2961111.2962603,null,C,no_arxiv,12
2015,JSS,"Classifying metrics for assessing Object-Oriented Software Maintainability: A family of metrics' catalogs.",Juliana de A. G. Saraiva; Micael S. de França; Sérgio C. B. Soares; Fernando Castor Filho; Renata M. C. R. de Souza,https://doi.org/10.1016/j.jss.2015.01.014,null,J,no_arxiv,7
