2017,ASEJ,"Meta-learning based selection of software reliability models.",Rafael Caiuta; Aurora T. R. Pozo; Silvia Regina Vergilio,https://doi.org/10.1007/s10515-016-0195-9,null,J,no_arxiv,1
2017,EMSE,"Multi-objective reverse engineering of variability-safe feature models based on code dependencies of system variants.",Wesley K. G. Assunção; Roberto E. Lopez-Herrejon; Lukas Linsbauer; Silvia R. Vergilio; Alexander Egyed,https://doi.org/10.1007/s10664-016-9462-4,null,J,no_arxiv,2
2017,EMSE,"Reengineering legacy applications into software product lines: a systematic mapping.",Wesley K. G. Assunção; Roberto E. Lopez-Herrejon; Lukas Linsbauer; Silvia R. Vergilio; Alexander Egyed,https://doi.org/10.1007/s10664-017-9499-z,null,J,no_arxiv,4
2017,IST,"A systematic review on search-based refactoring.",Thainá Mariani; Silvia Regina Vergilio,https://doi.org/10.1016/j.infsof.2016.11.009,null,J,no_arxiv,7
2017,IST,"Incorporating user preferences in search-based software engineering: A systematic mapping study.",Thiago do Nascimento Ferreira; Silvia Regina Vergilio; Jerffeson Teixeira de Souza,https://doi.org/10.1016/j.infsof.2017.05.003,null,J,no_arxiv,1
2016,JSS,"Preserving architectural styles in the search based design of software product line architectures.",Thainá Mariani; Thelma Elita Colanzi; Silvia Regina Vergilio,https://doi.org/10.1016/j.jss.2016.01.039,null,J,no_arxiv,1
2016,JSS,"A feature-driven crossover operator for multi-objective and evolutionary optimization of product line architectures.",Thelma Elita Colanzi; Silvia Regina Vergilio,https://doi.org/10.1016/j.jss.2016.02.026,null,J,no_arxiv,6
2013,JSS,"Search Based Software Engineering: Review and analysis of the field in Brazil.",Thelma Elita Colanzi; Silvia Regina Vergilio; Wesley Klewerton Guez Assunção; Aurora T. R. Pozo,https://doi.org/10.1016/j.jss.2012.07.041,null,J,no_arxiv,7
