2015,Engineering Appl. of AI,"Decision making with natural language based preferences and psychology-inspired heuristics.",Ingrid Nunes; Simon Miles; Michael Luck; Simone Diniz Junqueira Barbosa; Carlos José Pereira de Lucena,https://doi.org/10.1016/j.engappai.2015.03.008,null,J,no_arxiv,3
2017,EICS,"HistoryViewer: Instrumenting a Visual Analytics Application to Support Revisiting a Session of Interactive Data Analysis.",Vinícius C. V. B. Segura; Simone D. J. Barbosa,https://doi.org/10.1145/3095813,null,C,no_arxiv,2
2015,INTERACT,"How Does HCI Research Affect Education Programs? A Study in the Brazilian Context.",Isabela Gasparini; Simone Diniz Junqueira Barbosa; Milene Selbach Silveira; Silvia Amélia Bim; Clodis Boscarioli,https://doi.org/10.1007/978-3-319-22668-2_46,null,C,no_arxiv,2
2020,Inf. Systems,"Eras: Improving the quality control in the annotation process for Natural Language Processing tasks.",Jonatas S. Grosman; Pedro Henrique Thompson Furtado; Ariane M. B. Rodrigues; Guilherme G. Schardong; Simone D. J. Barbosa; Hélio Côrtes Vieira Lopes,https://doi.org/10.1016/j.is.2020.101553,null,J,no_arxiv,0
2019,Computers & Graphics,"Visual exploration of an ensemble of classifiers.",Paula Ceccon Ribeiro; Guilherme G. Schardong; Simone D. J. Barbosa; Clarisse Sieckenius de Souza; Hélio Lopes,https://doi.org/10.1016/j.cag.2019.08.012,null,J,no_arxiv,2
2018,IEEE TVCG,"CasCADe: A Novel 4D Visualization System for Virtual Construction Planning.",Paulo Ivson; Daniel Nascimento; Waldemar Celes Filho; Simone D. J. Barbosa,https://doi.org/10.1109/TVCG.2017.2745105,top,J,no_arxiv,11
2017,Multimedia Tools Appl.,"Extending multimedia languages to support multimodal user interactions.",Álan Lívio Vasconcelos Guedes; Roberto Gerson De Albuquerque Azevedo; Simone Diniz Junqueira Barbosa,https://doi.org/10.1007/s11042-016-3846-8,null,J,no_arxiv,4
2018,ICSE,"Identifying design problems in the source code: a grounded theory.",Leonardo da Silva Sousa; Anderson Oliveira; Willian Nalepa Oizumi; Simone D. J. Barbosa; Alessandro Garcia 0001; Jaejoon Lee; Marcos Kalinowski; Rafael Maiani de Mello; Baldoino Fonseca; Roberto Felicio Oliveira; Carlos Lucena; Rodrigo B. de Paes,https://doi.org/10.1145/3180155.3180239,top,C,no_arxiv,10
2015,JSS,"Quantifying usability of domain-specific languages: An empirical study on software maintenance.",Diego Albuquerque; Bruno Barbieri Pontes Cafeo; Alessandro F. Garcia 0001; Simone Diniz Junqueira Barbosa; Silvia Abrahão; António Ribeiro,https://doi.org/10.1016/j.jss.2014.11.051,null,J,no_arxiv,16
