2019,Knowledge-Based Syst.,"Knowledge-enhanced document embeddings for text classification.",Roberta Akemi Sinoara; José Camacho-Collados; Rafael Geraldeli Rossi; Roberto Navigli; Solange O. Rezende,https://doi.org/10.1016/j.knosys.2018.10.026,null,J,no_arxiv,4
2018,Expert Systems Appl.,"Latent association rule cluster based model to extract topics for classification and recommendation applications.",Fabiano Fernandes dos Santos; Marcos Aurélio Domingues; Camila Vaccari Sundermann; Veronica Oliveira de Carvalho; Maria Fernanda Moura; Solange Oliveira Rezende,https://doi.org/10.1016/j.eswa.2018.06.021,null,J,no_arxiv,1
2017,Knowledge-Based Syst.,"Using bipartite heterogeneous networks to speed up inductive semi-supervised learning and improve automatic text categorization.",Rafael Geraldeli Rossi; Alneu de Andrade Lopes; Solange Oliveira Rezende,https://doi.org/10.1016/j.knosys.2017.06.016,null,J,no_arxiv,1
2016,Expert Systems Appl.,"Privileged contextual information for context-aware recommender systems.",Camila Vaccari Sundermann; Marcos Aurélio Domingues; Merley da Silva Conrado; Solange Oliveira Rezende,https://doi.org/10.1016/j.eswa.2016.03.036,null,J,no_arxiv,10
2016,Inf. Process. Mgmt.,"Optimization and label propagation in bipartite heterogeneous networks to improve transductive classification of texts.",Rafael Geraldeli Rossi; Alneu de Andrade Lopes; Solange Oliveira Rezende,https://doi.org/10.1016/j.ipm.2015.07.004,null,J,no_arxiv,22
2016,Inf. Retr. Journal.,"Mining unstructured content for recommender systems: an ensemble approach.",Marcelo G. Manzato; Marcos Aurélio Domingues; Arthur da Costa Fortes; Camila Vaccari Sundermann; Rafael Martins D'Addio; Merley da Silva Conrado; Solange O. Rezende; Maria G. C. Pimentel,https://doi.org/10.1007/s10791-016-9280-8,null,J,no_arxiv,4
2015,PRL,"Interactive textual feature selection for consensus clustering.",Geraldo N. Correa; Ricardo M. Marcacini; Eduardo R. Hruschka; Solange Oliveira Rezende,https://doi.org/10.1016/j.patrec.2014.09.008,null,J,no_arxiv,7
