2023,Transp. Science,"A New Family of Route Formulations for Split Delivery Vehicle Routing Problems.",Isaac Balster; Teobaldo Bulhões; Pedro Munari; Artur Alves Pessoa; Ruslan Sadykov,https://doi.org/10.1287/trsc.2022.0085,null,J,no_arxiv,0
2022,EJOR,"Conference scheduling: A clustering-based approach.",Teobaldo Bulhões; Rubens Correia; Anand Subramanian 0001,https://doi.org/10.1016/j.ejor.2021.04.042,null,J,no_arxiv,0
2022,INFORMS J Compt,"Exact Approaches for Single Machine Total Weighted Tardiness Batch Scheduling.",Artur Alves Pessoa; Teobaldo Bulhões; Vitor Nesello; Anand Subramanian 0001,https://doi.org/10.1287/ijoc.2021.1133,top,J,no_arxiv,0
2022,JORS,"Scheduling the Brazilian OR conference.",Rubens Correia; Anand Subramanian 0001; Teobaldo Bulhões; Puca Huachi Vaz Penna,https://doi.org/10.1080/01605682.2021.1915194,null,J,no_arxiv,0
2021,Computers & OR,"A hybrid algorithm for the multi-depot heterogeneous dial-a-ride problem.",Igor Malheiros; Rodrigo Ramalho; Bruno Passeti; Teobaldo Bulhões; Anand Subramanian 0001,https://doi.org/10.1016/j.cor.2020.105196,null,J,no_arxiv,0
2021,Discrete Applied Math.,"The biclique partitioning polytope.",Gilberto Farias de Sousa Filho; Teobaldo Bulhões; Lucídio dos Anjos F. Cabral; Luiz Satoru Ochi; Fábio Protti; Rian G. S. Pinheiro,https://doi.org/10.1016/j.dam.2021.05.023,null,J,no_arxiv,0
