2022,EJOR,"Conference scheduling: A clustering-based approach.",Teobaldo Bulhões; Rubens Correia; Anand Subramanian 0001,https://doi.org/10.1016/j.ejor.2021.04.042,null,J,no_arxiv,0
2022,INFORMS J Compt,"Exact Approaches for Single Machine Total Weighted Tardiness Batch Scheduling.",Artur Alves Pessoa; Teobaldo Bulhões; Vitor Nesello; Anand Subramanian 0001,https://doi.org/10.1287/ijoc.2021.1133,top,J,no_arxiv,0
2022,JORS,"Scheduling the Brazilian OR conference.",Rubens Correia; Anand Subramanian 0001; Teobaldo Bulhões; Puca Huachi Vaz Penna,https://doi.org/10.1080/01605682.2021.1915194,null,J,no_arxiv,0
2021,Computers & OR,"A hybrid algorithm for the multi-depot heterogeneous dial-a-ride problem.",Igor Malheiros; Rodrigo Ramalho; Bruno Passeti; Teobaldo Bulhões; Anand Subramanian 0001,https://doi.org/10.1016/j.cor.2020.105196,null,J,no_arxiv,0
2018,Computers & OR,"A branch-and-price algorithm for the Minimum Latency Problem.",Teobaldo Bulhões; Ruslan Sadykov; Eduardo Uchoa,https://doi.org/10.1016/j.cor.2018.01.016,null,J,no_arxiv,0
2018,EJOR,"The static bike relocation problem with multiple vehicles and visits.",Teobaldo L. Bulhões Júnior; Anand Subramanian 0001; Günes Erdogan; Gilbert Laporte,https://doi.org/10.1016/j.ejor.2017.06.028,null,J,no_arxiv,0
2018,EJOR,"The vehicle routing problem with service level constraints.",Teobaldo Bulhões; Minh Hoàng Hà; Rafael Martinelli; Thibaut Vidal,https://doi.org/10.1016/j.ejor.2017.08.027,null,J,http://arxiv.org/abs/1706.03097v1,0
2021,Discrete Applied Math.,"The biclique partitioning polytope.",Gilberto Farias de Sousa Filho; Teobaldo Bulhões; Lucídio dos Anjos F. Cabral; Luiz Satoru Ochi; Fábio Protti; Rian G. S. Pinheiro,https://doi.org/10.1016/j.dam.2021.05.023,null,J,no_arxiv,0
