2015,CLOUD,"Cloud Query Manager: Using Semantic Web Concepts to Avoid IaaS Cloud Lock-In.",Arthur Souza; Nélio Cacho; Thaís Batista; Frederico Lopes,https://doi.org/10.1109/CLOUD.2015.98,null,C
2014,CCGrid,"A Branch-and-Bound Algorithm for Autonomic Adaptation of Multi-cloud Applications.",André Almeida; Francisco Dantas; Everton Cavalcante; Thaís Vasconcelos Batista,https://doi.org/10.1109/CCGrid.2014.25,null,C
2017,SoSyM,"An approach based on the domain perspective to develop WSAN applications.",Taniro Rodrigues; Flávia Coimbra Delicato; Thaís Vasconcelos Batista; Paulo F. Pires; Luci Pirmez,https://doi.org/10.1007/s10270-015-0498-5,null,J
2015,ICSA,"Supporting Dynamic Software Architectures: From Architectural Description to Implementation.",Everton Cavalcante; Thaís Vasconcelos Batista; Flávio Oquendo,https://doi.org/10.1109/WICSA.2015.21,null,C
2014,JSS,"Blending design patterns with aspects: A quantitative study.",Nélio Cacho; Cláudio Sant'Anna; Eduardo Figueiredo; Francisco Dantas; Alessandro F. Garcia; Thaís Vasconcelos Batista,https://doi.org/10.1016/j.jss.2014.08.041,null,J
2013,JSS,"25 years of software engineering in Brazil: Beyond an insider's view.",Paulo Anselmo da Mota Silveira Neto; Joás Sousa Gomes; Eduardo Santana de Almeida; Jair Cavalcanti Leite; Thaís Vasconcelos Batista; Larissa Leite,https://doi.org/10.1016/j.jss.2012.10.041,null,J
2013,SPE,"Mastering crosscutting architectural decisions with aspects.",Cláudio Sant'Anna; Alessandro Garcia; Thaís Vasconcelos Batista; Awais Rashid,https://doi.org/10.1002/spe.2113,null,J
