2024,Expert Systems Appl.,"Prov-Dominoes: An approach for knowledge discovery from provenance data.",Victor Alencar; Troy C. Kohwalter; Vanessa Braganholo; José Ricardo da Silva Jr.; Leonardo Murta 0001,https://doi.org/10.1016/j.eswa.2023.123030,null,J,no_arxiv,0
2019,ACM Comput. Surveys,"A Survey on Collecting, Managing, and Analyzing Provenance from Scripts.",João Felipe Pimentel; Juliana Freire; Leonardo Murta 0001; Vanessa Braganholo,https://doi.org/10.1145/3311955,null,J,no_arxiv,0
2020,Inf. Systems,"XChange: A semantic diff approach for XML documents.",Alessandreia Marta de Oliveira; Troy C. Kohwalter; Marcos Kalinowski; Leonardo Murta 0001; Vanessa Braganholo,https://doi.org/10.1016/j.is.2020.101610,null,J,no_arxiv,0
2019,Inf. Process. Mgmt.,"Querying XML documents using Prolog engines: When is this a good idea?",Fábio G. Santos; Leonardo Machado; Rafael de Araújo M. Pinheiro; Aline Paes; Vanessa Braganholo,https://doi.org/10.1016/j.ipm.2019.05.011,null,J,no_arxiv,0
2021,EMSE,"Understanding and improving the quality and reproducibility of Jupyter notebooks.",João Felipe Pimentel; Leonardo Murta 0001; Vanessa Braganholo; Juliana Freire,https://doi.org/10.1007/s10664-021-09961-9,null,J,no_arxiv,0
2019,MSR,"A large-scale study about quality and reproducibility of jupyter notebooks.",João Felipe Pimentel; Leonardo Murta 0001; Vanessa Braganholo; Juliana Freire,https://doi.org/10.1109/MSR.2019.00077,null,C,no_arxiv,0
