2019,Expert Systems Appl.,"Rehabilitation motion recognition based on the international biomechanical standards.",Alana Elza Fontes Da Gama; Thiago Menezes Chaves; Pascal Fallavollita; Lucas Silva Figueiredo; Veronica Teichrieb,https://doi.org/10.1016/j.eswa.2018.09.026,null,J,no_arxiv,1
2017,Expert Systems Appl.,"Markerless tracking system for augmented reality in the automotive industry.",Joao Paulo Silva do Monte Lima; Rafael Alves Roberto; Francisco Simões; Mozart W. S. Almeida; Lucas Silva Figueiredo; João Marcelo X. N. Teixeira; Veronica Teichrieb,https://doi.org/10.1016/j.eswa.2017.03.060,null,J,no_arxiv,14
2015,INTERACT,"Sci-Fi Gestures Catalog - Understanding the Future of Gestural Interaction.",Lucas Silva Figueiredo; Mariana Pinheiro; Edvar Vilar Neto; Thiago Chaves; Veronica Teichrieb,https://doi.org/10.1007/978-3-319-22668-2_30,null,C,no_arxiv,1
2018,Computers & Graphics,"Ray Tracer based rendering solution for large scale fluid rendering.",Caio Jose dos Santos Brito; Andre Luiz Buarque Vieira e Silva; João Marcelo X. N. Teixeira; Veronica Teichrieb,https://doi.org/10.1016/j.cag.2018.09.019,null,J,no_arxiv,2
2018,Computers & Graphics,"A comparative evaluation of direct hand and wand interactions on consumer devices.",Lucas Figueiredo; Eduardo Rodrigues; João Marcelo X. N. Teixeira; Veronica Teichrieb,https://doi.org/10.1016/j.cag.2018.10.006,null,J,no_arxiv,2
2016,Computers & Graphics,"Tracking for mobile devices: A systematic mapping study.",Rafael Alves Roberto; João Paulo Silva do Monte Lima; Veronica Teichrieb,https://doi.org/10.1016/j.cag.2016.02.002,null,J,no_arxiv,5
2018,ICRA,"Live Structural Modeling Using RGB-D SLAM.",Nicolas Olivier; Hideaki Uchiyama; Masashi Mishima; Diego Thomas; Rin-ichiro Taniguchi; Rafael Alves Roberto; João Paulo Lima; Veronica Teichrieb,https://doi.org/10.1109/ICRA.2018.8460973,null,C,no_arxiv,1
2016,MVAP,"Depth-assisted rectification for real-time object detection and pose estimation.",João Paulo Silva do Monte Lima; Francisco Paulo Magalhaes Simões; Hideaki Uchiyama; Veronica Teichrieb; Éric Marchand,https://doi.org/10.1007/s00138-015-0740-8,null,J,no_arxiv,4
