2021,Expert Systems Appl.,"Occlusion-robust method for RGB-D 6-DOF object tracking with particle swarm optimization.",José Guedes dos Santos Júnior; João Paulo Silva do Monte Lima; Veronica Teichrieb,https://doi.org/10.1016/j.eswa.2021.114736,null,J,no_arxiv,0
2019,Expert Systems Appl.,"Rehabilitation motion recognition based on the international biomechanical standards.",Alana Elza Fontes Da Gama; Thiago Menezes Chaves; Pascal Fallavollita; Lucas Silva Figueiredo; Veronica Teichrieb,https://doi.org/10.1016/j.eswa.2018.09.026,null,J,no_arxiv,0
2023,Computers & Graphics,"DirectVoxGO++: Grid-based fast object reconstruction using radiance fields.",Daniel Perazzo; João Paulo Lima; Luiz Velho 0001; Veronica Teichrieb,https://doi.org/10.1016/j.cag.2023.05.027,null,J,no_arxiv,0
2019,Computers & Graphics,"Geometrical and statistical incremental semantic modeling on mobile devices.",Rafael Alves Roberto; João Paulo Lima; Hideaki Uchiyama; Veronica Teichrieb; Rin-Ichiro Taniguchi,https://doi.org/10.1016/j.cag.2019.09.003,null,J,no_arxiv,0
2019,Computers & Graphics,"Usability and effects of text, image and audio feedback on exercise correction during augmented reality based motor rehabilitation.",Virgínia Carrazzone Cavalcanti; Maria Iziane de Santana Ferreira; Veronica Teichrieb; Ricardo Rossiter Barioni; Walter Franklin Marques Correia; Alana Elza Fontes Da Gama,https://doi.org/10.1016/j.cag.2019.10.001,null,J,no_arxiv,0
2024,WACV,"Attention Modules Improve Image-Level Anomaly Detection for Industrial Inspection: A DifferNet Case Study.",André Luiz Buarque Vieira e Silva; Francisco Simões; Danny Kowerko; Tobias Schlosser; Felipe Battisti; Veronica Teichrieb,https://doi.org/10.1109/WACV57701.2024.00806,null,C,no_arxiv,0
2022,MVAP,"3D pedestrian localization using multiple cameras: a generalizable approach.",João Paulo Lima; Rafael Roberto; Lucas Silva Figueiredo; Francisco Simões; Diego Thomas; Hideaki Uchiyama; Veronica Teichrieb,https://doi.org/10.1007/s00138-022-01323-9,null,J,no_arxiv,0
2022,PRL,"The impact of domain randomization on cross-device monocular deep 6DoF detection.",Kelvin B. da Cunha; Caio Brito; Lucas Valença; Lucas Silva Figueiredo; Francisco Simões; Veronica Teichrieb,https://doi.org/10.1016/j.patrec.2022.04.008,null,J,no_arxiv,0
