2022,ACM TWEB,"Measuring International Online Human Values with Word Embeddings.",Gabriel Magno; Virgílio A. F. Almeida,https://doi.org/10.1145/3501306,top,J,no_arxiv,0
2022,WebSci,"Analyzing the Sleeping Giants Activism Model in Brazil.",Bárbara Gomes Ribeiro; Manoel Horta Ribeiro; Virgílio A. F. Almeida; Wagner Meira Jr.,https://doi.org/10.1145/3501247.3531563,null,C,http://arxiv.org/abs/2105.07523v3,0
2020,IEEE Internet Computing,"Digital Governance and the Tragedy of the Commons.",Virgílio A. F. Almeida; Fernando Filgueiras; Francisco Gaetani,https://doi.org/10.1109/MIC.2020.2979639,null,J,no_arxiv,0
2020,IEEE Internet Computing,"Personal Digital Assistants: The Need for Governance.",Virgílio A. F. Almeida; Elizabeth Sucupira Furtado; Vasco Furtado,https://doi.org/10.1109/MIC.2020.3009897,null,J,no_arxiv,0
2019,IEEE Internet Computing,"Cyber Peace and Cyber Stability: Taking the Norm Road to Stability.",Alexander Klimburg; Virgílio A. F. Almeida,https://doi.org/10.1109/MIC.2019.2926847,null,J,no_arxiv,0
2019,IEEE Internet Computing,"Principles and Elements of Governance of Digital Public Services.",Virgílio A. F. Almeida; Fernando Filgueiras; Francisco Gaetani,https://doi.org/10.1109/MIC.2019.2936928,null,J,no_arxiv,0
2019,WebSci,"Characterizing Attention Cascades in WhatsApp Groups.",Josemar Alves Caetano; Gabriel Magno; Marcos André Gonçalves; Jussara M. Almeida; Humberto Torres Marques-Neto; Virgílio A. F. Almeida,https://doi.org/10.1145/3292522.3326018,null,C,http://arxiv.org/abs/1905.00825v2,0
