2018,Communications ACM,"A look at the design of Lua.",Roberto Ierusalimschy; Luiz Henrique de Figueiredo; Waldemar Celes Filho,https://doi.org/10.1145/3186277,null,J,no_arxiv,0
2019,CloudCom,"Metaheuristic-Based Workload Selection for Hybrid Cloud Rendering of CAD Models.",André Moreira; Waldemar Celes Filho,https://doi.org/10.1109/CloudCom.2019.00024,null,C,no_arxiv,0
2020,IEEE TVCG,"A Systematic Review of Visualization in Building Information Modeling.",Paulo Ivson 0001; André Moreira; Francisco Queiroz; Wallas H. S. dos Santos; Waldemar Celes 0001,https://doi.org/10.1109/TVCG.2019.2907583,top,J,no_arxiv,3
2019,Computers & Graphics,"Interactive directional ambient occlusion and shadow computations for volume ray casting.",Leonardo Quatrin Campagnolo; Waldemar Celes Filho,https://doi.org/10.1016/j.cag.2019.08.009,null,J,no_arxiv,2
2019,The Visual Computer,"Multiresolution visualization of massive black oil reservoir models.",Frederico Rodrigues Abraham; Waldemar Celes Filho,https://doi.org/10.1007/s00371-019-01674-x,null,J,no_arxiv,0
2018,IEEE TVCG,"CasCADe: A Novel 4D Visualization System for Virtual Construction Planning.",Paulo Ivson 0001; Daniel Nascimento; Waldemar Celes Filho; Simone D. J. Barbosa,https://doi.org/10.1109/TVCG.2017.2745105,top,J,no_arxiv,11
