2018,SANER,"Why and how Java developers break APIs.",Aline Brito; Laerte Xavier; André C. Hora; Marco Tulio Valente,http://doi.ieeecomputersociety.org/10.1109/SANER.2018.8330214,null
2017,SANER,"Historical and impact analysis of API breaking changes: A large-scale study.",Laerte Xavier; Aline Brito; André C. Hora; Marco Tulio Valente,https://doi.org/10.1109/SANER.2017.7884616,null
2016,ICSME,"Understanding the Factors That Impact the Popularity of GitHub Repositories.",Hudson Borges; André C. Hora; Marco Tulio Valente,https://doi.org/10.1109/ICSME.2016.31,null
2016,ICPC,"A novel approach for estimating Truck Factors.",Guilherme Avelino; Leonardo Teixeira Passos; André C. Hora; Marco Tulio Valente,https://doi.org/10.1109/ICPC.2016.7503718,null
2016,FSE,"When should internal interfaces be promoted to public?",André C. Hora; Marco Tulio Valente; Romain Robbes; Nicolas Anquetil,http://doi.acm.org/10.1145/2950290.2950306,top
2016,SANER,"Do Developers Deprecate APIs with Replacement Messages? A Large-Scale Analysis on Java Systems.",Gleison Brito; André C. Hora; Marco Tulio Valente; Romain Robbes,https://doi.org/10.1109/SANER.2016.99,null
2015,ICSME,"How do developers react to API evolution? The Pharo ecosystem case.",André C. Hora; Romain Robbes; Nicolas Anquetil; Anne Etien; Stéphane Ducasse; Marco Tulio Valente,https://doi.org/10.1109/ICSM.2015.7332471,null
