2017,ICSE,"Learning syntactic program transformations from examples.",Reudismam Rolim; Gustavo Soares; Loris D'Antoni; Oleksandr Polozov; Sumit Gulwani; Rohit Gheyi; Ryo Suzuki; Björn Hartmann,https://doi.org/10.1109/ICSE.2017.44,top
2017,ICSE,"Balancing soundness and efficiency for practical testing of configurable systems.",Sabrina Souto; Marcelo d'Amorim; Rohit Gheyi,https://doi.org/10.1109/ICSE.2017.64,top
2017,ICPC,"The discipline of preprocessor-based annotations does #ifdef TAG n't #endif matter.",Romero Malaquias; Márcio Ribeiro; Rodrigo Bonifácio; Eduardo Monteiro; Flávio Medeiros; Alessandro Garcia; Rohit Gheyi,https://doi.org/10.1109/ICPC.2017.41,null
2017,FSE,"Understanding the impact of refactoring on smells: a longitudinal study of 23 software projects.",Diego Cedrim; Alessandro Garcia; Melina Mongiovi; Rohit Gheyi; Leonardo da Silva Sousa; Rafael Maiani de Mello; Baldoino Fonseca; Márcio Ribeiro; Alexander Chávez,http://doi.acm.org/10.1145/3106237.3106259,top
2016,ICSE,"A comparison of 10 sampling algorithms for configurable systems.",Flávio Medeiros; Christian Kästner; Márcio Ribeiro; Rohit Gheyi; Sven Apel,http://doi.acm.org/10.1145/2884781.2884793,top
2015,SPLC,"A product line of theories for reasoning about safe evolution of product lines.",Leopoldo Teixeira; Vander Alves; Paulo Borba; Rohit Gheyi,http://doi.acm.org/10.1145/2791060.2791105,null
2014,ICSME,"Scaling Testing of Refactoring Engines.",Melina Mongiovi; Gustavo Mendes; Rohit Gheyi; Gustavo Soares; Márcio Ribeiro,https://doi.org/10.1109/ICSME.2014.59,null
