2015,Inf. Sciences,"A nature-inspired approach to speed up optimum-path forest clustering and its application to intrusion detection in computer networks.",UNICAMP; UNESP,Kelton A. P. Costa; Luis A. M. Pereira; Rodrigo Y. M. Nakamura; Clayton R. Pereira; João P. Papa; Alexandre Xavier Falcão,https://doi.org/10.1016/j.ins.2014.09.025,null,J,no_arxiv,24
2015,Inf. Sciences,"Approximate XML structure validation based on document-grammar tree similarity.",ICMC/USP; UFSC,Joe Tekli; Richard Chbeir; Agma J. M. Traina; Caetano Traina Jr.; Renato Fileto,https://doi.org/10.1016/j.ins.2014.09.044,null,J,no_arxiv,5
2015,Inf. Sciences,"High-level pattern-based classification via tourist walks in networks.",FFCLRP/USP,Thiago Christiano Silva; Liang Zhao 0001,https://doi.org/10.1016/j.ins.2014.09.048,null,J,no_arxiv,9
2015,Inf. Sciences,"Improving land cover classification through contextual-based optimum-path forest.",UNICAMP; UFSCAR; UNIFESP; UNESP,Daniel Osaku; Rodrigo Y. M. Nakamura; Luis A. M. Pereira; Rodrigo Jose Pisani; Alexandre L. M. Levada; Fabio A. M. Cappabianco; Alexandre X. Falcão; João Paulo Papa,https://doi.org/10.1016/j.ins.2015.06.020,null,J,no_arxiv,12
2015,Inf. Sciences,"On residual implications derived from overlap functions.",UFRN; FURG,Graçaliz Pereira Dimuro; Benjamín René Callejas Bedregal,https://doi.org/10.1016/j.ins.2015.03.049,null,J,no_arxiv,31
2015,Inf. Sciences,"Predicting the popularity of micro-reviews: A Foursquare case study.",UFMG,Marisa A. Vasconcelos; Jussara M. Almeida; Marcos André Gonçalves,https://doi.org/10.1016/j.ins.2015.07.001,null,J,no_arxiv,8
2015,Inf. Sciences,"Regulating social exchanges in open MAS: The problem of reciprocal conversions between POMDPs and HMMs.",UFRGS; FURG,Graçaliz Pereira Dimuro; Antônio Carlos da Rocha Costa,https://doi.org/10.1016/j.ins.2015.06.023,null,J,no_arxiv,3
2015,Inf. Sciences,"Shape classification using line segment statistics.",UFU,Jarbas Joaci de Mesquita Sá Junior; André Ricardo Backes,https://doi.org/10.1016/j.ins.2015.01.027,null,J,no_arxiv,9
2015,JMLR,"Evolving GPU machine code.",UERJ,Cleomar Pereira da Silva; Douglas Mota Dias; Cristiana Bentes; Marco Aurélio Cavalcanti Pacheco; Leandro Fontoura Cupertino,http://dl.acm.org/citation.cfm?id=2831136,top,J,no_arxiv,
2015,JMLR,"Exceptional rotations of random graphs: a VC theory.",IMPA,Louigi Addario-Berry; Shankar Bhamidi; Sébastien Bubeck; Luc Devroye; Gábor Lugosi; Roberto Imbuzeiro Oliveira,http://dl.acm.org/citation.cfm?id=2886810,top,J,http://arxiv.org/abs/1506.02811v1,
2015,KDD,"RSC: Mining and Modeling Temporal Activity in Social Media.",ICMC/USP,Alceu Ferraz Costa; Yuto Yamaguchi; Agma Juci Machado Traina; Caetano Traina Jr.; Christos Faloutsos,https://doi.org/10.1145/2783258.2783294,top,C,no_arxiv,12
2015,RecSys,"Context-Aware Event Recommendation in Event-based Social Networks.",UFCG; UFMG,Augusto Q. de Macedo; Leandro Balby Marinho; Rodrygo L. T. Santos,https://doi.org/10.1145/2792838.2800187,null,C,no_arxiv,55
2015,SDM,"Data Stream Classification Guided by Clustering on Nonstationary Environments and Extreme Verification Latency.",ICMC/USP,Vinícius M. A. de Souza; Diego Furtado Silva; João Gama; Gustavo E. A. P. A. Batista,https://doi.org/10.1137/1.9781611974010.98,null,C,no_arxiv,15
2014,Data Min. Knowl. Discov.,"CID: an efficient complexity-invariant distance for time series.",ICMC/USP,Gustavo E. A. P. A. Batista; Eamonn J. Keogh; Oben Moses Tataw; Vinícius M. A. de Souza,https://doi.org/10.1007/s10618-013-0312-3,null,J,no_arxiv,67
2014,ECML/PKDD,"A Lossless Data Reduction for Mining Constrained Patterns in n-ary Relations.",UFMG,Gabriel Poesia; Loïc Cerf,https://doi.org/10.1007/978-3-662-44851-9_37,null,C,no_arxiv,0
2014,ECML/PKDD,"Distinct Chains for Different Instances: An Effective Strategy for Multi-label Classifier Chains.",UFF,Pablo Nascimento da Silva; Eduardo Corrêa Gonçalves; Alexandre Plastino; Alex Alves Freitas,https://doi.org/10.1007/978-3-662-44851-9_29,null,C,no_arxiv,3
2014,ECML/PKDD,"Revisit Behavior in Social Media: The Phoenix-R Model and Discoveries.",UFMG,Flavio Figueiredo; Jussara M. Almeida; Yasuko Matsubara; Bruno Ribeiro 0001; Christos Faloutsos,https://doi.org/10.1007/978-3-662-44848-9_25,null,C,http://arxiv.org/abs/1405.1459v2,4
2014,ECML/PKDD,"Speeding Up Recovery from Concept Drifts.",UFPE,Silas Garrido Teixeira de Carvalho Santos; Paulo Mauricio Gonçalves Júnior; Geyson Daniel dos Santos Silva; Roberto Souto Maior de Barros,https://doi.org/10.1007/978-3-662-44845-8_12,null,C,no_arxiv,3
2014,ICML,"Active Learning of Parameterized Skills.",UFRGS,Bruno Castro da Silva; George Konidaris; Andrew G. Barto,http://jmlr.org/proceedings/papers/v32/silva14.html,top,C,no_arxiv,
2014,ICML,"Diagnosis determination: decision trees optimizing simultaneously worst and expected testing cost.",PUC-Rio,Ferdinando Cicalese; Eduardo Sany Laber; Aline Medeiros Saettler,http://jmlr.org/proceedings/papers/v32/cicalese14.html,top,C,no_arxiv,
2014,Inf. Fusion,"A localized algorithm for Structural Health Monitoring using wireless sensor networks.",DCC/UFRJ; UFC; NCE/UFRJ,Igor Leão dos Santos; Luci Pirmez; Érico Lemos; Flávia Coimbra Delicato; Luiz A. Vaz Pinto; José Neuman de Souza; Albert Y. Zomaya,https://doi.org/10.1016/j.inffus.2012.02.002,null,J,no_arxiv,14
2014,Inf. Fusion,"GeoSpray: A geographic routing protocol for vehicular delay-tolerant networks.",Inatel,Vasco N. G. J. Soares; Joel J. P. C. Rodrigues; Farid Farahmand,https://doi.org/10.1016/j.inffus.2011.11.003,null,J,no_arxiv,96
2014,Inf. Fusion,"On query processing in wireless sensor networks using classes of quality of queries.",UNIFOR,Angelo Brayner; André L. V. Coelho; Karina Marinho de Souza; Raimir Holanda; Wagner Castro,https://doi.org/10.1016/j.inffus.2012.01.010,null,J,no_arxiv,7
2014,Inf. Fusion,"Spatial query processing in wireless sensor networks - A survey.",UFMG,Rone Ilídio da Silva; Daniel Fernandes Macedo; José Marcos S. Nogueira,https://doi.org/10.1016/j.inffus.2012.08.006,null,J,no_arxiv,10
2014,Inf. Sciences,"A feature selection technique for inference of graphs from their known topological properties: Revealing scale-free gene regulatory networks.",UFABC; UTFPR; IME/USP,Fabrício Martins Lopes; David Correa Martins Jr.; Junior Barrera; Roberto Marcondes Cesar Jr.,https://doi.org/10.1016/j.ins.2014.02.096,null,J,no_arxiv,27
2014,Inf. Sciences,"A multi-objective optimization approach for the integration and test order problem.",UFPR; UEM,Wesley Klewerton Guez Assunção; Thelma Elita Colanzi; Silvia Regina Vergilio; Aurora T. R. Pozo,https://doi.org/10.1016/j.ins.2013.12.040,null,J,no_arxiv,22
2014,Inf. Sciences,"A scalable re-ranking method for content-based image retrieval.",UNESP; UNIFESP; UNICAMP,Daniel Carlos Guimarães Pedronette; Jurandy Almeida; Ricardo da Silva Torres,https://doi.org/10.1016/j.ins.2013.12.030,null,J,no_arxiv,27
2014,Inf. Sciences,"A seven-dimensional flow analysis to help autonomous network management.",Inatel; UEL,Marcos V. O. de Assis; Joel J. P. C. Rodrigues; Mario Lemes Proença Jr.,https://doi.org/10.1016/j.ins.2014.03.102,null,J,no_arxiv,15
2014,Inf. Sciences,"Aggregation functions for typical hesitant fuzzy elements and the action of automorphisms.",UFRN; UFPEL,Benjamín R. C. Bedregal; Renata Reiser; Humberto Bustince Sola; Carlos Lopez-Molina; Vicenç Torra,https://doi.org/10.1016/j.ins.2013.08.024,null,J,no_arxiv,77
2014,Inf. Sciences,"An approach to generate and embed sign language video tracks into multimedia contents.",UFPEL,Tiago Maritan Ugulino de Araújo; Felipe Lacet S. Ferreira; Danilo Assis Nobre dos S. Silva; Leonardo Dantas de Oliveira; Eduardo De Lucena Falcão; Leonardo Araújo Domingues; Vandhuy F. Martins; Igor A. C. Portela; Yúrika Sato Nóbrega; Hozana R. G. Lima; Guido Lemos de Souza Filho; Tatiana A. Tavares; Alexandre Duarte,https://doi.org/10.1016/j.ins.2014.04.008,null,J,no_arxiv,8
2014,Inf. Sciences,"Analysis of fitness landscape modifications in evolutionary dynamic optimization.",FFCLRP/USP,Renato Tinós; Shengxiang Yang,https://doi.org/10.1016/j.ins.2014.05.053,null,J,no_arxiv,5
2014,Inf. Sciences,"Architecture and protocol for intercloud communication.",Inatel,Jaime Lloret; Miguel Garcia; Jesús Tomás; Joel J. P. C. Rodrigues,https://doi.org/10.1016/j.ins.2013.05.003,null,J,no_arxiv,23
2014,Inf. Sciences,"Disclosed: An efficient depth-first, top-down algorithm for mining disjunctive closed itemsets in high-dimensional data.",UFPE,Renato Vimieiro; Pablo Moscato,https://doi.org/10.1016/j.ins.2014.04.044,null,J,no_arxiv,9
2014,Inf. Sciences,"Evolving decision trees with beam search-based initialization and lexicographic multi-objective evaluation.",ICMC/USP; UNIFESP; PUC-RS,Márcio P. Basgalupp; Rodrigo C. Barros; André Carlos Ponce Leon Ferreira de Carvalho; Alex Alves Freitas,https://doi.org/10.1016/j.ins.2013.07.025,null,J,no_arxiv,11
2014,Inf. Sciences,"K-operators: An approach to the generation of interval-valued fuzzy implications from fuzzy implications and vice versa.",UFRN; UFPEL,Renata Hax Sander Reiser; Benjamín René Callejas Bedregal,https://doi.org/10.1016/j.ins.2012.12.047,null,J,no_arxiv,3
2014,Inf. Sciences,"On (G, N)-implications derived from grouping functions.",UFRN; FURG,Graçaliz Pereira Dimuro; Benjamín R. C. Bedregal; Regivan Hugo Nunes Santiago,https://doi.org/10.1016/j.ins.2014.04.021,null,J,no_arxiv,31
2014,Inf. Sciences,"Pollution, bad-mouthing, and local marketing: The underground of location-based social networks.",UFMG; UFLA,Helen Costa; Luiz Henrique de Campos Merschmann; Fabrício Barth; Fabrício Benevenuto,https://doi.org/10.1016/j.ins.2014.03.108,null,J,no_arxiv,8
2014,Inf. Sciences,"QuMinS: Fast and scalable querying, mining and summarizing multi-modal databases.",ICMC/USP,Robson L. F. Cordeiro; Fan Guo; Donna S. Haverkamp; James H. Horne; Ellen K. Hughes; Gunhee Kim; Luciana A. S. Romani; Priscila P. Coltri; Tamires T. Souza; Agma J. M. Traina; Caetano Traina Jr.; Christos Faloutsos,https://doi.org/10.1016/j.ins.2013.11.013,null,J,no_arxiv,1
2014,Inf. Sciences,"Real-time query processing optimization for cloud-based wireless body area networks.",Inatel,Ousmane Diallo; Joel J. P. C. Rodrigues; Mbaye Sene; Jianwei Niu 0002,https://doi.org/10.1016/j.ins.2014.03.081,null,J,no_arxiv,26
2014,JMLR,"Do we need hundreds of classifiers to solve real world classification problems?",UEBA,Manuel Fernández Delgado; Eva Cernadas; Senén Barro; Dinani Gomes Amorim,http://dl.acm.org/citation.cfm?id=2697065,top,J,no_arxiv,
2014,Machine Learning,"Fast relational learning using bottom clause propositionalization with artificial neural networks.",COPPE/UFRJ,Manoel V. M. França; Gerson Zaverucha; Artur S. d'Avila Garcez,https://doi.org/10.1007/s10994-013-5392-1,null,J,no_arxiv,9
