2019,Inf. Fusion,"An iterative boosting-based ensemble for streaming data classification.",UNICAMP; UFSCAR,João Roberto Bertini Junior; Maria do Carmo Nicoletti,https://doi.org/10.1016/j.inffus.2018.01.003,null,J,no_arxiv,2
2019,Inf. Fusion,"Multimodal data fusion for sensitive scene localization.",UNICAMP,Daniel Moreira; Sandra Avila; Mauricio Perez; Daniel Moraes; Vanessa Testoni; Eduardo Valle; Siome Goldenstein; Anderson Rocha,https://doi.org/10.1016/j.inffus.2018.03.001,null,J,no_arxiv,1
2019,Inf. Fusion,"Postpartum depression prediction through pregnancy data analysis for emotion-aware smart systems.",Inatel,Mario W. L. Moreira; Joel J. P. C. Rodrigues; Neeraj Kumar 0001; Kashif Saleem; Igor V. Illin,https://doi.org/10.1016/j.inffus.2018.07.001,null,J,no_arxiv,0
2019,Inf. Sciences,"A dynamic computational model of motivation based on self-determination theory and CANN.",UFRG,Hendry Ferreira Chame; Fernanda Pinto Mota; Silvia Silva da Costa Botelho,https://doi.org/10.1016/j.ins.2018.09.055,null,J,no_arxiv,0
2019,Inf. Sciences,"A new data characterization for selecting clustering algorithms using meta-learning.",ICMC/USP,Bruno Almeida Pimentel; André C. P. L. F. de Carvalho,https://doi.org/10.1016/j.ins.2018.10.043,null,J,no_arxiv,0
2019,Inf. Sciences,"An analysis of hierarchical text classification using word embeddings.",Unisinos,Roger A. Stein; Patrícia Augustin Jaques; João Francisco Valiati,https://doi.org/10.1016/j.ins.2018.09.001,null,J,http://arxiv.org/abs/1809.01771v1,0
2019,Inf. Sciences,"Mathematical modeling of delivery delay for multi-copy opportunistic networks with heterogeneous pairwise encounter rates.",COPPE/UFRJ,Gabriela Moutinho de Souza Dias; José Ferreira de Rezende; Ronaldo Moreira Salles,https://doi.org/10.1016/j.ins.2018.09.056,null,J,no_arxiv,0
2019,Inf. Sciences,"Optimal Boolean lattice-based algorithms for the U-curve optimization problem.",IME/USP,Marcelo da Silva Reis; Gustavo Estrela; Carlos Eduardo Ferreira; Junior Barrera,https://doi.org/10.1016/j.ins.2018.08.060,null,J,no_arxiv,0
2018,ACM TKDD,"ATR-Vis: Visual and Interactive Information Retrieval for Parliamentary Discussions in Twitter.",ICMC/USP,Raheleh Makki; Eder J. de Carvalho; Axel J. Soto; Stephen Brooks; Maria Cristina Ferreira de Oliveira; Evangelos E. Milios; Rosane Minghim,https://doi.org/10.1145/3047010,top,J,no_arxiv,0
2018,Data Min. Knowl. Discov.,"Selective harvesting over networks.",UFMG,Fabricio Murai; Diogo Rennó; Bruno Ribeiro 0001; Gisele L. Pappa; Don Towsley; Krista Gile,https://doi.org/10.1007/s10618-017-0523-0,null,J,http://arxiv.org/abs/1703.05082v1,2
2018,Data Min. Knowl. Discov.,"Speeding up similarity search under dynamic time warping by pruning unpromising alignments.",ICMC/USP,Diego Furtado Silva; Rafael Giusti; Eamonn J. Keogh; Gustavo E. A. P. A. Batista,https://doi.org/10.1007/s10618-018-0557-y,null,J,no_arxiv,2
2018,ECML/PKDD,"One-Class Quantification.",ICMC/USP,Denis Moreira dos Reis; André Gustavo Maletzke; Everton Cherman; Gustavo Enrique De Almeida Prado Alves Batista,https://doi.org/10.1007/978-3-030-10925-7_17,null,C,no_arxiv,0
2018,ICML,"Binary Partitions with Approximate Minimum Impurity.",PUC-Rio,Eduardo Sany Laber; Marco Molinaro; Felipe de A. Mello Pereira,http://proceedings.mlr.press/v80/laber18a.html,top,C,no_arxiv,
2018,ICML,"Hierarchical Multi-Label Classification Networks.",UFSCAR; PUC-RS,Jonatas Wehrmann; Ricardo Cerri; Rodrigo C. Barros,http://proceedings.mlr.press/v80/wehrmann18a.html,top,C,no_arxiv,
2018,IEEE TKDE,"A Thorough Evaluation of Distance-Based Meta-Features for Automated Text Classification.",UFMG,Sérgio D. Canuto; Daniel Xavier de Sousa; Marcos André Gonçalves; Thierson Couto Rosa,https://doi.org/10.1109/TKDE.2018.2820051,top,J,no_arxiv,1
2018,Inf. Fusion,"Dynamic classifier selection: Recent advances and perspectives.",UFPE,Rafael M. O. Cruz; Robert Sabourin; George D. C. Cavalcanti,https://doi.org/10.1016/j.inffus.2017.09.010,null,J,no_arxiv,21
2018,Inf. Sciences,"-integrals: A new family of pre-aggregation functions with application to fuzzy rule-based classification systems.",UFRN; FURG,Giancarlo Lucca; José Antonio Sanz; Graçaliz Pereira Dimuro; Benjamín R. C. Bedregal; Humberto Bustince; Radko Mesiar,https://doi.org/10.1016/j.ins.2017.12.029,null,J,no_arxiv,8
2018,Inf. Sciences,"A greedy search tree heuristic for symbolic regression.",UFABC,Fabrício Olivetti de França,https://doi.org/10.1016/j.ins.2018.02.040,null,J,http://arxiv.org/abs/1801.01807v1,1
2018,Inf. Sciences,"A large-scale comparison of concept drift detectors.",UFPE,Roberto Souto Maior de Barros; Silas Garrido Teixeira de Carvalho Santos,https://doi.org/10.1016/j.ins.2018.04.014,null,J,no_arxiv,1
2018,Inf. Sciences,"An exact approach to extend network lifetime in a general class of wireless sensor networks.",UNESP,Fabian Castaño; André Rossi; Marc Sevaux; Nubia Velasco,https://doi.org/10.1016/j.ins.2017.12.028,null,J,no_arxiv,1
2018,Inf. Sciences,"An exponential-type kernel robust regression model for interval-valued variables.",UFPE,Eufrasio de Andrade Lima Neto; Francisco de A. T. de Carvalho,https://doi.org/10.1016/j.ins.2018.05.008,null,J,no_arxiv,0
2018,Inf. Sciences,"Application of two different methods for extending lattice-valued restricted equivalence functions used for constructing similarity measures on -fuzzy sets.",UFRN,Eduardo Silva Palmeira; Benjamín R. C. Bedregal; Humberto Bustince; Daniel Paternain; Laura De Miguel,https://doi.org/10.1016/j.ins.2018.02.022,null,J,no_arxiv,1
2018,Inf. Sciences,"Concept drift detection based on Fisher's Exact test.",UFPE,Danilo Rafael de Lima Cabral; Roberto Souto Maior de Barros,https://doi.org/10.1016/j.ins.2018.02.054,null,J,no_arxiv,3
2018,Inf. Sciences,"Handling high dimensionality contexts in formal concept analysis via binary decision diagrams.",PUC Minas,Sebastião M. Neto; Luis E. Zárate; Mark A. J. Song,https://doi.org/10.1016/j.ins.2017.11.028,null,J,no_arxiv,1
2018,Inf. Sciences,"Incremental evaluation of continuous preference queries.",UFU,Marcos Roberto Ribeiro; Maria Camila Nardini Barioni; Sandra de Amo; Claudia Roncancio; Cyril Labbé,https://doi.org/10.1016/j.ins.2018.04.030,null,J,no_arxiv,0
2018,Inf. Sciences,"Metalearning and Recommender Systems: A literature review and empirical study on the algorithm selection problem for Collaborative Filtering.",ICMC/USP,Tiago Cunha 0001; Carlos Soares; André C. P. L. F. de Carvalho,https://doi.org/10.1016/j.ins.2017.09.050,null,J,no_arxiv,6
2018,Inf. Sciences,"Multi-label semi-supervised classification through optimum-path forest.",UNICAMP; UNESP; UFGD,Willian Paraguassu Amorim; Alexandre X. Falcão; João P. Papa,https://doi.org/10.1016/j.ins.2018.06.067,null,J,no_arxiv,0
2018,Inf. Sciences,"Multi-objective genetic algorithms in the study of the genetic code's adaptability.",FFCLRP/USP,Lariza Laura de Oliveira; Alex Alves Freitas; Renato Tinós,https://doi.org/10.1016/j.ins.2017.10.022,null,J,no_arxiv,5
2018,Inf. Sciences,"NetClass: A network-based relational model for document classification.",UFSJ; UFMG,Fernando Mourão; Leonardo C. da Rocha; Felipe Viegas; Thiago Salles; Marcos André Gonçalves; Srinivasan Parthasarathy 0001; Wagner Meira Jr.,https://doi.org/10.1016/j.ins.2018.08.027,null,J,no_arxiv,0
2018,Inf. Sciences,"Revising the structure of Bayesian network classifiers in the presence of missing data.",UFF; COPPE/UFRJ,Roosevelt Sardinha; Aline Paes; Gerson Zaverucha,https://doi.org/10.1016/j.ins.2018.02.011,null,J,no_arxiv,0
2018,Inf. Sciences,"Word sense disambiguation: A complex network approach.",ICMC/USP,Edilson Anselmo Corrêa Júnior; Alneu de Andrade Lopes; Diego R. Amancio,https://doi.org/10.1016/j.ins.2018.02.047,null,J,http://arxiv.org/abs/1606.07950v2,1
2018,KDD,"Classifying and Counting with Recurrent Contexts.",ICMC/USP,Denis Moreira dos Reis; André Gustavo Maletzke; Diego Furtado Silva; Gustavo E. A. P. A. Batista,https://doi.org/10.1145/3219819.3220059,top,C,no_arxiv,0
2018,Machine Learning,"A comparison of hierarchical multi-output recognition approaches for anuran classification.",UFAM,Juan Gabriel Colonna; João Gama; Eduardo Freire Nakamura,https://doi.org/10.1007/s10994-018-5739-8,null,J,no_arxiv,0
2018,Machine Learning,"Data complexity meta-features for regression problems.",UNIFESP; UFPE,Ana Carolina Lorena; Aron I. Maciel; Péricles B. C. de Miranda; Ivan G. Costa; Ricardo B. C. Prudêncio,https://doi.org/10.1007/s10994-017-5681-1,null,J,no_arxiv,0
2018,Machine Learning,"On analyzing user preference dynamics with temporal social networks.",UFU,Fabiola S. F. Pereira; João Gama; Sandra de Amo; Gina M. B. Oliveira,https://doi.org/10.1007/s10994-018-5740-2,null,J,no_arxiv,0
2018,SDM,"A Novel Genetic Algorithm for Feature Selection in Hierarchical Feature Spaces.",UFF,Pablo Nascimento da Silva; Alexandre Plastino; Alex Alves Freitas,https://doi.org/10.1137/1.9781611975321.83,null,C,no_arxiv,0
2017,ACM TKDD,"Modeling Temporal Activity to Detect Anomalous Behavior in Social Media.",ICMC/USP,Alceu Ferraz Costa; Yuto Yamaguchi; Agma Juci Machado Traina; Caetano Traina Jr.; Christos Faloutsos,https://doi.org/10.1145/3064884,top,J,no_arxiv,0
2017,BigData,"A data-driven approach to help understanding the preferences of public transport users.",UNIFOR,Vasco Furtado; Elizabeth Furtado; Carlos Caminha; André Lopes; Victor Dantas; Caio Ponte; Sofia Cavalcante,https://doi.org/10.1109/BigData.2017.8258138,null,C,no_arxiv,1
2017,Inf. Fusion,"META-DES.Oracle: Meta-learning and feature selection for dynamic ensemble selection.",UFPE,Rafael M. O. Cruz; Robert Sabourin; George D. C. Cavalcanti,https://doi.org/10.1016/j.inffus.2017.02.010,null,J,no_arxiv,15
2017,Inf. Sciences,"A general framework to expand short text for topic modeling.",CEFET-MG; UFMG,Paulo Viana Bicalho; Marcelo Pita; Gabriel Pedrosa; Anísio Lacerda; Gisele L. Pappa,https://doi.org/10.1016/j.ins.2017.02.007,null,J,no_arxiv,9
2017,Inf. Sciences,"Anomaly detection using the correlational paraconsistent machine with digital signatures of network segment.",Inatel; UEL,Eduardo H. M. Pena; Luiz Fernando Carvalho; Sylvio Barbon Junior; Joel J. P. C. Rodrigues; Mario Lemes Proença Jr.,https://doi.org/10.1016/j.ins.2017.08.074,null,J,no_arxiv,4
2017,Inf. Sciences,"Choquet based TOPSIS and TODIM for dynamic and heterogeneous decision making with criteria interaction.",UFES,Rodolfo Lourenzutti; Renato A. Krohling; Marek Z. Reformat,https://doi.org/10.1016/j.ins.2017.04.037,null,J,no_arxiv,14
2017,Inf. Sciences,"Combining dissimilarity spaces for text categorization.",UFPE,Roberto H. W. Pinheiro; George D. C. Cavalcanti; Ing Ren Tsang,https://doi.org/10.1016/j.ins.2017.04.025,null,J,no_arxiv,2
2017,Inf. Sciences,"Copulas-based time series combined forecasters.",UFRPE,Ricardo T. A. de Oliveira; Thaize Fernandes O. de Assis; Paulo Renato A. Firmino; Tiago A. E. Ferreira,https://doi.org/10.1016/j.ins.2016.10.022,null,J,no_arxiv,4
2017,Inf. Sciences,"Enumerating all maximal biclusters in numerical datasets.",UNICAMP,Rosana Veroneze; Arindam Banerjee; Fernando J. Von Zuben,https://doi.org/10.1016/j.ins.2016.10.029,null,J,http://arxiv.org/abs/1403.3562v4,2
2017,Inf. Sciences,"FIoT: An agent-based framework for self-adaptive and self-organizing applications based on the Internet of Things.",PUC-Rio,Nathalia Moraes do Nascimento; Carlos José Pereira de Lucena,https://doi.org/10.1016/j.ins.2016.10.031,null,J,no_arxiv,11
2017,Inf. Sciences,"Fuzzy clustering of distributional data with automatic weighting of variable components.",UFPE,Antonio Irpino; Rosanna Verde; Francisco de A. T. de Carvalho,https://doi.org/10.1016/j.ins.2017.04.040,null,J,no_arxiv,3
2017,Inf. Sciences,"H3AD: A hybrid hyper-heuristic for algorithm design.",UFMG; UFPE,Péricles B. C. de Miranda; Ricardo B. C. Prudêncio; Gisele L. Pappa,https://doi.org/10.1016/j.ins.2017.05.029,null,J,no_arxiv,0
2017,Inf. Sciences,"Heuristics for lifetime maximization in camera sensor networks.",UNESP,Alok Singh 0001; André Rossi; Marc Sevaux,https://doi.org/10.1016/j.ins.2017.01.017,null,J,no_arxiv,3
2017,Inf. Sciences,"Multiobjective decomposition-based Mallows Models estimation of distribution algorithm. A case of study for permutation flowshop scheduling problem.",UFPR,Murilo Zangari; Alexander Mendiburu; Roberto Santana; Aurora T. R. Pozo,https://doi.org/10.1016/j.ins.2017.02.034,null,J,no_arxiv,8
2017,Inf. Sciences,"ORFEL: Efficient detection of defamation or illegitimate promotion in online recommendation.",ICMC/USP,Gabriel P. Gimenes; Robson L. F. Cordeiro; José Fernando Rodrigues Jr.,https://doi.org/10.1016/j.ins.2016.09.006,null,J,http://arxiv.org/abs/1505.06747v6,3
2017,Inf. Sciences,"Ranked batch-mode active learning.",UFMG,Thiago N. C. Cardoso; Rodrigo M. Silva; Sérgio D. Canuto; Mirella M. Moro; Marcos André Gonçalves,https://doi.org/10.1016/j.ins.2016.10.037,null,J,no_arxiv,1
2017,Inf. Sciences,"The strength of the work ties.",UFMG,Douglas Castilho; Pedro O. S. Vaz de Melo; Fabrício Benevenuto,https://doi.org/10.1016/j.ins.2016.09.009,null,J,no_arxiv,2
2017,KDD,": Learning Node Representations from Structural Identity.",COPPE/UFRJ,Leonardo Filipe Rodrigues Ribeiro; Pedro H. P. Saverese; Daniel R. Figueiredo,https://doi.org/10.1145/3097983.3098061,top,C,http://arxiv.org/abs/1704.03165v3,15
2017,KDD,"Luck is Hard to Beat: The Difficulty of Sports Prediction.",UFMG,Raquel Y. S. Aoki; Renato Martins Assunção; Pedro O. S. Vaz de Melo,https://doi.org/10.1145/3097983.3098045,top,C,http://arxiv.org/abs/1706.02447v1,0
2017,Machine Learning,"Adaptive random forests for evolving data stream classification.",PUC-PR,Heitor Murilo Gomes; Albert Bifet; Jesse Read; Jean Paul Barddal; Fabrício Enembreck; Bernhard Pfharinger; Geoff Holmes; Talel Abdessalem,https://doi.org/10.1007/s10994-017-5642-8,null,J,no_arxiv,13
2017,Machine Learning,"Nearest neighbors distance ratio open-set classifier.",UNICAMP,Pedro Ribeiro Mendes-Junior; Roberto Medeiros de Souza; Rafael de Oliveira Werneck; Bernardo V. Stein; Daniel V. Pazinato; Waldir R. de Almeida; Otávio A. B. Penatti; Ricardo da Silva Torres; Anderson Rocha,https://doi.org/10.1007/s10994-016-5610-8,null,J,no_arxiv,5
2017,Machine Learning,"On the use of stochastic local search techniques to revise first-order logic theories from examples.",UFF; COPPE/UFRJ,Aline Paes; Gerson Zaverucha; Vítor Santos Costa,https://doi.org/10.1007/s10994-016-5595-3,null,J,no_arxiv,1
2017,Machine Learning,"Weightless neural networks for open set recognition.",COPPE/UFRJ,Douglas de O. Cardoso; João Gama; Felipe M. G. França,https://doi.org/10.1007/s10994-017-5646-4,null,J,no_arxiv,2
2017,RecSys,"Exploiting Socio-Economic Models for Lodging Recommendation in the Sharing Economy.",UFMG,Raul Sanchez-Vazquez; Jordan Silva; Rodrygo L. T. Santos,https://doi.org/10.1145/3109859.3109910,null,C,no_arxiv,2
2017,RecSys,"Metalearning for Context-aware Filtering: Selection of Tensor Factorization Algorithms.",ICMC/USP,Tiago Cunha 0001; Carlos Soares; André C. P. L. F. Carvalho,https://doi.org/10.1145/3109859.3109899,null,C,no_arxiv,0
2017,SDM,"VolTime: Unsupervised Anomaly Detection on Users' Online Activity Volume.",ICMC/USP,Daniel Y. T. Chino; Alceu Ferraz Costa; Agma J. M. Traina; Christos Faloutsos,https://doi.org/10.1137/1.9781611974973.13,null,C,no_arxiv,2
2016,BigData,"Managing hot metadata for scientific workflows on multisite clouds.",COPPE/UFRJ,Luis Pineda-Morales; Ji Liu 0003; Alexandru Costan; Esther Pacitti; Gabriel Antoniu; Patrick Valduriez; Marta Mattoso,https://doi.org/10.1109/BigData.2016.7840628,null,C,no_arxiv,0
2016,Data Min. Knowl. Discov.,"Ensembles of label noise filters: a ranking approach.",UNIFESP; ICMC/USP,Luís Paulo F. Garcia; Ana Carolina Lorena; Stan Matwin; André Carlos Ponce de Leon Ferreira de Carvalho,https://doi.org/10.1007/s10618-016-0475-9,null,J,no_arxiv,9
2016,Data Min. Knowl. Discov.,"MINAS: multiclass learning algorithm for novelty detection in data streams.",ICMC/USP; UFU,Elaine Ribeiro de Faria; André Carlos Ponce de Leon Ferreira de Carvalho; João Gama,https://doi.org/10.1007/s10618-015-0433-y,null,J,no_arxiv,6
2016,ECML/PKDD,"Infection Hot Spot Mining from Social Media Trajectories.",UFMG,Roberto C. S. N. P. Souza; Renato M. Assunção; Derick M. de Oliveira; Denise E. F. de Brito; Wagner Meira Jr.,https://doi.org/10.1007/978-3-319-46227-1_46,null,C,no_arxiv,0
2016,ECML/PKDD,"M-Flash: Fast Billion-Scale Graph Computation Using a Bimodal Block Processing Model.",ICMC/USP,Hugo Gualdron; Robson L. F. Cordeiro; José Fernando Rodrigues Jr.; Duen Horng (Polo) Chau; Minsuk Kahng; U. Kang,https://doi.org/10.1007/978-3-319-46227-1_39,null,C,no_arxiv,0
2016,ECML/PKDD,"On Dynamic Feature Weighting for Feature Drifting Data Streams.",PUC-PR,Jean Paul Barddal; Heitor Murilo Gomes; Fabrício Enembreck; Bernhard Pfahringer; Albert Bifet,https://doi.org/10.1007/978-3-319-46227-1_9,null,C,no_arxiv,2
2016,ECML/PKDD,"Selecting Collaborative Filtering Algorithms Using Metalearning.",ICMC/USP,Tiago Cunha 0001; Carlos Soares; André C. P. L. F. de Carvalho,https://doi.org/10.1007/978-3-319-46227-1_25,null,C,no_arxiv,4
2016,ICDM,"Vote-and-Comment: Modeling the Coevolution of User Interactions in Social Voting Web Sites.",ICMC/USP,Alceu Ferraz Costa; Agma Juci Machado Traina; Caetano Traina Jr.; Christos Faloutsos,https://doi.org/10.1109/ICDM.2016.0020,top,C,no_arxiv,1
2016,ICML,"Energetic Natural Gradient Descent.",UFRGS,Philip S. Thomas; Bruno Castro da Silva; Christoph Dann; Emma Brunskill,http://jmlr.org/proceedings/papers/v48/thomasb16.html,top,C,no_arxiv,
2016,Inf. Fusion,"A position and perspective analysis of hesitant fuzzy sets on information fusion in decision making. Towards high quality progress.",UFRN,Rosa M. Rodríguez; Benjamín R. C. Bedregal; Humberto Bustince; Yucheng Dong; Bahram Farhadinia; Cengiz Kahraman; Luis Martínez-López; Vicenç Torra; Y. J. Xu; Zeshui Xu; Francisco Herrera,https://doi.org/10.1016/j.inffus.2015.11.004,null,J,no_arxiv,112
2016,Inf. Sciences,"A Technique to provide differential privacy for appliance usage in smart metering.",UFCG,Pedro Barbosa; Andrey Brito; Hyggo Oliveira de Almeida,https://doi.org/10.1016/j.ins.2016.08.011,null,J,no_arxiv,8
2016,Inf. Sciences,"A generalized TOPSIS method for group decision making with heterogeneous information in a dynamic environment.",UFES,Rodolfo Lourenzutti; Renato A. Krohling,https://doi.org/10.1016/j.ins.2015.10.005,null,J,no_arxiv,29
2016,Inf. Sciences,"A generalized distance based on a generalized triangle inequality.",UFRN,Fágner L. Santana; Regivan H. N. Santiago,https://doi.org/10.1016/j.ins.2016.01.058,null,J,no_arxiv,1
2016,Inf. Sciences,"A stopping criterion for multi-objective optimization evolutionary algorithms.",UFF,Luis Martí; Jesús García; Antonio Berlanga; José M. Molina,https://doi.org/10.1016/j.ins.2016.07.025,null,J,no_arxiv,6
2016,Inf. Sciences,"Account classification in online social networks with LBCA and wavelets.",UEL,Rodrigo Augusto Igawa; Sylvio Barbon; Katia Cristina Silva Paulo; Guilherme Sakaji Kido; Rodrigo Capobianco Guido; Mario Lemes Proença Jr.; Ivan Nunes da Silva,https://doi.org/10.1016/j.ins.2015.10.039,null,J,no_arxiv,6
2016,Inf. Sciences,"An interval extension of homogeneous and pseudo-homogeneous t-norms and t-conorms.",UFRN,Lucelia Lima Costa; Benjamín R. C. Bedregal; Humberto Bustince; Edurne Barrenechea; Marcus P. da Rocha,https://doi.org/10.1016/j.ins.2015.11.031,null,J,no_arxiv,6
2016,Inf. Sciences,"Analysis of Ant Colony Optimization-based routing in optical networks in the presence of byzantine failures.",UFABC,Gustavo Sousa Pavani; Anderson de França Queiroz; Jerônimo Cordoni Pellegrini,https://doi.org/10.1016/j.ins.2016.01.008,null,J,no_arxiv,3
2016,Inf. Sciences,"Evolutionary algorithms and elliptical copulas applied to continuous optimization problems.",UFF; PUC-Rio,Harold Dias de Mello Junior; Luis Martí; André Vargas Abs da Cruz; Marley M. B. R. Vellasco,https://doi.org/10.1016/j.ins.2016.07.006,null,J,no_arxiv,5
2016,Inf. Sciences,"Generalized quasi-metric on strings.",UFRN,Fagner Santana; Regivan H. N. Santiago; Benjamín R. C. Bedregal; Daniel Paternain; Humberto Bustince,https://doi.org/10.1016/j.ins.2016.01.097,null,J,no_arxiv,0
2016,Inf. Sciences,"Genetic generation of fuzzy systems with rule extraction using formal concept analysis.",UFSCAR,Marcos E. Cintra; Heloisa A. Camargo; Maria Carolina Monard,https://doi.org/10.1016/j.ins.2016.02.026,null,J,no_arxiv,7
2016,Inf. Sciences,"Many Objective Particle Swarm Optimization.",UFPE,Elliackin M. N. Figueiredo; Teresa Bernarda Ludermir; Carmelo J. A. Bastos Filho,https://doi.org/10.1016/j.ins.2016.09.026,null,J,no_arxiv,15
2016,Inf. Sciences,"Musical rhythmic pattern extraction using relevance of communities in networks.",FFCLRP/USP,Andres Eduardo Coca Salazar; Liang Zhao 0001,https://doi.org/10.1016/j.ins.2015.09.030,null,J,no_arxiv,2
2016,Inf. Sciences,"PhenoVis - A tool for visual phenological analysis of digital camera images using chronological percentage maps.",UFRGS; UNIFESP; UNICAMP,Roger A. Leite; Lucas Mello Schnorr; Jurandy Almeida; Bruna Alberton; Leonor Patricia C. Morellato; Ricardo da Silva Torres; João Luiz Dihl Comba,https://doi.org/10.1016/j.ins.2016.08.052,null,J,no_arxiv,2
2016,Inf. Sciences,"Quota traveling car renter problem: Model and evolutionary algorithm.",UFRN,Marco César Goldbarg; Elizabeth Ferreira Gouvea Goldbarg; Matheus da Silva Menezes; Henrique P. L. Luna,https://doi.org/10.1016/j.ins.2016.05.027,null,J,no_arxiv,2
2016,Inf. Sciences,"Social choice in distributed classification tasks: Dealing with vertically partitioned data.",UFRGS,Mariana Recamonde Mendoza; Ana L. C. Bazzan,https://doi.org/10.1016/j.ins.2015.11.001,null,J,no_arxiv,4
2016,Inf. Sciences,"Texture recognition based on diffusion in networks.",UFMS,Wesley Nunes Gonçalves; Núbia Rosa da Silva; Luciano da Fontoura Costa; Odemir Martinez Bruno,https://doi.org/10.1016/j.ins.2016.04.052,null,J,no_arxiv,3
2016,Inf. Sciences,"Time series clustering via community detection in networks.",FFCLRP/USP,Leonardo Nascimento Ferreira; Liang Zhao 0001,https://doi.org/10.1016/j.ins.2015.07.046,null,J,http://arxiv.org/abs/1508.04757v1,34
2016,Inf. Sciences,"TrendLearner: Early prediction of popularity trends of user generated content.",UFMG,Flavio Figueiredo; Jussara M. Almeida; Marcos André Gonçalves; Fabrício Benevenuto,https://doi.org/10.1016/j.ins.2016.02.025,null,J,http://arxiv.org/abs/1402.2351v4,10
2016,Inf. Sciences,"Using unsupervised information to improve semi-supervised tweet sentiment classification.",UFSCAR; UNESP,Nádia Félix Felipe da Silva; Luiz F. S. Coletta; Eduardo R. Hruschka; Estevam R. Hruschka Jr.,https://doi.org/10.1016/j.ins.2016.02.002,null,J,no_arxiv,16
2016,JMLR,"Multi-task Sparse Structure Learning with Gaussian Copula Models.",UNICAMP,André Ricardo Gonçalves; Fernando J. Von Zuben; Arindam Banerjee,http://jmlr.org/papers/v17/15-215.html,top,J,no_arxiv,
2016,KDD,"Burstiness Scale: A Parsimonious Model for Characterizing Random Series of Events.",UFMG,Rodrigo Augusto da Silva Alves; Renato Martins Assunção; Pedro Olmo Stancioli Vaz de Melo,https://doi.org/10.1145/2939672.2939852,top,C,no_arxiv,1
2016,KDD,"Fast Unsupervised Online Drift Detection Using Incremental Kolmogorov-Smirnov Test.",ICMC/USP,Denis Moreira dos Reis; Peter A. Flach; Stan Matwin; Gustavo E. A. P. A. Batista,https://doi.org/10.1145/2939672.2939836,top,C,no_arxiv,5
2016,RecSys,"Efficient Bayesian Methods for Graph-based Recommendation.",UFMG,Ramon Lopes; Renato Assunção; Rodrygo L. T. Santos,https://doi.org/10.1145/2959100.2959132,null,C,no_arxiv,2
2016,SDM,": Fast and Scalable Subspace Clustering for Multidimensional Data Streams.",ICMC/USP,Afonso Expedito Da Silva; Lucas L. Sanches; Antonio C. Fraideinberze; Robson L. F. Cordeiro,https://doi.org/10.1137/1.9781611974348.40,null,C,no_arxiv,0
2016,SDM,"Speeding Up All-Pairwise Dynamic Time Warping Matrix Calculation.",ICMC/USP,Diego Furtado Silva; Gustavo E. A. P. A. Batista,https://doi.org/10.1137/1.9781611974348.94,null,C,no_arxiv,12
2015,ACM TKDD,"Universal and Distinct Properties of Communication Dynamics: How to Generate Realistic Inter-event Times.",UFMG,Pedro O. S. Vaz de Melo; Christos Faloutsos; Renato Assunção; Rodrigo Alves; Antonio A. F. Loureiro,https://doi.org/10.1145/2700399,top,J,no_arxiv,2
2015,Data Min. Knowl. Discov.,"Learning sequential classifiers from long and noisy discrete-event sequences efficiently.",UFMG,Gessé Dafé; Adriano Veloso; Mohammed J. Zaki; Wagner Meira Jr.,https://doi.org/10.1007/s10618-014-0391-9,null,J,no_arxiv,2
2015,ECML/PKDD,"Versatile Decision Trees for Learning Over Multiple Contexts.",UFPE,Reem Al-Otaibi; Ricardo B. C. Prudêncio; Meelis Kull; Peter A. Flach,https://doi.org/10.1007/978-3-319-23528-8_12,null,C,no_arxiv,2
2015,IEEE TKDE,"A Practical and Effective Sampling Selection Strategy for Large Scale Deduplication.",UFMG; UFRGS,Guilherme Dal Bianco; Renata Galante; Marcos André Gonçalves; Sérgio D. Canuto; Carlos Alberto Heuser,https://doi.org/10.1109/TKDE.2015.2416734,top,J,no_arxiv,5
2015,IEEE TKDE,"Evaluation of Multiclass Novelty Detection Algorithms for Data Streams.",ICMC/USP; UFU,Elaine Ribeiro de Faria; Isabel Ribeiro Goncalves; João Gama; André Carlos Ponce de Leon Ferreira de Carvalho,https://doi.org/10.1109/TKDE.2015.2441713,top,J,no_arxiv,6
2015,IEEE TKDE,"Removing DUST Using Multiple Alignment of Sequences.",UFAM,Kaio Wagner Lima Rodrigues; Marco Cristo; Edleno Silva de Moura; Altigran Soares da Silva,https://doi.org/10.1109/TKDE.2015.2407354,top,J,no_arxiv,1
2015,IEEE TKDE,"SERIMI: Class-Based Matching for Instance Matching Across Heterogeneous Datasets.",PUC-Rio,Samur Araújo; Duc Thanh Tran; Arjen P. de Vries; Daniel Schwabe,https://doi.org/10.1109/TKDE.2014.2365779,top,J,no_arxiv,9
