2016,Data & Knowl. Eng.,"Corrigendum to Ontological anti-patterns: Empirically uncovered error-prone structures in ontology-driven conceptual models [Data Knowl. Eng 99 (September 2015) 72-104].",UFES,Tiago Prince Sales; Giancarlo Guizzardi,https://doi.org/10.1016/j.datak.2015.11.001,null,J,no_arxiv,0
2016,Data & Knowl. Eng.,"Detecting avoidance behaviors between moving object trajectories.",UFSC,Francesco Lettich; Luis Otávio Alvares; Vania Bogorny; Salvatore Orlando 0001; Alessandra Raffaetà; Claudio Silvestri,https://doi.org/10.1016/j.datak.2015.12.003,null,J,no_arxiv,0
2016,Data & Knowl. Eng.,"LCA-based algorithms for efficiently processing multiple keyword queries over XML streams.",UFMG; UFAM,Evandrino G. Barros; Alberto H. F. Laender; Mirella M. Moro; Altigran Soares da Silva,https://doi.org/10.1016/j.datak.2016.03.001,null,J,no_arxiv,0
2016,EDOC,"Combining Network Measures and Expert Knowledge to Analyze Enterprise Architecture at the Component Level.",UFPE,Alixandre Santana; Daniel Simon; Kai Fischbach; Hermano P. de Moura,https://doi.org/10.1109/EDOC.2016.7579379,null,C,no_arxiv,0
2016,Inf. Systems,"Exploiting multimodal interactions in recommender systems with ensemble algorithms.",ICMC/USP,Arthur F. Da Costa; Marcelo G. Manzato,https://doi.org/10.1016/j.is.2015.09.007,null,J,no_arxiv,0
2016,Inf. Systems,"SNCStream: Extending a high quality true anytime data stream clustering algorithm.",PUC-PR,Jean Paul Barddal; Heitor Murilo Gomes; Fabrício Enembreck; Jean-Paul A. Barthès,https://doi.org/10.1016/j.is.2016.06.007,null,J,no_arxiv,0
2016,Proc. VLDB,"Cubrick: Indexing Millions of Records per Second for Interactive Analytics.",UFPR,Pedro Pedreira; Chris Croswhite; Luis Carlos Erpen De Bona,http://www.vldb.org/pvldb/vol9/p1305-pedreira.pdf,top,J,no_arxiv,0
2016,Proc. VLDB,"Database System Support of Simulation Data.",LNCC,Hermano Lustosa; Fábio Porto; Pablo Blanco; Patrick Valduriez,http://www.vldb.org/pvldb/vol9/p1329-lustosa.pdf,top,J,no_arxiv,0
2016,Trans. GIS,"Multidimensional Similarity Measuring for Semantic Trajectories.",UFSC,Andre Salvaro Furtado; Despina Kopanaki; Luis Otávio Alvares; Vania Bogorny,https://doi.org/10.1111/tgis.12156,null,J,no_arxiv,0
