2021,ICDE,"Multidimensional Adaptive & Progressive Indexes.",UFPR,Matheus Agio Nerone; Pedro Holanda; Eduardo Cunha de Almeida; Stefan Manegold,https://doi.org/10.1109/ICDE51399.2021.00060,top,C,no_arxiv,0
2021,Inf. Systems,"A DSL for WSN software components coordination.",UFMG; UFPR; UFRN,Marcos Aurélio Carrero; Martin A. Musicante; Aldri Luiz dos Santos; Carmem S. Hara,https://doi.org/10.1016/j.is.2019.101461,null,J,no_arxiv,0
2021,Inf. Systems,"A comprehensive analysis of delayed insertions in metric access methods.",UFU,Humberto Luiz Razente; Maria Camila Nardini Barioni; Régis Michel dos Santos Sousa,https://doi.org/10.1016/j.is.2020.101492,null,J,no_arxiv,0
2021,Inf. Systems,"A survey on graph-based methods for similarity searches in metric spaces.",UEL,Larissa Capobianco Shimomura; Rafael Seidi Oyamada; Marcos R. Vieira; Daniel S. Kaster,https://doi.org/10.1016/j.is.2020.101507,null,J,no_arxiv,0
2021,Inf. Systems,"Cause vs. effect in context-sensitive prediction of business process instances.",UNIRIO,Jens Brunk; Matthias Stierle; Leon Papke; Kate Revoredo; Martin Matzner; Jörg Becker 0001,https://doi.org/10.1016/j.is.2020.101635,null,J,no_arxiv,0
2021,Inf. Systems,"Characterizing client usage patterns and service demand for car-sharing systems.",UFJF; UFMG,Victor A. Alencar; Felipe Rooke; Michele Cocca; Luca Vassio; Jussara Marques de Almeida; Alex Borges Vieira,https://doi.org/10.1016/j.is.2019.101448,null,J,no_arxiv,0
2021,Inf. Systems,"Points of Interest recommendations: Methods, evaluation, and future directions.",UFMG; UFSJ,Heitor Werneck; Nícollas Silva; Matheus Carvalho Viana; Adriano C. M. Pereira; Fernando Mourão; Leonardo Rocha 0001,https://doi.org/10.1016/j.is.2021.101789,null,J,no_arxiv,0
2021,Inf. Systems,"Service contract modeling in Enterprise Architecture: An ontology-based approach.",UFES,Cristine Griffo; João Paulo A. Almeida; Giancarlo Guizzardi; Julio Cesar Nardi,https://doi.org/10.1016/j.is.2019.101454,null,J,no_arxiv,0
2021,Inf. Systems,"Speed prediction in large and dynamic traffic sensor networks.",UFC,Regis Pires Magalhães; Francesco Lettich; José Antônio Fernandes de Macêdo; Franco Maria Nardini; Raffaele Perego 0001; Chiara Renso; Roberto Trani,https://doi.org/10.1016/j.is.2019.101444,null,J,no_arxiv,0
2021,Inf. Systems,"Towards holistic Entity Linking: Survey and directions.",UFSC,Italo Lopes Oliveira; Renato Fileto; René Speck; Luís Paulo F. Garcia; Diego Moussallem; Jens Lehmann 0001,https://doi.org/10.1016/j.is.2020.101624,null,J,no_arxiv,0
2021,Trans. GIS,"A proposal to minimize the cost of processing big geospatial data in public cloud providers.",UnB,João Bachiega Jr.; Maristela Holanda; Aleteia P. F. Araujo,https://doi.org/10.1111/tgis.12754,null,J,no_arxiv,0
2020,ACM TOIS,"OutdoorSent: Sentiment Analysis of Urban Outdoor Images by Using Semantic and Deep Features.",UTFPR,Wyverson Bonasoli de Oliveira; Leyza Baldo Dorini; Rodrigo Minetto; Thiago Henrique Silva,https://doi.org/10.1145/3385186,top,J,http://arxiv.org/abs/1906.02331v4,0
2020,CAiSE,"Aspect Term Extraction Using Deep Learning Model with Minimal Feature Engineering.",UFC,Felipe Zschornack Rodrigues Saraiva; Ticiana Linhares Coelho da Silva; José Antônio Fernandes de Macêdo,https://doi.org/10.1007/978-3-030-49435-3_12,null,C,no_arxiv,0
2020,CAiSE,"Mutation Operators for Large Scale Data Processing Programs in Spark.",DCC/UFRJ; UFRN,João Batista de Souza Neto; Anamaria Martins Moreira; Genoveva Vargas-Solar; Martin Alejandro Musicante,https://doi.org/10.1007/978-3-030-49435-3_30,null,C,no_arxiv,0
2020,CAiSE,"Query-Based Metrics for Evaluating and Comparing Document Schemas.",UFPR,Evandro Miguel Kuszera; Letícia M. Peres; Marcos Didonet Del Fabro,https://doi.org/10.1007/978-3-030-49435-3_33,null,C,no_arxiv,0
2020,Data & Knowl. Eng.,"An analysis of the collaboration network of the International Conference on Conceptual Modeling at the Age of 40.",UFMG; UFRGS,Lucas Henrique C. Lima; Alberto H. F. Laender; Mirella M. Moro; José Palazzo M. de Oliveira,https://doi.org/10.1016/j.datak.2020.101866,null,J,no_arxiv,0
2020,ER,"A Core Ontology for Economic Exchanges.",UFES,Daniele Porello; Giancarlo Guizzardi; Tiago Prince Sales; Glenda C. M. Amaral,https://doi.org/10.1007/978-3-030-62522-1_27,null,C,no_arxiv,0
2020,ER,"Ontology-Based Modeling and Analysis of Trustworthiness Requirements: Preliminary Results.",UFES,Glenda C. M. Amaral; Renata S. S. Guizzardi; Giancarlo Guizzardi; John Mylopoulos,https://doi.org/10.1007/978-3-030-62522-1_25,null,C,no_arxiv,0
2020,ER,"Towards an Ontology Network on Human-Computer Interaction.",UFES,Simone Dornelas Costa; Monalessa Perini Barcellos; Ricardo de Almeida Falbo; Murillo Vasconcelos Henriques Bittencourt Castro,https://doi.org/10.1007/978-3-030-62522-1_24,null,C,no_arxiv,0
2020,ER,"Transformation of Ontology-Based Conceptual Models into Relational Schemas.",UFES,Gustavo L. Guidoni; João Paulo A. Almeida; Giancarlo Guizzardi,https://doi.org/10.1007/978-3-030-62522-1_23,null,C,no_arxiv,0
2020,ER,"Upper-Level Types of Occurrent Based on the Principle of Ontological Conservation.",UFRGS,Fabrício Henrique Rodrigues; Joel Luís Carbonera; Mara Abel,https://doi.org/10.1007/978-3-030-62522-1_26,null,C,no_arxiv,0
2020,GeoInformatica,"JS4Geo: a canonical JSON Schema for geographic data suitable to NoSQL databases.",UFSC,Angelo Augusto Frozza; Ronaldo dos Santos Mello,https://doi.org/10.1007/s10707-020-00415-w,null,J,no_arxiv,0
2020,Inf. Systems,"Bitmap filter: Speeding up exact set similarity joins with bitwise operations.",UnB; UFMG,Edans F. de O. Sandes; George Luiz Medeiros Teodoro; Alba C. M. A. Melo,https://doi.org/10.1016/j.is.2019.101449,null,J,http://arxiv.org/abs/1711.07295v1,0
2020,Inf. Systems,"Eras: Improving the quality control in the annotation process for Natural Language Processing tasks.",PUC-Rio,Jonatas S. Grosman; Pedro Henrique Thompson Furtado; Ariane M. B. Rodrigues; Guilherme G. Schardong; Simone D. J. Barbosa; Hélio Côrtes Vieira Lopes,https://doi.org/10.1016/j.is.2020.101553,null,J,no_arxiv,0
2020,Inf. Systems,"Exploiting semantic relationships for unsupervised expansion of sentiment lexicons.",UFSJ; UFMG,Felipe Viegas; Mário S. Alvim; Sérgio D. Canuto; Thierson Rosa; Marcos André Gonçalves; Leonardo Rocha 0001,https://doi.org/10.1016/j.is.2020.101606,null,J,no_arxiv,0
2020,Inf. Systems,"XChange: A semantic diff approach for XML documents.",UFF; PUC-Rio,Alessandreia Marta de Oliveira; Troy C. Kohwalter; Marcos Kalinowski; Leonardo Murta 0001; Vanessa Braganholo,https://doi.org/10.1016/j.is.2020.101610,null,J,no_arxiv,0
2020,Proc. VLDB,"Local Dampening: Differential Privacy for Non-numeric Queries via Local Sensitivity.",UFC,Victor A. E. de Farias; Felipe T. Brito; Cheryl Flynn; Javam C. Machado; Subhabrata Majumdar; Divesh Srivastava,http://www.vldb.org/pvldb/vol14/p521-farias.pdf,top,J,no_arxiv,0
2020,Proc. VLDB,"ODIN: Automated Drift Detection and Recovery in Video Analytics.",IME/USP,Abhijit Suprem; Joy Arulraj; Calton Pu; João Eduardo Ferreira,http://www.vldb.org/pvldb/vol13/p2453-suprem.pdf,top,J,http://arxiv.org/abs/2009.05440v1,0
2020,Proc. VLDB,"RECEIPT: REfine CoarsE-grained IndePendent Tasks for Parallel Tip decomposition of Bipartite Graphs.",PUC-RS,Kartik Lakhotia; Rajgopal Kannan; Viktor K. Prasanna; César A. F. De Rose,http://www.vldb.org/pvldb/vol14/p404-lakhotia.pdf,top,J,no_arxiv,0
2019,ACM TOIS,"Risk-Sensitive Learning to Rank with Evolutionary Multi-Objective Feature Selection.",UFMG; UFG,Daniel Xavier de Sousa; Sérgio D. Canuto; Marcos André Gonçalves; Thierson Couto Rosa; Wellington Santos Martins,https://doi.org/10.1145/3300196,top,J,no_arxiv,0
2019,CAiSE,"A Pattern Language for Value Modeling in ArchiMate.",UFES,Tiago Prince Sales; Ben Roelens; Geert Poels; Giancarlo Guizzardi; Nicola Guarino; John Mylopoulos,https://doi.org/10.1007/978-3-030-21290-2_15,null,C,no_arxiv,0
2019,CAiSE,"Fifty Shades of Green: How Informative is a Compliant Process Trace?",UFES,Andrea Burattin; Giancarlo Guizzardi; Fabrizio Maria Maggi; Marco Montali,https://doi.org/10.1007/978-3-030-21290-2_38,null,C,no_arxiv,0
2019,EDBT,"Modeling and Building IoT Data Platforms with Actor-Oriented Databases.",UNICAMP,Yiwen Wang 0007; Júlio César dos Reis; Kasper Myrtue Borggren; Marcos Antonio Vaz Salles; Claudia Bauzer Medeiros; Yongluan Zhou,https://doi.org/10.5441/002/edbt.2019.47,null,C,no_arxiv,0
2019,EDOC,"A Reference Model for Digital Transformation and Innovation.",UNIRIO,Silvia Bogea Gomes; Flávia Maria Santoro; Miguel Mira da Silva; Maria-Eugenia Iacob,https://doi.org/10.1109/EDOC.2019.00013,null,C,no_arxiv,0
2019,EDOC,"A Service-Oriented Architecture for Generating Sound Process Descriptions.",UFRGS,Thanner Soares Silva; Diego Toralles Avila; Jean Ampos Flesch; Sarajane Marques Peres; Jan Mendling; Lucinéia Heloisa Thom,https://doi.org/10.1109/EDOC.2019.00011,null,C,no_arxiv,0
2019,EDOC,"An Ontology-Based Diagnosis of Mainstream Service Modeling Languages.",UFES,Julio Cesar Nardi; João Paulo A. Almeida; Paulo Henrique A. da Silva; Giancarlo Guizzardi,https://doi.org/10.1109/EDOC.2019.00023,null,C,no_arxiv,0
2019,EDOC,"Foundational Choices in Enterprise Architecture: The Case of Capability in Defense Frameworks.",UFES,Gabriel M. Miranda; João Paulo A. Almeida; Giancarlo Guizzardi; Carlos L. B. Azevedo,https://doi.org/10.1109/EDOC.2019.00014,null,C,no_arxiv,0
2019,ER,"An Ontological Perspective for Database Tuning Heuristics.",PUC-Rio; UNIRIO,Ana Carolina Almeida; Maria Luiza Machado Campos; Fernanda Araújo Baião; Sérgio Lifschitz; Rafael Pereira de Oliveira; Daniel Schwabe,https://doi.org/10.1007/978-3-030-33223-5_20,null,C,no_arxiv,0
2019,ER,"Decision-Making in Knowledge-intensive Processes: The Case of Value Ascription and Goal Processing.",UNIRIO,Pedro H. Piccoli Richetti; Fernanda Araujo Baião; Maria Luiza Machado Campos,https://doi.org/10.1007/978-3-030-33223-5_30,null,C,no_arxiv,0
2019,ER,"Don't Tune Twice: Reusing Tuning Setups for SQL-on-Hadoop Queries.",UFPR,Edson Ramiro Lucas Filho; Eduardo Cunha de Almeida; Stefanie Scherzinger,https://doi.org/10.1007/978-3-030-33223-5_9,null,C,no_arxiv,0
2019,ER,"Events as Entities in Ontology-Driven Conceptual Modeling.",UFES,João Paulo A. Almeida; Ricardo de Almeida Falbo; Giancarlo Guizzardi,https://doi.org/10.1007/978-3-030-33223-5_39,null,C,no_arxiv,0
2019,ER,"OOC-O: A Reference Ontology on Object-Oriented Code.",UFES,Camila Zacché de Aguiar; Ricardo de Almeida Falbo; Vítor E. Silva Souza,https://doi.org/10.1007/978-3-030-33223-5_3,null,C,no_arxiv,0
2019,ER,"Relations in Ontology-Driven Conceptual Modeling.",UFES,Claudenir M. Fonseca; Daniele Porello; Giancarlo Guizzardi; João Paulo A. Almeida; Nicola Guarino,https://doi.org/10.1007/978-3-030-33223-5_4,null,C,no_arxiv,0
2019,ER,"What Rocks Are Made of: Towards an Ontological Pattern for Material Constitution in the Geological Domain.",UFRGS,Luan Fonseca Garcia; Joel Luis Carbonera; Fabrício Henrique Rodrigues; Cauã Antunes; Mara Abel,https://doi.org/10.1007/978-3-030-33223-5_23,null,C,no_arxiv,0
2019,Inf. Systems,"A generic and efficient framework for flash-aware spatial indexing.",ICMC/USP; UFSCar,Anderson Chaves Carniel; Ricardo Rodrigues Ciferri; Cristina Dutra de Aguiar Ciferri,https://doi.org/10.1016/j.is.2018.09.004,null,J,no_arxiv,0
2019,Inf. Systems,"Boosting decision stumps for dynamic feature selection on data streams.",PUC-PR,Jean Paul Barddal; Fabrício Enembreck; Heitor Murilo Gomes; Albert Bifet; Bernhard Pfahringer,https://doi.org/10.1016/j.is.2019.02.003,null,J,no_arxiv,0
2019,Inf. Systems,"Combining different metadata views for better recommendation accuracy.",ICMC/USP,Rafael Martins D'Addio; Ronnie S. Marinho; Marcelo G. Manzato,https://doi.org/10.1016/j.is.2019.01.008,null,J,no_arxiv,0
2019,Inf. Systems,"Comparing traditional conceptual modeling with ontology-driven conceptual modeling: An empirical study.",UFES,Michaël Verdonck; Frederik Gailly; Robert Pergl; Giancarlo Guizzardi; Beatriz Franco Martins; Oscar Pastor 0001,https://doi.org/10.1016/j.is.2018.11.009,null,J,no_arxiv,0
2019,Inf. Systems,"Querying on large and complex databases by content: Challenges on variety and veracity regarding real applications.",ICMC/USP,Agma J. M. Traina; Safia Brinis; Glauco Vitor Pedrosa; Letricia P. S. Avalhais; Caetano Traina Jr.,https://doi.org/10.1016/j.is.2019.03.012,null,J,no_arxiv,0
2019,Inf. Systems,"The Pure Cold-Start Problem: A deep study about how to conquer first-time users in recommendations domains.",UFMG; UFSJ,Nícollas Silva; Diego Carvalho 0002; Adriano C. M. Pereira; Fernando Mourão; Leonardo Rocha 0001,https://doi.org/10.1016/j.is.2018.09.001,null,J,no_arxiv,0
2019,Inf. Systems,"The similarity-aware relational division database operator with case studies in agriculture and genetics.",ICMC/USP,André S. Gonzaga; Robson L. F. Cordeiro,https://doi.org/10.1016/j.is.2019.01.002,null,J,no_arxiv,0
2019,Proc. VLDB,"COVIZ: A System for Visual Formation and Exploration of Patient Cohorts.",UFRGS,Cícero A. L. Pahins; Behrooz Omidvar-Tehrani; Sihem Amer-Yahia; Valérie Siroux; Jean Louis Pépin; Jean-Christian Borel; João Comba,http://www.vldb.org/pvldb/vol12/p1822-pahins.pdf,top,J,no_arxiv,0
2019,Proc. VLDB,"Database Processing-in-Memory: An Experimental Study.",UFPR,Tiago Rodrigo Kepe; Eduardo Cunha de Almeida; Marco A. Z. Alves,http://www.vldb.org/pvldb/vol13/p334-kepe.pdf,top,J,no_arxiv,0
2019,Proc. VLDB,"Discovery of Approximate (and Exact) Denial Constraints.",UFPR,Eduardo H. M. Pena; Eduardo Cunha de Almeida; Felix Naumann,http://www.vldb.org/pvldb/vol13/p266-pena.pdf,top,J,no_arxiv,0
2019,SIGMOD,"Fractal: A General-Purpose Graph Pattern Mining System.",UFMG,Vinícius Vitor dos Santos Dias; Carlos H. C. Teixeira; Dorgival O. Guedes; Wagner Meira Jr.; Srinivasan Parthasarathy 0001,https://doi.org/10.1145/3299869.3319875,top,C,no_arxiv,0
2019,Trans. GIS,"MASTER: A multiple aspect view on trajectories.",UFSC,Ronaldo dos Santos Mello; Vania Bogorny; Luis Otávio Alvares; Luiz Henrique Zambom Santana; Carlos Andres Ferrero; Angelo Augusto Frozza; Geomar Andre Schreiner; Chiara Renso,https://doi.org/10.1111/tgis.12526,null,J,no_arxiv,0
2019,Trans. GIS,"Multi-temporal transport network models for accessibility studies.",UFMG,Diego Bogado Tomasiello; Mariana A. Giannotti; Renato Arbex; Clodoveu A. Davis Jr.,https://doi.org/10.1111/tgis.12513,null,J,no_arxiv,0
2019,Trans. GIS,"Towards semantic-aware multiple-aspect trajectory similarity measuring.",UFSC,Lucas May Petry; Carlos Andres Ferrero; Luis Otávio Alvares; Chiara Renso; Vania Bogorny,https://doi.org/10.1111/tgis.12542,null,J,no_arxiv,0
2018,ACM TOIS,"Explicit Diversification of Event Aspects for Temporal Summarization.",UFMG,Richard McCreadie; Rodrygo L. T. Santos; Craig Macdonald; Iadh Ounis,https://doi.org/10.1145/3158671,top,J,no_arxiv,0
2018,Data & Knowl. Eng.,"A branch and bound strategy for Fast Trajectory Similarity Measuring.",UFSC,Andre Salvaro Furtado; Laércio Lima Pilla; Vania Bogorny,https://doi.org/10.1016/j.datak.2018.01.003,null,J,no_arxiv,0
2018,Data & Knowl. Eng.,"Domain content querying using ontology-based context-awareness in information systems.",UFRGS,Vinícius Maran; Alencar Machado; Guilherme Medeiros Machado; Iara Augustin; José Palazzo M. de Oliveira,https://doi.org/10.1016/j.datak.2018.03.003,null,J,no_arxiv,0
2018,Data & Knowl. Eng.,"Full-fledged semantic indexing and querying model designed for seamless integration in legacy RDBMS.",ICMC/USP,Joe Tekli; Richard Chbeir; Agma J. M. Traina; Caetano Traina; Kokou Yétongnon; Carlos Raymundo Ibañez; Marc Al Assad; Christian Kallas,https://doi.org/10.1016/j.datak.2018.07.007,null,J,no_arxiv,0
2018,Data & Knowl. Eng.,"The Merkurion approach for similarity searching optimization in Database Management Systems.",ICMC/USP; UEL,Marcos V. N. Bedo; Daniel S. Kaster; Agma J. M. Traina; Caetano Traina Jr.,https://doi.org/10.1016/j.datak.2017.09.003,null,J,no_arxiv,0
2018,EDOC,"Ontological Analysis and Redesign of Risk Modeling in ArchiMate.",UNIRIO; UFES,Tiago Prince Sales; João Paulo Andrade Almeida; Sebastiano Santini; Fernanda Araujo Baião; Giancarlo Guizzardi,https://doi.org/10.1109/EDOC.2018.00028,null,C,no_arxiv,0
2018,ER,"Conceptual Modeling of Legal Relations.",UFES,Cristine Griffo; João Paulo A. Almeida; Giancarlo Guizzardi,https://doi.org/10.1007/978-3-030-00847-5_14,null,C,no_arxiv,0
2018,ER,"Endurant Types in Ontology-Driven Conceptual Modeling: Towards OntoUML 2.0.",UFES,Giancarlo Guizzardi; Claudenir M. Fonseca; Alessander Botti Benevides; João Paulo A. Almeida; Daniele Porello; Tiago Prince Sales,https://doi.org/10.1007/978-3-030-00847-5_12,null,C,no_arxiv,0
2018,ER,"Multi-level Conceptual Modeling: From a Formal Theory to a Well-Founded Language.",UFES,Claudenir M. Fonseca; João Paulo A. Almeida; Giancarlo Guizzardi; Victorio Albani de Carvalho,https://doi.org/10.1007/978-3-030-00847-5_29,null,C,no_arxiv,0
2018,ER,"Reification and Truthmaking Patterns.",UFES,Nicola Guarino; Tiago Prince Sales; Giancarlo Guizzardi,https://doi.org/10.1007/978-3-030-00847-5_13,null,C,no_arxiv,0
2018,ER,"The Common Ontology of Value and Risk.",UNIRIO; UFES,Tiago Prince Sales; Fernanda Araujo Baião; Giancarlo Guizzardi; João Paulo A. Almeida; Nicola Guarino; John Mylopoulos,https://doi.org/10.1007/978-3-030-00847-5_11,null,C,no_arxiv,0
2018,ER,"Towards an Ontology of Software Defects, Errors and Failures.",UFES,Bruno Borlini Duarte; Ricardo de Almeida Falbo; Giancarlo Guizzardi; Renata S. S. Guizzardi; Vítor E. Silva Souza,https://doi.org/10.1007/978-3-030-00847-5_25,null,C,no_arxiv,0
2018,GeoInformatica,"Strategies for combining Twitter users geo-location methods.",UFMG,Sílvio S. Ribeiro Jr.; Gisele L. Pappa,https://doi.org/10.1007/s10707-017-0296-z,null,J,no_arxiv,0
2018,ICDE,"An Elastic Multi-Core Allocation Mechanism for Database Systems.",UFPR,Simone Dominico; Eduardo Cunha de Almeida; Jorge Augusto Meira; Marco Antonio Zanata Alves,https://doi.org/10.1109/ICDE.2018.00050,top,C,no_arxiv,0
2018,Inf. Systems,"An efficient similarity-based approach for comparing XML documents.",UFF; PUC-Rio,Alessandreia Marta de Oliveira; Gabriel Tessarolli; Gleiph Ghiotto; Bruno Pinto; Fernando Campello; Matheus Marques; Carlos Roberto Carvalho Oliveira; Igor Rodrigues; Marcos Kalinowski; Uéverton S. Souza; Leonardo Murta 0001; Vanessa Braganholo,https://doi.org/10.1016/j.is.2018.07.001,null,J,no_arxiv,0
2018,Inf. Systems,"BLOSS: Effective meta-blocking with almost no effort.",UFMG,Guilherme Dal Bianco; Marcos André Gonçalves; Denio Duarte,https://doi.org/10.1016/j.is.2018.02.005,null,J,no_arxiv,0
2018,Inf. Systems,"Improving random forests by neighborhood projection for effective text classification.",UFSJ; UFMG,Thiago Salles; Marcos André Gonçalves; Victor Rodrigues; Leonardo Rocha 0001,https://doi.org/10.1016/j.is.2018.05.006,null,J,no_arxiv,0
2018,Inf. Systems,"VazaDengue: An information system for preventing and combating mosquito-borne diseases with social networks.",PUC-Rio,Leonardo da Silva Sousa; Rafael Maiani de Mello; Diego Cedrim; Alessandro Garcia 0001; Paolo Missier; Anderson G. Uchôa; Anderson Oliveira; Alexander B. Romanovsky,https://doi.org/10.1016/j.is.2018.02.003,null,J,no_arxiv,0
2018,Proc. VLDB,"DfAnalyzer: Runtime Dataflow Analysis of Scientific Applications using Provenance.",UFF; COPPE/UFRJ,Vítor Silva 0003; Daniel de Oliveira 0001; Marta Mattoso; Patrick Valduriez,http://www.vldb.org/pvldb/vol11/p2082-sousa.pdf,top,J,no_arxiv,0
2018,Proc. VLDB,"Information and Data Management at PUC-Rio and UFMG.",PUC-Rio; UFMG,Antonio L. Furtado; Nivio Ziviani,http://www.vldb.org/pvldb/vol11/p2114-furtado.pdf,top,J,no_arxiv,0
2018,Proc. VLDB,"Scalable and Efficient Data Analytics and Mining with Lemonade.",UFMG,Walter Santos; Gustavo de P. Avelar; Manoel Horta Ribeiro; Dorgival O. Guedes; Wagner Meira Jr.,http://www.vldb.org/pvldb/vol11/p2070-santos.pdf,top,J,no_arxiv,0
2018,SIGMOD,"Big Data Linkage for Product Specification Pages.",UFPE,Disheng Qiu; Luciano Barbosa; Valter Crescenzi; Paolo Merialdo; Divesh Srivastava,https://doi.org/10.1145/3183713.3183757,top,C,no_arxiv,0
2017,BPM,"Analysis of Knowledge-Intensive Processes Focused on the Communication Perspective.",UNIRIO,Pedro H. Piccoli Richetti; João Carlos de A. R. Gonçalves; Fernanda Araujo Baião; Flávia Maria Santoro,https://doi.org/10.1007/978-3-319-65000-5_16,null,C,no_arxiv,0
2017,BPM,"Uncovering the Hidden Co-evolution in the Work History of Software Projects.",UNIRIO,Saimir Bala; Kate Revoredo; João Carlos de A. R. Gonçalves; Fernanda Araujo Baião; Jan Mendling; Flávia Maria Santoro,https://doi.org/10.1007/978-3-319-65000-5_10,null,C,no_arxiv,0
2017,CAiSE,"Searching Linked Data with a Twist of Serendipity.",PUC-Rio; DCC/UFRJ; UFF,Jeronimo S. A. Eichler; Marco A. Casanova; Antonio L. Furtado; Lívia Ruback; Luiz André P. Paes Leme; Giseli Rabello Lopes; Bernardo Pereira Nunes; Alessandra Raffaetà; Chiara Renso,https://doi.org/10.1007/978-3-319-59536-8_31,null,C,no_arxiv,0
2017,Data & Knowl. Eng.,"From reference ontologies to ontology patterns and back.",UFES,Fabiano Borges Ruy; Giancarlo Guizzardi; Ricardo de Almeida Falbo; Cássio Chaves Reginato; Victor Amorim dos Santos,https://doi.org/10.1016/j.datak.2017.03.004,null,J,no_arxiv,0
2017,Data & Knowl. Eng.,"Multi-level ontology-based conceptual modeling.",UFES,Victorio Albani de Carvalho; João Paulo A. Almeida; Claudenir M. Fonseca; Giancarlo Guizzardi,https://doi.org/10.1016/j.datak.2017.03.002,null,J,no_arxiv,0
2017,Data & Knowl. Eng.,"Planning runtime software adaptation through pragmatic goal model.",IME/USP; UnB,Felipe Pontes Guimarães; Genaína Nunes Rodrigues; Raian Ali; Daniel Macêdo Batista,https://doi.org/10.1016/j.datak.2017.03.003,null,J,no_arxiv,0
2017,EDBT,"RDF Keyword-based Query Technology Meets a Real-World Dataset.",PUC-Rio,Grettel García; Yenier Izquierdo; Elisa Menendez; Frederic Dartayre; Marco A. Casanova,https://doi.org/10.5441/002/edbt.2017.86,null,C,no_arxiv,0
2017,EDOC,"An Ontological Analysis of Value Propositions.",UFES,Tiago Prince Sales; Nicola Guarino; Giancarlo Guizzardi; John Mylopoulos,https://doi.org/10.1109/EDOC.2017.32,null,C,no_arxiv,0
2017,EDOC,"From an Ontology of Service Contracts to Contract Modeling in Enterprise Architecture.",UFES,Cristine Griffo; João Paulo A. Almeida; Giancarlo Guizzardi; Julio Cesar Nardi,https://doi.org/10.1109/EDOC.2017.15,null,C,no_arxiv,0
2017,EDOC,"Network Science Applied to Enterprise Architecture Analysis: Towards the Foundational Concepts.",UFPE,Alixandre Santana; Aline Souza; Daniel Simon; Kai Fischbach; Hermano Perrelli de Moura,https://doi.org/10.1109/EDOC.2017.12,null,C,no_arxiv,0
2017,ER,"A Comprehensive Formal Theory for Multi-level Conceptual Modeling.",UFES,João Paulo A. Almeida; Claudenir M. Fonseca; Victorio Albani de Carvalho,https://doi.org/10.1007/978-3-319-69904-2_23,null,C,no_arxiv,0
2017,Inf. Systems,"A Two-Stage Machine learning approach for temporally-robust text classification.",UFSJ; UFMG,Thiago Salles; Leonardo Rocha 0001; Fernando Mourão; Marcos André Gonçalves; Felipe Viegas; Wagner Meira Jr.,https://doi.org/10.1016/j.is.2017.04.004,null,J,no_arxiv,0
2017,Inf. Systems,"A large-scale study of cultural differences using urban data about eating and drinking preferences.",UFMG; UTFPR,Thiago Henrique Silva; Pedro O. S. Vaz de Melo; Jussara M. Almeida; Mirco Musolesi; Antonio A. F. Loureiro,https://doi.org/10.1016/j.is.2017.10.002,null,J,no_arxiv,0
2017,Inf. Systems,"An on-line algorithm for cluster detection of mobile nodes through complex event processing.",PUC-Rio,Marcos Roriz; Markus Endler; Francisco José da Silva e Silva,https://doi.org/10.1016/j.is.2015.12.003,null,J,no_arxiv,0
2017,Inf. Systems,"CLAP, ACIR and SCOOP: Novel techniques for improving the performance of dynamic Metric Access Methods.",ICMC/USP; UEL,Paulo H. Oliveira; Caetano Traina Jr.; Daniel S. Kaster,https://doi.org/10.1016/j.is.2017.10.003,null,J,no_arxiv,0
2017,Inf. Systems,"What surprises does your past have for you?",UFSJ; UFMG,Fernando Mourão; Leonardo Rocha 0001; Camila Souza Araujo; Wagner Meira Jr.; Joseph A. Konstan,https://doi.org/10.1016/j.is.2017.08.001,null,J,no_arxiv,0
2017,Proc. VLDB,"noWorkflow: a Tool for Collecting, Analyzing, and Managing Provenance from Python Scripts.",UFF,João Felipe Pimentel; Leonardo Murta 0001; Vanessa Braganholo; Juliana Freire,http://www.vldb.org/pvldb/vol10/p1841-pimentel.pdf,top,J,no_arxiv,0
2017,Sci. of Comput. Program.,"An ontology-based approach for integrating tools supporting the software measurement process.",UFES,Vinícius S. Fonseca; Monalessa Perini Barcellos; Ricardo de Almeida Falbo,https://doi.org/10.1016/j.scico.2016.10.004,null,J,no_arxiv,0
2017,Trans. GIS,"Reference data enhancement for geographic information retrieval using linked data.",UFMG,Tiago H. V. M. Moura; Clodoveu A. Davis Jr.; Frederico T. Fonseca,https://doi.org/10.1111/tgis.12238,null,J,no_arxiv,0
2016,BPM,"Ontological Considerations About the Representation of Events and Endurants in Business Models.",UFES,Giancarlo Guizzardi; Nicola Guarino; João Paulo A. Almeida,https://doi.org/10.1007/978-3-319-45348-4_2,null,C,no_arxiv,0
2016,CAiSE,"Engineering Requirements with Desiree: An Empirical Evaluation.",UFES,Feng-Lin Li; Jennifer Horkoff; Lin Liu 0001; Alexander Borgida; Giancarlo Guizzardi; John Mylopoulos,https://doi.org/10.1007/978-3-319-39696-5_14,null,C,no_arxiv,0
2016,CAiSE,"Using a Well-Founded Multi-level Theory to Support the Analysis and Representation of the Powertype Pattern in Conceptual Modeling.",UFES,Victorio Albani de Carvalho; João Paulo A. Almeida; Giancarlo Guizzardi,https://doi.org/10.1007/978-3-319-39696-5_19,null,C,no_arxiv,0
