2018,CCGrid,"A Machine Learning Auditing Model for Detection of Multi-Tenancy Issues Within Tenant Domain.",PUC-PR,Cleverton Vicentini; Altair Olivo Santin; Eduardo Viegas; Vilmar Abreu,https://doi.org/10.1109/CCGRID.2018.00081,null,C,no_arxiv,0
2018,CLOUD,"A Prediction Approach to Define Checkpoint Intervals in Spot Instances.",UnB,Jose Pergentino A. Neto; Donald M. Pianto; Célia Ghedini Ralha,https://doi.org/10.1007/978-3-319-94295-7_6,null,C,no_arxiv,0
2018,CLOUD,"Dynamic Selecting Approach for Multi-cloud Providers.",UFC,Juliana Oliveira de Carvalho; Dario Vieira; Fernando Trinta,https://doi.org/10.1007/978-3-319-94295-7_3,null,C,no_arxiv,0
2018,DSN,"Byzantine Fault-Tolerant Atomic Multicast.",PUC-RS,Paulo R. Coelho; Tarcisio Ceolin Junior; Alysson Bessani; Fernando Luís Dotti; Fernando Pedone,https://doi.org/10.1109/DSN.2018.00017,null,C,no_arxiv,0
2018,PerCom,"Sprinkler: A probabilistic dissemination protocol to provide fluid user interaction in multi-device ecosystems.",UFG,Adrien Luxey; Yérom-David Bromberg; Fábio M. Costa; Vinicius Lima; Ricardo Couto Antunes da Rocha; François Taïani,https://doi.org/10.1109/PERCOM.2018.8444577,null,C,no_arxiv,0
2018,SPE,"An asynchronous collaborative reconciliation model based on data provenance.",UFPR; ICMC/USP; UFSCar,Dayse Silveira de Almeida; Carmem Satie Hara; Ricardo Rodrigues Ciferri; Cristina Dutra de Aguiar Ciferri,https://doi.org/10.1002/spe.2506,null,J,no_arxiv,0
2017,CCGrid,"Multi-dimensional admission control and capacity planning for IaaS clouds with multiple service classes.",UFCG,Marcus Carvalho; Francisco Vilar Brasileiro; Raquel Vigolvino Lopes; Giovanni Farias; Alessandro Fook; João Mafra; Daniel Turull,https://doi.org/10.1109/CCGRID.2017.14,null,C,no_arxiv,0
2017,CCGrid,"PRIVAaaS: privacy approach for a distributed cloud-based data analytics platforms.",UFMG,Tânia Basso; Regina Moraes; Nuno Antunes; Marco Vieira; Walter Santos; Wagner Meira Jr.,https://doi.org/10.1109/CCGRID.2017.136,null,C,no_arxiv,1
2017,CLOUD,"A Robust Scheduler for Workflow Ensembles under Uncertainties of Available Bandwidth.",UNICAMP,Thiago Augusto Lopes Genez; Luiz Fernando Bittencourt; Rizos Sakellariou; Edmundo Roberto Mauro Madeira,https://doi.org/10.1109/CLOUD.2017.70,null,C,no_arxiv,0
2017,CloudCom,"DynSGX: A Privacy Preserving Toolset for Dinamically Loading Functions into Intel(R) SGX Enclaves.",UFCG,Rodolfo Silva; Pedro Barbosa; Andrey Brito,https://doi.org/10.1109/CloudCom.2017.42,null,C,no_arxiv,0
2017,CloudCom,"On the Efficiency Gains of Using Disaggregated Hardware to Build Warehouse-Scale Clusters.",UFCG,Giovanni Farias; Francisco Vilar Brasileiro; Raquel Vigolvino Lopes; Marcus Carvalho; Fabio Jorge Almeida Morais; Daniel Turull,https://doi.org/10.1109/CloudCom.2017.19,null,C,no_arxiv,0
2017,ICDCS,"A Framework for Enabling Security Services Collaboration Across Multiple Domains.",POLI/USP,Daniel Migault; Marcos A. Simplício Jr.; Bruno M. Barros; Makan Pourzandi; Thiago R. M. Almeida; Ewerton R. Andrade; Tereza Cristina M. B. Carvalho,https://doi.org/10.1109/ICDCS.2017.67,near-top,C,no_arxiv,1
2017,ICDCS,"High Performance Recovery for Parallel State Machine Replication.",PUC-RS,Odorico Machado Mendizabal; Fernando Luís Dotti; Fernando Pedone,https://doi.org/10.1109/ICDCS.2017.193,near-top,C,no_arxiv,1
2017,ICDCS,"Model-Driven Domain-Specific Middleware.",UFG; IME/USP,Fábio M. Costa; Karl A. Morris; Fabio Kon; Peter J. Clarke,https://doi.org/10.1109/ICDCS.2017.197,near-top,C,no_arxiv,1
2017,JSS,"A multivariate and quantitative model for predicting cross-application interference in virtual environments.",UFF,Maicon Melo Alves; Lúcia Maria de Assumpção Drummond,https://doi.org/10.1016/j.jss.2017.04.001,null,J,no_arxiv,0
2017,JSS,"Modeling and automatic code generation for wireless sensor network applications using model-driven or business process approaches: A systematic mapping study.",DCC/UFRJ,Sergio Teixeira; Bruno Alves Agrizzi; José Gonçalves Pereira Filho; Silvana Rossetto; Roquemar de Lima Baldam,https://doi.org/10.1016/j.jss.2017.06.024,null,J,no_arxiv,0
2017,SPE,"Multi-criteria IoT resource discovery: a comparative analysis.",ICMC/USP,Luiz Henrique Nunes; Júlio Cezar Estrella; Charith Perera; Stephan Reiff-Marganiec; Alexandre Cláudio Botazzo Delbem,https://doi.org/10.1002/spe.2469,null,J,no_arxiv,1
2017,SPE,"Pattern-based multi-cloud architecture migration.",UNIFOR,Pooyan Jamshidi; Claus Pahl; Nabor C. Mendonça,https://doi.org/10.1002/spe.2442,null,J,no_arxiv,11
2017,SRDS,"Reconfiguring Parallel State Machine Replication.",UnB; PUC-RS,Eduardo Alchieri; Fernando Luís Dotti; Odorico Machado Mendizabal; Fernando Pedone,https://doi.org/10.1109/SRDS.2017.23,null,C,no_arxiv,2
2017,UCC,"Secure and Privacy-Aware Data Dissemination for Cloud-Based Applications.",UFCG,Lilia Sampaio; Fábio Silva; Amanda Souza; Andrey Brito; Pascal Felber,http://doi.acm.org/10.1145/3147213.3147230,null,C,no_arxiv,0
2016,CCGrid,"Automatic Communication Optimization of Parallel Applications in Public Clouds.",UFRGS,Emmanuell D. Carreño; Matthias Diener; Eduardo H. M. Cruz; Philippe O. A. Navaux,https://doi.org/10.1109/CCGrid.2016.59,null,C,no_arxiv,2
2016,CCGrid,"Faster: A Low Overhead Framework for Massive Data Analysis.",UFMG,Matheus Santos; Wagner Meira Jr.; Dorgival O. Guedes; Virgílio A. F. Almeida,https://doi.org/10.1109/CCGrid.2016.90,null,C,no_arxiv,0
2016,CCGrid,"Leveraging High Performance Computing for Bioinformatics: A Methodology that Enables a Reliable Decision-Making.",LNCC,Mariza Ferro; Marisa F. Nicolas; Quadalupe Del Rosario Q. Saji; Antonio Roberto Mury; Bruno Schulze,https://doi.org/10.1109/CCGrid.2016.69,null,C,no_arxiv,2
2016,CCGrid,"enerGyPU and enerGyPhi Monitor for Power Consumption and Performance Evaluation on Nvidia Tesla GPU and Intel Xeon Phi.",UFRGS,John A. Garcia H.; Esteban Hernandez B.; Carlos E. Montenegro; Philippe O. A. Navaux; Carlos Jaime Barrios Hernández,https://doi.org/10.1109/CCGrid.2016.100,null,C,no_arxiv,0
2016,CLOUD,"An Approach for Evaluating Cloud Application Topologies Based on TOSCA.",UNIFOR,Américo Sampaio; Tiago Rolim; Nabor C. Mendonça; Matheus Cunha,https://doi.org/10.1109/CLOUD.2016.0061,null,C,no_arxiv,0
2016,CloudCom,"Exploring Controlled RDF Distribution.",UFPR,Raqueline R. M. Penteado; Rebeca Schroeder; Carmem S. Hara,https://doi.org/10.1109/CloudCom.2016.0038,null,C,no_arxiv,4
2016,CloudCom,"Instance Type Selection in Proactive Horizontal Auto-Scaling.",UFCG,Fabio Jorge Almeida Morais; Raquel Vigolvino Lopes; Francisco Vilar Brasileiro,https://doi.org/10.1109/CloudCom.2016.0031,null,C,no_arxiv,0
2016,JSS,"Evaluating REST architectures - Approach, tooling and guidelines.",DCC/UFRJ,Bruno Costa 0003; Paulo F. Pires; Flávia Coimbra Delicato; Paulo Merson,https://doi.org/10.1016/j.jss.2015.09.039,null,J,no_arxiv,9
2016,JSS,"Using traffic filtering rules and OpenFlow devices for transparent flow switching and automatic dynamic-circuit creation in hybrid networks.",COPPE/UFRJ,Kleber Vieira Cardoso; Sand Luz Correa; José Ferreira de Rezende; Bruno Soares da Silva; Micael O. M. C. de Mello; Mario Augusto da Cruz,https://doi.org/10.1016/j.jss.2016.02.019,null,J,no_arxiv,1
2016,UCC,"A flexible scheduler for workflow ensembles.",UNICAMP,Thiago A. L. Genez; Luiz F. Bittencourt; Rizos Sakellariou; Edmundo R. M. Madeira,http://doi.acm.org/10.1145/2996890.2996910,null,C,no_arxiv,1
2015,CCGrid,"A Multi-GPU Hitting Set Algorithm for GRNs Inference.",UFABC; IME/USP,Danilo Carastan-Santos; Raphael Yokoingawa de Camargo; David Correa Martins; Siang Wun Song; Luiz Carlos Silva Rozante; Fabrizio Ferreira Borelli,https://doi.org/10.1109/CCGrid.2015.29,null,C,no_arxiv,1
2015,CLOUD,"Automating Resource Selection and Configuration in Inter-clouds through a Software Product Line Method.",UnB; UNB,Alessandro Ferreira Leite; Vander Alves; Genaína Nunes Rodrigues; Claude Tadonki; Christine Eisenbeis; Alba Cristina Magalhaes Alves de Melo,https://doi.org/10.1109/CLOUD.2015.101,null,C,no_arxiv,6
2015,CLOUD,"Cloud Query Manager: Using Semantic Web Concepts to Avoid IaaS Cloud Lock-In.",UFRN,Arthur Souza; Nélio Cacho; Thaís Batista; Frederico Lopes,https://doi.org/10.1109/CLOUD.2015.98,null,C,no_arxiv,1
2015,CLOUD,"Performance Inference: A Novel Approach for Planning the Capacity of IaaS Cloud Applications.",UNIFOR,Marcelo Gonçalves; Matheus Cunha; Nabor C. Mendonça; Américo Sampaio,https://doi.org/10.1109/CLOUD.2015.112,null,C,no_arxiv,2
2015,CloudCom,"Prediction-Based Admission Control for IaaS Clouds with Multiple Service Classes.",UFCG,Marcus Carvalho; Daniel A. Menascé; Francisco Vilar Brasileiro,https://doi.org/10.1109/CloudCom.2015.16,null,C,no_arxiv,3
2015,DSN,"User-Constraint and Self-Adaptive Fault Tolerance for Event Stream Processing Systems.",UFCG,André Martin; Tiaraju Smaneoto; Tobias Dietze; Andrey Brito; Christof Fetzer,https://doi.org/10.1109/DSN.2015.56,null,C,no_arxiv,3
2015,IPSN,"SIoT: securing the internet of things through distributed system analysis.",UFMG,Fernando Augusto Teixeira; Gustavo V. Machado; Fernando Magno Quintão Pereira; Hao Chi Wong; José Marcos S. Nogueira; Leonardo B. Oliveira,http://doi.acm.org/10.1145/2737095.2737097,null,C,no_arxiv,8
2015,JSS,"A programming-level approach for elasticizing parallel scientific applications.",UFPR,Guilherme Galante; Luis Carlos Erpen De Bona,https://doi.org/10.1016/j.jss.2015.08.051,null,J,no_arxiv,5
2015,SPE,"On the replacement of objects from round-based applications over heterogeneous environments.",Unisinos,Rodrigo da Rosa Righi; Lucas Graebin; Cristiano André da Costa,https://doi.org/10.1002/spe.2253,null,J,no_arxiv,0
2015,SRDS,"Chasing the Tail of Atomic Broadcast Protocols.",UNICAMP,Daniel Cason; Parisa Jalili Marandi; Luiz Eduardo Buzato; Fernando Pedone,https://doi.org/10.1109/SRDS.2015.28,null,C,no_arxiv,0
2014,CCGrid,"A Branch-and-Bound Algorithm for Autonomic Adaptation of Multi-cloud Applications.",UFRN,André Almeida; Francisco Dantas; Everton Cavalcante; Thaís Vasconcelos Batista,https://doi.org/10.1109/CCGrid.2014.25,null,C,no_arxiv,12
2014,CCGrid,"A Storage Policy for a Hybrid Federated Cloud platform: A Case Study for Bioinformatics.",UnB,Deric Lima; Breno Moura; Gabriel S. S. de Oliveira; Edward de Oliveira Ribeiro; Aletéia Patrícia Favacho de Araújo; Maristela Holanda; Roberto C. Togawa; Maria Emilia Telles Walter,https://doi.org/10.1109/CCGrid.2014.102,null,C,no_arxiv,1
2014,CCGrid,"CUDAlign 3.0: Parallel Biological Sequence Comparison in Large GPU Clusters.",UnB,Edans F. de O. Sandes; Guillermo Miranda; Alba Cristina Magalhaes Alves de Melo; Xavier Martorell; Eduard Ayguadé,https://doi.org/10.1109/CCGrid.2014.18,null,C,no_arxiv,2
2014,CloudCom,"Prototyping an Autonomic Cloud Infrastructure to Manage Live Streaming Applications Using a Software Defined Network: Performance Analysis and Challenges.",UFPE,Moisés Rodrigues; Patricia Takako Endo; Jonatas Vitalino; Glauco Estacio Gonçalves; Djamel Sadok; Fetahi Wuhib,https://doi.org/10.1109/CloudCom.2014.97,null,C,no_arxiv,0
2014,DSN,"Adaptive Low-Power Architecture for High-Performance and Reliable Embedded Computing.",UFRGS,Ronaldo Rodrigues Ferreira; Jean da Rolt; Gabriel L. Nazar; Álvaro Freitas Moreira; Luigi Carro,https://doi.org/10.1109/DSN.2014.56,null,C,no_arxiv,2
2014,DSN,"Impact of GPUs Parallelism Management on Safety-Critical and HPC Applications Reliability.",UFSC; UFRGS,Paolo Rech; Laércio Lima Pilla; Philippe Olivier Alexandre Navaux; Luigi Carro,https://doi.org/10.1109/DSN.2014.49,null,C,no_arxiv,23
2014,DSN,"State Machine Replication for the Masses with BFT-SMART.",UnB,Alysson Neves Bessani; João Sousa; Eduardo Adílio Pelinson Alchieri,https://doi.org/10.1109/DSN.2014.43,null,C,no_arxiv,47
2014,JSS,"Synthesizing interpreted domain-specific models to manage smart microgrids.",UFG,Mark Allison; Karl A. Morris; Fábio M. Costa; Peter J. Clarke,https://doi.org/10.1016/j.jss.2014.06.006,null,J,no_arxiv,6
2014,UCC,"Reducing Costs in Cloud Application Execution Using Redundancy-Based Scheduling.",UNICAMP,Cristiano C. A. Vieira; Luiz F. Bittencourt; Edmundo R. M. Madeira,https://doi.org/10.1109/UCC.2014.20,null,C,no_arxiv,3
2013,CCGrid,"Autoflex: Service Agnostic Auto-scaling Framework for IaaS Deployment Models.",UFCG,Fabio Jorge Almeida Morais; Francisco Vilar Brasileiro; Raquel Vigolvino Lopes; Ricardo Araújo Santos; Wade Satterfield; Leandro Rosa,https://doi.org/10.1109/CCGrid.2013.74,null,C,no_arxiv,15
2013,ICDCS,"Optimistic Atomic Multicast.",UFRGS,Carlos Eduardo Benevides Bezerra; Fernando Pedone; Benoît Garbinato; Cláudio F. R. Geyer,https://doi.org/10.1109/ICDCS.2013.46,near-top,C,no_arxiv,2
2013,JSS,"Group and link analysis of multi-relational scientific social networks.",COPPE/UFRJ; UFJF,Victor Ströele A. Menezes; Geraldo Zimbrão; Jano M. Souza,https://doi.org/10.1016/j.jss.2013.02.024,null,J,no_arxiv,21
2013,SPE,"EMUSIM: an integrated emulation and simulation environment for modeling, evaluation, and validation of performance of Cloud computing applications.",PUC-RS,Rodrigo N. Calheiros; Marco Aurélio Stelmar Netto; César A. F. De Rose; Rajkumar Buyya,https://doi.org/10.1002/spe.2124,null,J,no_arxiv,28
2013,SPE,"Fault-tolerant timestamp-based two-phase commit protocol for RESTful services.",ITA,Luiz Alexandre Hiane da Silva Maciel; Celso Massaki Hirata,https://doi.org/10.1002/spe.2151,null,J,no_arxiv,0
2013,SRDS,"Consensus with Unknown Participants in Shared Memory.",UFBA,Catia Khouri; Fabíola Greve; Sébastien Tixeuil,https://doi.org/10.1109/SRDS.2013.14,null,C,no_arxiv,1
