2015,EJOR,"A speed and departure time optimization algorithm for the pollution-routing problem.",COPPE/UFRJ,Raphael Kramer; Nelson Maculan; Anand Subramanian; Thibaut Vidal,https://doi.org/10.1016/j.ejor.2015.06.037,null,J,no_arxiv,20
2015,EJOR,"Characterization of the split closure via geometric lifting.",PUC-Rio,Amitabh Basu; Marco Molinaro,https://doi.org/10.1016/j.ejor.2014.12.018,null,J,http://arxiv.org/abs/1701.06679v1,0
2015,EJOR,"Exact approaches for lifetime maximization in connectivity constrained wireless multi-role sensor networks.",UNESP,Fabian Castaño; Eric Bourreau; Nubia Velasco; André Rossi; Marc Sevaux,https://doi.org/10.1016/j.ejor.2014.08.013,null,J,no_arxiv,13
2015,EJOR,"Optimality cuts and a branch-and-cut algorithm for the K-rooted mini-max spanning forest problem.",UFMG,Alexandre Salles da Cunha; Luidi Simonetti; Abilio Lucena,https://doi.org/10.1016/j.ejor.2015.05.001,null,J,no_arxiv,0
2015,ITOR,"A biased random-key genetic algorithm for single-round divisible load scheduling.",UFF; UFMG,Julliany S. Brandão; Thiago F. Noronha; Mauricio G. C. Resende; Celso C. Ribeiro,https://doi.org/10.1111/itor.12178,null,J,no_arxiv,7
2015,ITOR,"A dynamic programming based local search approach for the double traveling salesman problem with multiple stacks.",UFMG,Sebastián Urrutia; Anolan Milanés; Arne Løkketangen,https://doi.org/10.1111/itor.12053,null,J,no_arxiv,5
2015,ITOR,"Heuristics and matheuristics for a real-life machine reassignment problem.",UFMG,Ramon Lopes; Vinicius W. C. Morais; Thiago F. Noronha; Vitor A. A. Souza,https://doi.org/10.1111/itor.12063,null,J,no_arxiv,10
2015,J Comb Opt,"Scheduling with task replication on desktop grids: theoretical and experimental analysis.",UNICAMP,Eduardo C. Xavier; Robson R. S. Peixoto; Jefferson L. M. da Silveira,https://doi.org/10.1007/s10878-013-9650-8,null,J,no_arxiv,0
2015,J Heuristics,"A multiple neighborhood search for dynamic memory allocation in embedded systems.",UNESP,María Soto; André Rossi; Marc Sevaux,https://doi.org/10.1007/s10732-015-9297-y,null,J,no_arxiv,1
2015,J Heuristics,"A relax-and-fix with fix-and-optimize heuristic applied to multi-level lot-sizing problems.",ICMC/USP; UNESP,Claudio Fabiano Motta Toledo; Márcio da Silva Arantes; Marcelo Yukio Bressan Hossomi; Paulo Morelato França; Kerem Akartunali,https://doi.org/10.1007/s10732-015-9295-0,null,J,no_arxiv,12
2015,Math Program,"A systematic approach to bound factor-revealing LPs and its application to the metric and squared metric facility location problems.",IME/USP; UNICAMP,Cristina G. Fernandes; Luis A. A. Meira; Flávio Keidi Miyazawa; Lehilton L. C. Pedrosa,https://doi.org/10.1007/s10107-014-0821-x,null,J,no_arxiv,4
2015,Math Program,"Approximating polyhedra with sparse inequalities.",PUC-Rio,Santanu S. Dey; Marco Molinaro; Qianyi Wang,https://doi.org/10.1007/s10107-015-0925-y,null,J,no_arxiv,4
2015,Math Program,"Packing in generalized kernel systems: a framework that generalizes packing of branchings.",IME/USP,Mario Leston Rey; Yoshiko Wakabayashi,https://doi.org/10.1007/s10107-014-0746-4,null,J,no_arxiv,2
2015,Num Linear Alg,"An efficient approach to solve very large dense linear systems with verified computing on clusters.",UFRGS,Mariana Luderitz Kolberg; Gerd Bohlender; Luiz Gustavo Fernandes,https://doi.org/10.1002/nla.1950,null,J,no_arxiv,0
2014, Opt Letters,"A MILP model for an extended version of the Flexible Job Shop Problem.",IME/USP,Ernesto G. Birgin; Paulo Feofiloff; Cristina G. Fernandes; Everton L. de Melo; Marcio T. I. Oshiro; Débora P. Ronconi,https://doi.org/10.1007/s11590-013-0669-7,null,J,http://arxiv.org/abs/1401.3654v1,8
2014, Opt Letters,"An edge-swap heuristic for generating spanning trees with minimum number of branch vertices.",UFMG,Ricardo M. A. Silva; Diego M. Silva; Mauricio G. C. Resende; Geraldo R. Mateus; José Fernando Gonçalves; Paola Festa,https://doi.org/10.1007/s11590-013-0665-y,null,J,no_arxiv,8
2014, Opt Letters,"Market neutral portfolios.",UFMG,Cristiano Arbex Valle; Nigel Meade; John E. Beasley,https://doi.org/10.1007/s11590-013-0714-6,null,J,no_arxiv,0
2014, Opt Letters,"Memetic self-adaptive evolution strategies applied to the maximum diversity problem.",UFOP,Alan R. R. de Freitas; Frederico Gadelha Guimarães; Rodrigo César Pedrosa Silva; Marcone Jamilson Freitas Souza,https://doi.org/10.1007/s11590-013-0610-0,null,J,no_arxiv,9
2014, Opt Letters,"On the Weber facility location problem with limited distances and side constraints.",UERN,Isaac F. Fernandes; Daniel Aloise; Dario J. Aloise; Pierre Hansen; Leo Liberti,https://doi.org/10.1007/s11590-012-0538-9,null,J,no_arxiv,4
2014,Annals OR,"Algorithmic aspects of Steiner convexity and enumeration of Steiner trees.",UFF; DCC/UFRJ,Mitre Costa Dourado; Rodolfo Alves de Oliveira; Fábio Protti,https://doi.org/10.1007/s10479-014-1607-5,null,J,no_arxiv,0
2014,Annals OR,"Order and static stability into the strip packing problem.",UNICAMP,Thiago Alves de Queiroz; Flávio Keidi Miyazawa,https://doi.org/10.1007/s10479-014-1634-2,null,J,no_arxiv,5
2014,Annals OR,"Restricted coloring problems on Graphs with few P 4's.",UFC,Cláudia Linhares Sales; Ana Karolinna Maia; Nícolas A. Martins; Rudini Menezes Sampaio,https://doi.org/10.1007/s10479-014-1537-2,null,J,no_arxiv,1
2014,Computers & OR,"A column generation approach to extend lifetime in wireless sensor networks with coverage and connectivity constraints.",UNESP,Fabian Castaño; André Rossi; Marc Sevaux; Nubia Velasco,https://doi.org/10.1016/j.cor.2013.11.001,null,J,no_arxiv,13
2014,Computers & OR,"A fix-and-optimize heuristic for the high school timetabling problem.",UFRGS,Árton P. Dorneles; Olinto César Bassi de Araújo; Luciana S. Buriol,https://doi.org/10.1016/j.cor.2014.06.023,null,J,no_arxiv,18
2014,Computers & OR,"A genetic algorithm/mathematical programming approach to solve a two-level soft drink production problem.",ICMC/USP; UNESP,Claudio Fabiano Motta Toledo; Lucas de Oliveira; Rodrigo de Freitas Pereira; Paulo Morelato França; Reinaldo Morabito,https://doi.org/10.1016/j.cor.2014.02.012,null,J,no_arxiv,16
2014,Computers & OR,"A redistricting problem applied to meter reading in power distribution networks.",UNESP,Laura Silva de Assis; Paulo Morelato França; Fabio Luiz Usberti,https://doi.org/10.1016/j.cor.2013.08.002,null,J,no_arxiv,13
2014,Computers & OR,"Multi-objective metaheuristic algorithms for the resource-constrained project scheduling problem with precedence relations.",UFOP,Helton Cristiano Gomes; Francisco de Assis das Neves; Marcone Jamilson Freitas Souza,https://doi.org/10.1016/j.cor.2013.11.002,null,J,no_arxiv,11
2014,EJOR,"Branch-and-price algorithm for the Resilient Multi-level Hop-constrained Network Design.",UFMG,Fernanda S. H. Souza; Michel Gendreau; Geraldo Robson Mateus,https://doi.org/10.1016/j.ejor.2013.08.024,null,J,no_arxiv,0
2014,EJOR,"Efficient elementary and restricted non-elementary route pricing.",PUC-Rio,Rafael Martinelli; Diego Pecin; Marcus Poggi,https://doi.org/10.1016/j.ejor.2014.05.005,null,J,no_arxiv,16
2014,EJOR,"Improved bounds for the traveling umpire problem: A stronger formulation and a relax-and-fix heuristic.",UNICAMP,Lucas de Oliveira; Cid C. de Souza; Tallys H. Yunes,https://doi.org/10.1016/j.ejor.2013.12.019,null,J,no_arxiv,9
2014,EJOR,"The one-dimensional cutting stock problem with usable leftovers - A survey.",UNIFESP,Adriana Cristina Cherri; Marcos Nereu Arenales; Horacio Hideki Yanasse; Kelly Cristina Poldi; Andréa Carla Gonçalves Vianna,https://doi.org/10.1016/j.ejor.2013.11.026,null,J,no_arxiv,15
2014,INFORMS J Compt,"Benders Decomposition, Branch-and-Cut, and Hybrid Algorithms for the Minimum Connected Dominating Set Problem.",UFMG,Bernard Gendron; Abilio Lucena; Alexandre Salles da Cunha; Luidi Simonetti,https://doi.org/10.1287/ijoc.2013.0589,null,J,no_arxiv,26
2014,ITOR,"An evaluation of the bihyperbolic function in the optimization of the backpropagation algorithm.",COPPE/UFRJ,Geraldo Miguez; Adilson Elias Xavier; Nelson Maculan,https://doi.org/10.1111/itor.12072,null,J,no_arxiv,2
2014,ITOR,"Applying software engineering techniques in the development and management of linear and integer programming applications.",UFF,Fernando Costa; Leonardo Murta; Celso C. Ribeiro,https://doi.org/10.1111/itor.12123,null,J,no_arxiv,0
2014,J Global Opt,"A hyperbolic smoothing approach to the Multisource Weber problem.",COPPE/UFRJ,Vinicius Layter Xavier; Felipe M. G. França; Adilson Elias Xavier; Priscila M. V. Lima,https://doi.org/10.1007/s10898-014-0160-8,null,J,no_arxiv,2
2014,J Global Opt,"An integer linear programming formulation and heuristics for the minmax relative regret robust shortest path problem.",UFMG,Amadeu Almeida Coco; João Carlos Abreu Júnior; Thiago F. Noronha; Andréa Cynthia Santos,https://doi.org/10.1007/s10898-014-0187-x,null,J,no_arxiv,13
2014,J Global Opt,"Discretization orders for protein side chains.",COPPE/UFRJ,Virginia Costa; Antonio Mucherino; Carlile Lavor; Andrea Cassioli; Luiz Mariano Carvalho; Nelson Maculan,https://doi.org/10.1007/s10898-013-0135-1,null,J,no_arxiv,10
2014,J Global Opt,"Modeling and solving the bi-objective minimum diameter-cost spanning tree problem.",UERN,Andréa Cynthia Santos; Diego Rocha Lima; Dario José Aloise,https://doi.org/10.1007/s10898-013-0124-4,null,J,no_arxiv,3
2014,J Heuristics,"Adaptive and multi-mining versions of the DM-GRASP hybrid metaheuristic.",UFF,Alexandre Plastino; Hugo Barbalho; Luis Filipe M. Santos; Richard Fuchshuber; Simone L. Martins,https://doi.org/10.1007/s10732-013-9231-0,null,J,no_arxiv,7
2014,Math OR,"The Geometry of Online Packing Linear Programs.",PUC-Rio,Marco Molinaro; R. Ravi 0001,https://doi.org/10.1287/moor.2013.0612,null,J,no_arxiv,8
2013, Opt Letters,"Branch-and-price algorithms for the Two-Echelon Capacitated Vehicle Routing Problem.",UFMG,Fernando Afonso Santos; Alexandre Salles da Cunha; Geraldo Robson Mateus,https://doi.org/10.1007/s11590-012-0568-3,null,J,no_arxiv,19
2013, Opt Letters,"Branch-cut-and-price for the vehicle routing problem with simultaneous pickup and delivery.",UFF,Anand Subramanian; Eduardo Uchoa; Artur Alves Pessoa; Luiz Satoru Ochi,https://doi.org/10.1007/s11590-012-0570-9,null,J,no_arxiv,19
2013, Opt Letters,"Multiobjective vehicle routing problem with fixed delivery and optional collections.",UFVJM,Luciana P. Assis; André L. Maravilha; Alessandro Vivas; Felipe Campelo; Jaime A. Ramírez,https://doi.org/10.1007/s11590-012-0551-z,null,J,no_arxiv,8
2013, Opt Letters,"On swarm-level resource allocation in BitTorrent communities.",UFCG,Tamás Vinkó; Flavio Santos; Nazareno Andrade; Mihai Capota,https://doi.org/10.1007/s11590-012-0477-5,null,J,no_arxiv,3
2013,Annals OR,"Algorithmic and structural aspects of the P 3-Radon number.",COPPE/UFRJ; DCC/UFRJ; UFMG,Mitre Costa Dourado; Dieter Rautenbach; Vinícius Fernandes dos Santos; Philipp Matthias Schäfer; Jayme Luiz Szwarcfiter; Alexandre Toman,https://doi.org/10.1007/s10479-013-1320-9,null,J,no_arxiv,2
2013,Annals OR,"Cascading Knapsack Inequalities: reformulation of a crude oil distribution problem.",PUC-Rio,Roger Rocha; Ignacio E. Grossmann; Marcus Poggi de Aragão,https://doi.org/10.1007/s10479-011-0857-8,null,J,no_arxiv,10
2013,Comp Opt Appl,"A robust and efficient proposal for solving linear systems arising in interior-point methods for linear programming.",UNICAMP,María D. González-Lima; Aurelio R. L. Oliveira; Danilo E. Oliveira,https://doi.org/10.1007/s10589-013-9572-5,null,J,no_arxiv,4
2013,Computers & OR,"A hybrid GRASP heuristic to construct effective drawings of proportional symbol maps.",UNICAMP,Rafael G. Cano; Guilherme Kunigami; Cid C. de Souza; Pedro J. de Rezende,https://doi.org/10.1016/j.cor.2012.09.007,null,J,no_arxiv,5
2013,Computers & OR,"A hybrid Lagrangean heuristic with GRASP and path-relinking for set k-covering.",UFF,Luciana S. Pessoa; Mauricio G. C. Resende; Celso C. Ribeiro,https://doi.org/10.1016/j.cor.2011.11.018,null,J,no_arxiv,15
2013,Computers & OR,"A hybrid VNS approach for the short-term production planning and scheduling: A case study in the pulp and paper industry.",ICMC/USP,Gonçalo Figueira; Maristela Oliveira Santos; Bernardo Almada-Lobo,https://doi.org/10.1016/j.cor.2013.01.015,null,J,no_arxiv,15
2013,Computers & OR,"A hybrid algorithm for a class of vehicle routing problems.",UFF,Anand Subramanian; Eduardo Uchoa; Luiz Satoru Ochi,https://doi.org/10.1016/j.cor.2013.01.013,null,J,no_arxiv,69
2013,Computers & OR,"A hybrid data mining GRASP with path-relinking.",UFF,Hugo Barbalho; Isabel Rosseti; Simone L. Martins; Alexandre Plastino,https://doi.org/10.1016/j.cor.2012.02.022,null,J,no_arxiv,10
2013,Computers & OR,"A hybrid multi-population genetic algorithm applied to solve the multi-level capacitated lot sizing problem with backlogging.",ICMC/USP; UNESP,Claudio Fabiano Motta Toledo; Renato Resende Ribeiro de Oliveira; Paulo Morelato França,https://doi.org/10.1016/j.cor.2012.11.002,null,J,no_arxiv,28
2013,Computers & OR,"Community detection by modularity maximization using GRASP with path relinking.",UNIFESP,Mariá Cristina Vasconcelos Nascimento; Leonidas S. Pitsoulis,https://doi.org/10.1016/j.cor.2013.03.002,null,J,no_arxiv,21
2013,Computers & OR,"GRASP with evolutionary path-relinking for the capacitated arc routing problem.",UNESP,Fabio Luiz Usberti; Paulo Morelato França; André Luiz Morelato França,https://doi.org/10.1016/j.cor.2011.10.014,null,J,no_arxiv,16
2013,Computers & OR,"GRASP with path relinking for the symmetric Euclidean clustered traveling salesman problem.",UFF,Mário Mestria; Luiz Satoru Ochi; Simone de Lima Martins,https://doi.org/10.1016/j.cor.2012.10.001,null,J,no_arxiv,14
2013,Computers & OR,"Heuristics for the strip packing problem with unloading constraints.",UNICAMP,Jefferson L. M. da Silveira; Flávio Keidi Miyazawa; Eduardo C. Xavier,https://doi.org/10.1016/j.cor.2012.11.003,null,J,no_arxiv,9
2013,Computers & OR,"Improved bounds for large scale capacitated arc routing problem.",PUC-Rio,Rafael Martinelli; Marcus Poggi; Anand Subramanian,https://doi.org/10.1016/j.cor.2013.02.013,null,J,no_arxiv,19
2013,Computers & OR,"Single string planning problem arising in liner shipping industries: A heuristic approach.",COPPE/UFRJ,Shahin Gelareh; Rahimeh Neamatian Monemi; Philippe Mahey; Nelson Maculan; David Pisinger,https://doi.org/10.1016/j.cor.2013.03.018,null,J,no_arxiv,3
2013,EJOR,"Harvest planning in the Brazilian sugar cane industry via mixed integer programming.",PUC-Rio,Sanjay Dominik Jena; Marcus Poggi,https://doi.org/10.1016/j.ejor.2013.04.011,null,J,no_arxiv,17
2013,EJOR,"Improving an interior-point approach for large block-angular problems by hybrid preconditioners.",UNICAMP,Silvana Bocanegra; Jordi Castro; Aurelio R. L. Oliveira,https://doi.org/10.1016/j.ejor.2013.04.007,null,J,no_arxiv,5
2013,EJOR,"Iterative approaches for a dynamic memory allocation problem in embedded systems.",UNESP,María Soto; André Rossi; Marc Sevaux,https://doi.org/10.1016/j.ejor.2013.05.016,null,J,no_arxiv,2
2013,EJOR,"Lifetime maximization in wireless directional sensor network.",UNESP,André Rossi; Alok Singh 0001; Marc Sevaux,https://doi.org/10.1016/j.ejor.2013.05.033,null,J,no_arxiv,17
2013,EJOR,"Multi-start methods for combinatorial optimization.",UFF,Rafael Martí; Mauricio G. C. Resende; Celso C. Ribeiro,https://doi.org/10.1016/j.ejor.2012.10.012,null,J,no_arxiv,55
2013,INFORMS J Compt,"Efficient Transient Analysis of Markovian Models Using a Block Reduction Approach.",COPPE/UFRJ,Edmundo de Souza e Silva; Rosa M. M. Leão; Raymond A. Marie,https://doi.org/10.1287/ijoc.1120.0537,null,J,no_arxiv,1
2013,ITOR,"Probabilistic stopping rules for GRASP heuristics and extensions.",UFF,Celso C. Ribeiro; Isabel Rosseti; Reinaldo C. Souza,https://doi.org/10.1111/itor.12010,null,J,no_arxiv,4
2013,ITOR,"Semidefinite relaxation for linear programs with equilibrium constraints.",COPPE/UFRJ,Marcia H. C. Fampa; Wendel A. X. Melo; Nelson Maculan,https://doi.org/10.1111/j.1475-3995.2012.00869.x,null,J,no_arxiv,4
2013,ITOR,"The usable leftover one-dimensional cutting stock problem - a priority-in-use heuristic.",UNIFESP,Adriana Cristina Cherri; Marcos Nereu Arenales; Horacio Hideki Yanasse,https://doi.org/10.1111/j.1475-3995.2012.00868.x,null,J,no_arxiv,11
2013,J Heuristics,"An Iterated Local Search heuristic for the Heterogeneous Fleet Vehicle Routing Problem.",UFF; UFOP,Puca Huachi Vaz Penna; Anand Subramanian; Luiz Satoru Ochi,https://doi.org/10.1007/s10732-011-9186-y,null,J,no_arxiv,74
2013,Math Program,"A 3-Slope Theorem for the infinite relaxation in the plane.",PUC-Rio,Gérard Cornuéjols; Marco Molinaro,https://doi.org/10.1007/s10107-012-0562-7,null,J,no_arxiv,10
2013,Math Program,"Polyhedral results and a Branch-and-cut algorithm for the $$k$$ -cardinality tree problem.",UFMG,Luidi Simonetti; Alexandre Salles da Cunha; Abilio Lucena,https://doi.org/10.1007/s10107-012-0590-3,null,J,no_arxiv,2
2013,Math Program,"Unique lifting of integer variables in minimal inequalities.",UFC,Amitabh Basu; Manoel B. Campêlo; Michele Conforti; Gérard Cornuéjols; Giacomo Zambelli,https://doi.org/10.1007/s10107-012-0560-9,null,J,no_arxiv,8
2013,SIAM J Opt,"A (k+1)-Slope Theorem for the k-Dimensional Infinite Group Relaxation.",PUC-Rio,Amitabh Basu; Robert Hildebrand; Matthias Köppe; Marco Molinaro,https://doi.org/10.1137/110848608,null,J,http://arxiv.org/abs/1109.4184v1,17
